id,text
703,i just don't like that.
704,usually waiting to talk about.
705,i am close to receiving my english degree.
706,everything to enjoy.
707,he made a real big cake himself.
708,they're actually great for them.
709,it was for a murder trial.
710,are you a professional musician?
711,it's far beyond me.
712,we've been an awful lot from the space program.
713,two sets of grandparents.
714,i call and find out.
715,you want salary too but what?
716,i've heard about him.
717,we've had more freezing this winter.
718,if we can't get a handle on that.
719,they would vote for choice.
720,they were okay.
721,you find a button.
722,on a working farm.
723,after we had them for several years.
724,if they work at it a little bit.
725,we don't have enough.
726,what are you making?
727,absolutely nothing.
728,i had a carpet service call up there times.
729,although he's probably better than a lot of them.
730,just about any kind of music.
731,we like mexican food.
732,i know the day care centers are not cheap either.
733,i found it a lot of times.
734,they've got to find an even line.
735,i think he barely makes it.
736,where you got the boy?
737,it all starts to become similar.
738,i could go along with that.
739,it's like one second of recording.
740,that's a big thing with me.
741,i'm the only one.
742,i've been calling you on that.
743,if there starts to be a lot of violence all.
744,walking seems to be the best.
745,i don't think too many of them are anymore.
746,how do you feel about your game?
747,when i lived out in the country.
748,i'm steadily from being a.
749,to grow up and to do what they want to do.
750,we just keep stacks of it on paper.
751,i had friends.
752,i've worked in hotels.
753,they can pretty much get everybody there.
754,you can just say i'm sorry.
755,the changing weather up in it.
756,the summer courses did so much.
757,i don't have a lot of time.
758,i know they will.
759,sometimes they're not very urban.
760,we scored the bottom.
761,i make a lot of my christmas presents.
762,we were talking about that just the other day.
763,in the houston area.
764,i'm not counting on it.
765,i like to have somebody come with me.
766,was always kind of tough.
767,not sure that's something i want to do.
768,most of the stores will accept those.
769,that is pretty unusual.
770,that's what he grew up fastening to.
771,she'll be two in just.
772,i just that it's been any money.
773,the news or something.
774,i do have my radio going most of the day though.
775,a girl and a boy.
776,he has did a lot.
777,it's a little bit financial type thing.
778,an economic incentive for people to vote.
779,i'm guessing from that.
780,some are a sure thing in about four hours.
781,it's going to happen.
782,i only weighed seconds away.
783,horrible stuff like that.
784,an opera or the symphony or something.
785,if they don't have any living relatives.
786,i watched the news on despair.
787,a record of the trip songs of the eighties.
788,i do not have much to compare it to.
789,i don't read as much as i would like to either.
790,this was fresher than.
791,i want them to come back up next year.
792,did that when i was a kid.
793,things that are under state exception.
794,i was an independent.
795,i don't have a lot of time to do it.
796,and i'm up here.
797,i enjoy them coming.
798,but it has a pretty low crime rate.
799,big closet space.
800,they're welcome to go some place else.
801,i would offer.
802,we do a lot of things on the weekend together.
803,i've heard different.
804,we'd have to build less prisons.
805,a light reading.
806,well we just started.
807,we started taking her.
808,my mother and i were.
809,we are so busy.
810,i'd like to go bird hunting.
811,sometimes you have to ask them for that.
812,then do it all over again.
813,what do you think are some current trends?
814,about a second mind tricks.
815,do you watch star trek?
816,so you don't have to put it down.
817,i don't see much tv mostly when i'm in school.
818,they could probably come in and see.
819,i don't get too many of those.
820,that they do that be he went in or what.
821,i'm getting rid of this car.
822,i have three cats and a dog.
823,they don't need that seven day waiting period.
824,of course it's real convenient.
825,my husband and i both went.
826,you learn more about the skills and stuff.
827,just a little while to go on a shoot.
828,then we put our receipts in there.
829,where is it going to be?
830,fifty nine kilometers for children.
831,they need it early.
832,it couldn't be decided.
833,comical trivia to come.
834,which what i thought was a real entity question.
835,well that's about it really.
836,if i don't have a real with a burden on it.
837,you get a lot of sunfish.
838,i enjoy going to the beaches and to beach areas.
839,i guess i'm crucial to big tree country.
840,they are both remarried.
841,the high school i went to.
842,you have to think grandchildren.
843,you could do it.
844,he was treated like all the rest of students.
845,i don't think you anymore.
846,that's just not enough for a total.
847,one thing led to another.
848,do different parts of the country.
849,i didn't have any job anything to speak of.
850,it really helps those people.
851,put a cap in your version.
852,it's a pretty good size church.
853,camping for years in a motor home.
854,if you've only got a talking point there.
855,this time of the year.
856,it just has done a lot for people did.
857,they think it's kind of cool.
858,crime is too much.
859,i didn't know how my father did it.
860,lives on a farm for sixty years.
861,i look at something as a job also.
862,really kind of gone the rounds.
863,i never even knew that.
864,curling and chess.
865,the commercial district.
866,what's the difference there?
867,i like that kind of stuff.
868,they might as well.
869,savings and loans.
870,they plastered over detail.
871,all left right crap.
872,the same development.
873,on the outskirts of houston.
874,i forget how she got it.
875,your decision important.
876,getting back seats for the restraints.
877,if you have any tips whatsoever.
878,literary movies.
879,i can't remember where.
