id,text
701,siting of a waste.
702,sometimes it will stop.
703,i just don't like that.
704,usually getting to talk about.
705,i am close to receiving my angular degree.
706,everything to enjoy.
707,he made a real big take himself.
708,these actually great for them.
709,it was for a murder trial.
710,are you a professional musician?
711,it's far beyond me.
712,we've made an awful lot from the space program.
713,two sets of grandparents.
714,i call and find out.
715,you want quality to most what?
716,i've heard about him.
717,we've had more racing this winter.
718,if we can't get a handle on that.
719,they would vote for peace.
720,they were okay.
721,to find a band.
722,on a working farm.
723,after we had them for several years.
724,if they work at it a little bit.
725,we don't have enough.
726,what are you making?
727,absolutely nothing.
728,i had a corporate service call up there tom.
729,although he's probably better than a lot of them.
730,just about any kind of budget.
731,we like mexican food.
732,i know the day care centers are not cheap either.
733,i found it a lot of times.
734,you've got to find an even line.
735,i think he probably makes it.
736,well you got the boy.
737,it all starts to become simple.
738,i could go along with that.
739,it's like one second of recording.
740,that's a big thing with me.
741,i'm the only one.
742,i've been calling you on that.
743,if there starts to be a lot of violence all.
744,walking seems to be the best.
745,i don't think too many of them are anymore.
746,how do you feel about your game?
747,when i lived out in the country.
748,i'm generally from mn.
749,to grow up and to get what they want to do.
750,we just keep track of it on paper.
751,i had friends.
752,i've worked in hotels.
753,they can pretty much get everybody there.
754,you can just say i'm sorry.
755,the changing world up in it.
756,the arm warriors did so much.
757,i don't have a lot of time.
758,i know they will.
759,sometimes you're not very common.
760,we sort the problem.
761,i make a lot of my estimate precedents.
762,we were talking about that just the other day.
763,in the chosen area.
764,i'm not counting on it.
765,i like to have somebody come with me.
766,was always kind of tough.
767,not sure that's something i want to do.
768,most of the stores will except those.
769,that is pretty unusual.
770,that's what he grew up listening to.
771,she'll be two in july.
772,i just that it's been any money.
773,the news or something?
774,i do have my radio going most of the day though.
775,a girl and a boy.
776,we have heard a lot.
777,it's a little bit financial type thing.
778,an economic incentive for people to vote.
779,i'm guessing from that.
780,stumped for a sure thing in about four hours?
781,it's going to happen.
782,i only weigh seconds away.
783,horrible stuff like that.
784,an opera or the symphony or something?
785,if they don't have any living relatives.
786,i watched the news on display.
787,a record of the top songs of the eighties.
788,i do not have much to compare it to.
789,i don't read as much as i would like to either.
790,this was fresher than.
791,i want them to come back up next year.
792,news that when i was a kid.
793,things that are under state retrospection.
794,i was an independent.
795,i don't have a lot of time to do it.
796,when i'm up here.
797,i enjoy them coming.
798,but it is a pretty low crime rate.
799,big closet space.
800,he willed to go some place else.
801,i write software.
802,we do a lot of things on the weekends together.
803,i've heard different.
804,we have to build less prisons.
805,a light reading.
806,well we just started.
807,we started taking her.
808,my mother and i were.
809,we are so busy.
810,i'd like to go board untrusting.
811,sometimes you have to ask them for that.
812,then do it all over again.
813,what do you think are some current trends?
814,about a second bad tracks.
815,do you watch star trek?
816,no you don't have to put it down.
817,i don't see much tv mostly when i'm in school.
818,they could probably come in and see.
819,i don't get too many of those.
820,that they do that be he went in or want.
821,i'm getting rid of this car.
822,i have three cats and a dog.
823,they don't need that seven day waiting period.
824,of course it's really convenient.
825,my husband and i both went.
826,to learn more about the lectures and stuff.
827,just a little trail to go and a short.
828,then we put a receipt in there.
829,where is it going to be?
830,fifty nine kilometers for landing.
831,they did it early.
832,it shouldn't be decided.
833,capital services to come.
834,watch what i thought was a real endearing cutscene.
835,well that's about it really.
836,if i don't have a real with a burden on it.
837,you get a lot of conflicts.
838,i enjoy going to the beaches and to beach areas.
839,i guess i'm cruel to big scary country.
840,they are both remarried.
841,the high school i went to.
842,you have to think grandchildren.
843,you could do it.
844,he was treated like all the rest of students.
845,i don't think so anymore.
846,that's still not enough for a total.
847,one thing led to another.
848,your different parts of the country.
849,i didn't have any shop amenities to speak of.
850,it really helps those people.
851,put a cramp in your varying.
852,it's a pretty good size stick.
853,camping for years in a motor home.
854,if you've really got a talking post there.
855,this time of the year.
856,it just has an a lot very people did.
857,they think it's kind of cool.
858,some is too much.
859,i don't know how my brother did it.
860,live on a farm for tax years.
861,i look at something as a job all.
862,really kind of fun the rounds.
863,i never even knew that.
864,sealing and gas.
865,the commercial strict.
866,what's the difference there?
867,i like that kind of stuff.
868,we might as well.
869,pricing and loans.
870,they plastered over drywall.
871,all places what grape?
872,the prime development.
873,on the outskirts of person.
874,i worked hard to get it.
875,your parent reimbursement.
876,getting back seats for the base state.
877,if you have any puppets whatsoever.
878,literary movies.
879,i can't remember where.
