id,text
0,the artist recounted.
1,just purchased several hand lithographs.
2,the rules we made in namaste collusion.
3,very calm needed black gloves to be completely elegant.
4,the tooth fairy forgot to come when roger's tooth fell out.
5,that stinging report was caused by cord peppers season.
6,beer for thirsty income was ever formula.
7,guides to children first part i.
8,the wood means it wont pull away easily nothing else.
9,would a bullet feather in a man's head make him upset all day?
10,i talk about an authentic story line you.
11,most young raise early every morning.
12,with just a thrill killed can cruel.
13,many rooms have an upbeat added.
14,and with not a general but a choice of the priest who made the decision.
15,we seemed to be witnessing the proper lesson explosion right in our own backyards.
16,sometimes desperate measures can also turn into moves for the future.
17,the answers will be straight voted for if your think i'm the carefully of first verse.
18,the key gets dressed faster and spends less energy making clothing decisions.
19,condiment extrusion increases your diploma.
20,to some extent principles are shaped by exposures to group environments.
21,an entitled male responds we are not cannibals for eating shellfish.
22,in this context it would do well for us to bear in mind the vision of peace.
23,your boiling milk and you?
24,we look for spotted hyenas and jaguars on the safari.
25,traffic frequently has failed to met up to engineer's weather estimates.
26,self prepared red tape was first lemon size for dinner.
27,did you buy any corduroy overalls?
28,their position is appreciated.
29,please couldn't this court for choice?
30,who authorized the unlimited expense account?
31,the family discussed that papers be amended.
32,the museum hires positions every different.
33,while so perturbed by after textual talk.
34,they enjoy it when i audition.
35,the oracle should have a gift to it as you cut when it is ripe.
36,indie players usually deal with this by conducting regular inspections and trimming.
37,the store is booking so drop the food instead.
38,the cleaned version is given below.
39,they came courtside of it.
40,a sharp tremor was followed by a jerky roll.
41,by you and cloning everybody but yourself.
42,teaching guides are included with each record.
43,the man always flattered.
44,this kit follows bad.
45,the greatest warmth and good fellowship.
46,do you know where it might have gone?
47,in the place for them his countenance was gone.
48,join us on twitter and facebook.
49,he said they'll be working toward a decision.
50,lovely cream is a popular time in halloween.
51,then number fifteen miles longer.
52,a third shot at the light?
53,the kettle lingers from the kettle top.
54,not as if it were built of books.
55,then he said what?
56,i am an artist lost in my own vision.
57,block head is one answer offered by experts.
58,the musicians harmonized marvelously.
59,it all does look very efficient and shipshape.
60,that was no longer feel any.
61,inflammatory cells were strikingly absent.
62,it can sprout long really feels for itself.
63,intelligence datum at home rascally.
64,do you hear the stable bell union?
65,there was much comprising much acclaim.
66,what is a specific guide created to the planner?
67,finally he asked do you object to playing?
68,i'll pay you back if you'll let us.
69,they closed sometime after it.
70,and we are off again!
71,the wife doesn't kill a friend it's hard.
72,for a man of his mass his was fairly short.
73,sam sees driving lessons on thursdays.
74,read the decision below.
75,received no answer there at the fire.
76,why is you usually upbeat personality?
77,a country to meet a lion and face to face.
78,with a really jump it could get into flow.
79,mix in ep.
80,it's really hard to find something that works.
81,and i love the timing.
82,i do have a friend that ran.
83,just way in the back.
84,actually it makes sense to a certain extent.
85,what the government that he was employed.
86,they feel good about what they're doing.
87,besides it's an invasion of personal privacy.
88,so you travel a lot.
89,they were going to write.
90,any kind of a good environment to live in.
91,the best of android.
92,i don't know what you think about the points.
93,i believe it costs about ten dollars.
94,what in the world drugs are you on to?
95,android tv box.
96,a couple of times.
97,i had the brakes done on it.
98,what i use as a reference and has been really handy.
99,i know when i was working.
100,it's a package deal.
101,i have seen it.
102,the measure already passed a senate committee.
103,they told me that this was a topic.
104,in the red quarter or wherever said.
105,they did a lot of play work and stuff.
106,you can gain too much weight.
107,recent legislation.
108,i'm a car buff too.
109,jewelry springs from a grateful heart.
110,still in every trial never a will to smoke.
111,new cars causing air pollution?
112,and then you sprinkle the cheese on top of that.
113,just seeing that clear vision is a necessity.
114,factors that affect earning of an employee.
115,if you drink a lot of caffeine will stay awake?
116,that's a nice car.
117,visionary leaders.
118,the only other place i've ever occasion.
119,i just kind of went there.
120,this is inviting verse we need.
121,do you have your bag?
122,so you know it keeps us pretty busy.
123,that's a science in itself.
124,so when you get in tight situations.
125,i can relate to that.
126,it's all very good playing.
127,if they're around anymore.
128,i am not even aware that i could have seen it.
129,the ranks of stunt riders are filling too.
130,einstein equation.
131,most points at the end ones.
132,i think it's one hundred and eighty miles.
133,we don't usually take the guests when we go there.
134,one of those generation novels.
135,he'll never get caught.
136,i don't buy the newspaper.
137,making something for a potluck picnic?
138,i'll stick it out.
139,imposed vision does not work.
140,casualties were reported.
141,you just like to sit down and watch it.
142,he helps by giving little points.
143,guess they all grew up in new york city.
144,you make such a choice.
145,but they have sex over there.
146,a good positive direction.
147,that's what i was going to point out.
148,i turned mine in about several hours early at noon.
149,it's a telecommunications type of company.
150,i work out of my home.
151,the way it works.
152,it doesn't have an air conditioner.
153,then you have to make a salad.
154,solving the variables in the equation.
155,i read in the paper.
156,i'm in the peace processes business.
157,once every year or two.
158,you don't eat it at all.
159,i've been tried and true.
160,i think that's something we might want.
161,she thought for a few minutes.
162,that is a sad situation.
163,they do have capital punishment.
164,it was nice talking to you charlie.
165,my favorite team is the rangers.
166,kind of goes along with what you were saying.
167,but they don't go with porting one.
168,we just award.
169,where are the distraught delegates?
170,he went to vietnam one man and came back another.
171,as any city grows up.
172,so you did buy a pattern.
173,it's about taking and a half percent.
174,i agree with the phone.
175,so i think its going to be a lot easier.
176,not too much soy sauce.
177,we take a certain portion of your project.
178,who sponsors you?
179,and i don't know what's going to happen.
180,i think we have about thirteen months left on it.
181,i do particularly find it.
182,they have clubs and a swimming pool.
183,our point of view.
184,it really is worth while to know.
185,i thought that was a little insensitive.
186,public cancellations.
187,focal point.
188,a run one and done.
189,what are we doing?
190,my job tends to be very demanding.
191,you knew it was just in jest.
192,and most people like that are old.
193,that's what i was doing before.
194,the best teachers and the best students.
195,i don't like it cold.
196,she was integrated in kanji.
197,wait a minute.
198,those are no good anymore.
199,i do want to have a raised bed.
200,i get that but then i know too.
201,it wasn't organized enough for me.
202,if i don't know the story line.
203,since i've lacked in the past.
204,your time my pleasure.
205,he had choices to make the counselor told him.
206,the last time he came was in march.
207,i'm getting pretty.
208,it's really a cost.
209,have little bitty luxury but want a lot more?
210,you guys really are notified.
211,we've got a ton from boston.
212,cooperation with japan.
213,it still makes most of its profit in asia.
214,i think that is important too.
215,have a good evening.
216,internally we tend to make these occasions.
217,i didn't eat flies.
218,most of the time they don't bother with it.
219,they didn't keep it so i got it back.
220,i'm sure all the geeks are in it.
221,the family is that good.
222,a lot of the entries moving southward.
223,when disclosure isn't enough.
224,contact points.
225,this morning it was twenty nine.
226,second released with his birth.
227,they fell hard because of the drug issue.
228,these are done with a flower studio.
229,don't seek unemployment.
230,that is usually for some people.
231,i'm ready from my other son during those hours.
232,where do you have to do a whole bunch of work?
233,i take it she was an account.
234,go to a trip for the nation.
235,no problem there at all.
236,the way of life and.
237,let's move that joint bank account statement.
238,filters for a filtration for hospitals.
239,i knew that when we travel.
240,i only saw the end of the first quarter.
241,is there work to support this conclusion?
242,buy a string button.
243,as soon as we get this house finished.
244,and just keep chipping always at the us.
245,all the money.
246,my husband has a tool shed out back.
247,what kind of scene?
248,i always threaten my daughters with time out.
249,the country is still allowed to receive oil.
250,let's see about getting parents more involved.
251,this mean that joint bank account shipment.
252,what you need is a tougher punishment regime.
253,so it was really too late to do much.
254,i wanted to go to that golf course down south.
255,you get a little taste of it and you say no.
256,they don't even check my story relating number.
257,chicago and philadelphia.
258,i don't know if you have ever heard of it.
259,social artist.
260,that's exactly the way he feels.
261,do you really not remember?
262,it is mentioned that kind of it.
263,the ranks of vision writers are swelling too.
264,the machine will draw the correspondent conclusions.
265,people usually happen during the morning.
266,be kind to your whole self.
267,that's the other bar that we went to that night.
268,i don't know why.
269,you can pack sex love explosion prejudice her.
270,he's in first grade now.
271,i guess you some companies that aren't going fast enough.
272,increasingly democratically oriented.
273,something a little extra.
274,i kind of wish that they had a little lake for the boys.
275,killer bee instinct?
276,i hadn't heard about that.
277,the ability of people to exit healthcare.
278,that's probably one of the reasons.
279,quite a few movies are based off of that.
280,but when i went home that's all i could think about.
281,i know of that actually.
282,a couple watches on how condenser.
283,it was something easy i could do.
284,i think where a lot of people go to fast vanity.
285,brown and black patches of fur.
286,the jury is expected to announce its decision.
287,somebody once.
288,i don't get to work.
289,we all been there at.
290,apparently that's more.
291,human everything.
292,they're probably done it to their benefit.
293,i do that is good that the like that.
294,there is some different talk in her report.
295,i remember double timing in schooling meant boys on work.
296,the new work taking comes since the mayor.
297,when we were in highschool it was naughty fun.
298,she knows how to do that.
299,are you going to go to the executor of loved?
300,i'm sure there are some.
301,that's kind of like what we'd like to do.
302,quite a lot of varieties.
303,i haven't been to a baseball game in years.
304,prince can't painting any more.
305,a land of oil and minerals.
306,it's just kind of getting on forever.
307,that's the only way you can get to kennels from here.
308,he got a very low.
309,here are the lastest excerpts from the draft.
310,i have to think about it some more now.
311,i was really kind of excited to start reading.
312,what are you saying?
313,very interesting.
314,i enjoyed it very much.
315,he had occasion on her mother's money.
316,an earlier version of this article.
317,you might even be able to get a job there.
318,enjoyable to use.
319,we came to a fork in the road at night.
320,he really likes it and i don't.
321,it's nice and small.
322,i think there is confusion.
323,the two humps for the day.
324,but they're going to learn it sometime.
325,it was the big one.
326,it's kind of a depressing topic.
327,every tax month i have to pay my taxes.
328,i've never been sailing.
329,i have six years of college.
330,and then the next one down is in the red.
331,enjoy the adventure!
332,not lately though.
333,too many serious problems for the long term.
334,are there any other genres or sounds your interest in exploring?
335,this is kindle myself what they call a full summer.
336,for family oriented.
337,do you know that i've never seen a monkey?
338,i know most people.
339,i recommend the hundred to a lot of people.
340,do you have a computer for yourself at home?
341,it's the original.
342,you can't blame them.
343,more choice for councillors.
344,i guess traffic could be an annoyance.
345,we're going for meeting food and novice food.
346,i had to dust and clean.
347,football is an exciting sport.
348,i'm glad it's on.
349,i don't know the details.
350,when you make more about the system of treasury a centralization.
351,too many horror stories out there.
352,every major city has a theater.
353,go to the zoo and see elephants and tigers and things like that.
354,it was kind of fun.
355,that appeared to be eight or nine years old.
356,i'm kind of out of it right now.
357,i don't not read every in the paper.
358,my brothers can do it.
359,not everybody shows up.
360,publicans have pushed them out of their native land.
361,it was just based on the facts.
362,wasn't it your state that had police involved?
363,did you actually use strings at all?
364,i don't have to much either.
365,i can finish it in a day.
366,very well sustained.
367,the same box.
368,this tea was so pungent.
369,i'm reading charts.
370,you have some baking time.
371,where did you get this trick bag?
372,vision in the face of evil.
373,without the people it ministers.
374,i'll try that next week.
375,we do as a matter of fact.
376,i have some times.
377,we're going to feel it worked out.
378,the news is a good way to keep up to date.
379,point blank in the face.
380,just walking the streets.
381,he did not want to be in it any more than i did.
382,the teacher had eleven kids.
383,we were promised civil liberties.
384,click here to join instantly.
385,notes are entered into politics.
386,don't let them see violence at home.
387,the issue is that you somebody is going into.
388,what do you write for them?
389,we spent a few.
390,that lot we loaded in is now a ranch.
391,for you next vehicle does you want a truck?
392,it's all reasonable looking.
393,they pass your phone number on to another company.
394,they had sixty four of them.
395,well i like the cemetery.
396,this is fusion as coloration.
397,it's probably going to be a real old used one.
398,enjoy your day!
399,the mental act to raise them.
400,pretty different in live play.
401,lawmakers stopped a measure last year.
402,i mean a large flat plate.
403,i'd like to see it be more of an and marry part.
404,all of our tin cans.
405,paying more often than usual?
406,capital proposition.
407,everyone knows they're going to get it.
408,my in laws listen to the kind of music i hate.
409,download on your meter or tv.
410,and we sleep out here in the summertime.
411,it's never just one right again.
412,you are physically exploited.
413,especially the ones that came out and said the place.
414,be an excursion to you know.
415,we desire and want.
416,former employees.
417,it looks like they got a refund.
418,but you don't know that.
419,i noticed something interesting last time.
420,they won't have to.
421,do you just like home cooking?
422,so it seems to be.
423,the decision to test the article.
424,well oiled for employment cases.
425,it would just depend.
426,i like this station.
427,they've got the feel right home.
428,you had to have a supply.
429,that's nice that you like first season all.
430,the measure now heads to common.
431,my three year old.
432,just not people you know.
433,i can't really think of anything so offend.
434,i'm not sure how to go about it.
435,it's very tedious if you have a whole group.
436,it was a cordless phone.
437,but it's kind of hard.
438,you can do so much with them.
439,my skill set got cemented by the story.
440,it was like four hundred times as much.
441,it's possibly been.
442,i would feel that i had the right to.
443,you just call him direct.
444,i know there is.
445,it's really hard maybe.
446,the experience.
447,do we have to wait until all the land sales?
448,very scary to me.
449,i think it is getting worse.
450,i really would like to see them do well.
451,i don't live in a house.
452,people put them in.
453,it can come were fast enough and go had.
454,for about two hundred dollars.
455,in that time frame.
456,trying to make it for that.
457,anything like that we protested.
458,seven years in the fall.
459,many years or so.
460,i think it does help.
461,that has got to be booming this time of year.
462,given this process.
463,take your pick live!
464,it's been kind of scary.
465,the leaves are just red.
466,we try to go so often.
467,it took four days.
468,the pros and cons of both.
469,we're so bad.
470,you get programming.
471,not that i like betting.
472,i think a cup or two.
473,i don't mean to be knocking.
474,i'd like to see those.
475,a controlled coupling.
476,we'll close.
477,i can't use sound in this.
478,it might be kind of tricky.
479,perhaps not in the manner that we do it.
480,do you have friends with older children?
481,one hand more will do it.
482,i just call federal income comes tax every year.
483,i grew up on a farm.
484,that was the one that's been really nice to have.
485,they've done it before.
486,the engine was pretty good.
487,how different the people there really are.
488,we get out on the water occasionally.
489,maybe once every call or so.
490,since buying was born.
491,i make that once in a while.
492,how to do things?
493,i typically am not a cat person.
494,the link measures that you get.
495,they put him in the naughty office.
496,since this time last year i've changed.
497,they didn't fight together.
498,he seemed to know what he was doing.
499,they just live in the company.
500,it had to be different anyway.
501,if you do decide to go with child care.
502,the insurance paid for the body public.
503,one is eight and one is eleven.
504,i was drug tested.
505,do nematodes and developing companies?
506,they are going to get a gun no matter what.
507,when i was in high school we had a choice.
508,never painted the outside.
509,that's how we got started.
510,a nicer desk than i could afford.
511,it's really beautiful.
512,more people want.
513,i think what they will do is start paying mexico.
514,i haven't experienced it.
515,you have to have a pretty good team.
516,they're small little trucks and cars like that.
517,they don't have the ability to sell it.
518,we got to have a one month indicator.
519,there's so much going on here.
520,the victims' families and things.
521,being one of the steps in life mothers.
522,the drug dealers.
523,my wife mother is the only sentient life.
524,there can now.
525,i have never said before.
526,i don't know what we're going to do.
527,it's second nature.
528,find out where the languages are.
529,we don't get to see too many.
530,it's like a bullet going by.
531,i mean lunch today was eighteen dollars.
532,it's really unfortunate.
533,the next morning you want to take them out.
534,if the news we're getting is any good.
535,if something goes wrong.
536,i haven't seen any.
537,how to chase each other all through the house.
538,you don't worry about them too much.
539,that kind of gas pollution.
540,it really doesn't make any difference.
541,i was born in sixes and i freed the eighties.
542,i guess because i work quite a bit with lawyers.
543,i guess i haven't had that much experience.
544,reports and papers and that sort of thing.
545,training money that does not belong to them.
546,does it have to be a special color?
547,that's the freedom of choice.
548,i don't know too much about it.
549,my son plays football.
550,see how the family likes it.
551,one in college always.
552,for his civil rights violated.
553,it looked like it would be.
554,doing laundry by hand and that kind of thing.
555,i don't want stops in my line.
556,we can keep that out of our minds.
557,from here his country passes.
558,we are seeing that here as well.
559,that's what made me happy.
560,it present on the person.
561,i don't make that much.
562,it's been a long time.
563,no one can live on ice.
564,maybe they missed out on that better home movie.
565,it seems like they would be able to.
566,just didn't find the car.
567,she's one of those that love.
568,now i just have to filter it though.
569,mostly with adolescents.
570,i'm not a carpenter or anything like that.
571,i like to listen to piano music a whole lot.
572,two hour classes.
573,basically.
574,do you enjoy camping?
575,it's kind of a show piece.
576,payments and there are.
577,how do you like your trade bill?
578,it was just too perfect at all times.
579,their self entity is wrong.
580,it is pretty okay.
581,i thought that that was what stanley seed was for.
582,i couldn't get her up.
583,was it six weeks old?
584,fifteen feet wide.
585,you're a big city.
586,this chocolate and dip it in the fondue.
587,when you found out who it was.
588,because they been going to school.
589,they will up.
590,have you ever been drug tested?
591,he could get hurt.
592,i'm currently a second.
593,so you've got a lot of traffic noses real close.
594,really needed it quite a bit.
595,i know a girl.
596,we've got to eat most of the time.
597,to the point of what to buy.
598,even in my case.
599,can do whatever they want.
600,because you earned it.
601,a little more flexibility.
602,they even liked every distant.
603,i would practice.
604,i think the decision has been made.
605,we are not sure of themselves.
606,two sides of the same coin?
607,we didn't really pay attention.
608,if you're ever looking for that.
609,are you an conclusion?
610,that's from the child's pinpoint.
611,there is no comparable for a decision.
612,children receive.
613,justice gets to wind down.
614,the six times you say it.
615,i mean you can earn a lot more money.
616,but at that point i was too far gone.
617,his voice was nearly drowned out by the crowd.
618,i didn't notice it.
619,that was a great little car.
620,over a very long period of time.
621,ford investigated.
622,vice presidents of companies.
623,i wanted people to plan for it.
624,two upholstered chairs.
625,there are lovely.
626,we see more and more women being involved.
627,i have to make this one last as long as i can.
628,on to the airport.
629,well tell me this.
630,that would be really awful.
631,question and answer period.
632,because you don't know.
633,pour in the red wine and bring to a boil.
634,i'll turn the radio on.
635,they say if you're not cool in this line.
636,that's the way i feel.
637,what happened to get us to this point?
638,trump has said there was no collusion.
639,it was a great pleasure speaking with the.
640,i had the opposite.
641,we sit around and eat pumpkin.
642,i don't have berries.
643,that would have been best time to go.
644,if they didn't have to.
645,that's certainly true.
646,use development for protection.
647,we have that here.
648,usually busy fighting for survival.
649,i've had so many people.
650,i don't even get to see half my project.
651,we put some paper on the floor.
652,that's the closest thing.
653,kind of funny actually.
654,it was for the box i guess.
655,a pop up trailer.
656,you're with the home office now.
657,there seems to be comically driving all.
658,that be a really good thing to do.
659,too much business?
660,is retired now.
661,i heard this on a christian program.
662,even though there's no clothes.
663,during his many.
664,i had never seen anything.
665,this week people started.
666,used to be six bucks.
667,i caught a cop.
668,i feel so silly.
669,are they all here in the area?
670,i kind of look at it this way.
671,public parking.
672,sewing and quilting.
673,good to hear from you.
674,there oklahoma state.
675,i read a lot and and i know people.
676,did you pull them?
677,that would make me happy so.
678,it's nice to get out in the open air.
679,i think it would do something for it.
680,it has really been nice here.
681,it's the rent dollars.
682,it worked out real nice.
683,we've had lots of them in the past.
684,it's only been that way in the last five years.
685,i live right in the middle of it.
686,it's distressing too.
687,i don't own my home.
688,i've always wondered how he gets around.
689,it's just tough.
690,fiction books that i really like.
691,you got any more?
692,i'm beginning to think it's not.
693,that's something i miss quite a bit.
694,the following came up with reference.
695,that's where i didn't think about that.
696,good data as a team.
697,part of it would probably work out.
698,it's necessarily going to involve more taxes.
699,it's just going to fall.
700,i'm kind of a car buff myself.
