id,text
0,the artist reconsidered.
1,last person ever hand lithograph.
2,the rules were made in unabashed collusion.
3,there's houses needed back lives to be completely elegant.
4,the tooth fairy forgot to come when roger's tooth fell out.
5,that sunken fist war was cold but tiring despite decision.
6,before thursday's attempt was ever formal.
7,ready to tendon us part way.
8,the wood means it won't pull away easily nothing else.
9,would a bowl feeder in a man's head make him obsessed all day?
10,i talk about an authentic story line you.
11,most young rise early every morning.
12,with this new royal children can rule.
13,many jobs have an upbeat attitude.
14,and with not a change but a justice of the peace had made the decision.
15,we seem to be earning the proper lesson exposures right in our own actions.
16,sometimes desperate measures can also turn into right moves for the future.
17,the action will be straight version of if you think of you carefully of first version.
18,the gi gets dressed faster and spends less energy making cooling decisions.
19,constant attitude increase your diploma.
20,to some extent principles are shaped by exposures to group environments.
21,an adult male responds they are not suitable for eating shellfish.
22,in the context it would do well for us to put in mind the vision of peace.
23,you're boiling milk and you.
24,we look for spotted hyenas and jaguars on the safari.
25,traffic frequently has failed to measure up to engineer's worthy estimates.
26,well prepared red cap with fresh lemon slice for dinner.
27,did you buy any corduroy overalls?
28,their position is appreciated.
29,please shouldn't this hurt for just.
30,who authorized the unlimited expense account?
31,the family isn't that avid be amended.
32,the museum hires discussions every evening.
33,will serve verb by after actual talk.
34,they enjoy it when i audition.
35,the oracle should have a gift to it as you wilt when it is ripe.
36,entry filers usually deal with this by conducting regular disconnection and trimming.
37,the store is boring so shop the food instead.
38,the cleaned version is given below.
39,they seem gone proud of it.
40,a job member was fined by a turkey roll.
41,boy you ain't killing nobody but yourself.
42,teacher's guides are included with each record.
43,the man's lust fluttered.
44,this kid's father's bad.
45,the greatest warmth and good fellowship.
46,do you know where it might have gone?
47,in the place for them his cutlass was gone.
48,join us on twitter and facebook.
49,he said it'll be working sort of.
50,devil's game is a popular time in halloween.
51,that number fifteen minutes longer.
52,a third got at the light.
53,the choral singing from the eight steps.
54,not as if it were built of books.
55,then he said what?
56,i am an artist just in my own vision.
57,like kids is one answer offered by experts.
58,those musicians harmonize marvelously.
59,it all did look very efficient and shipshape.
60,that was no longer real easy.
61,in some toy sales were strikingly absent.
62,it can support long tail rules for itself.
63,none ever aim at him occasionally.
64,do you hear the trouble bells using?
65,there was much inviting much acclaim.
66,what is a specific guide given to the planner?
67,finally he asked do you object to playing.
68,i'll pay you back if you'll let us.
69,they closed sometime after eight.
70,then we are off again.
71,he left sudden cave a and did herd.
72,for a man of his mass he was clearly short.
73,some key driving lessons on thirty.
74,what the decision below.
75,receiving no answer they set the fire.
76,what is you usual upbeat personality?
77,a country to be a lion and fast to fast.
78,with a ruling up it could get into gay.
79,six minutes.
80,it's really hard to find something that works.
81,and i love the shining.
82,i do have a friend that one.
83,just way in the back.
84,actually it makes sense to a certain extent.
85,so the government that he was employed.
86,they feel good about what they're doing.
87,besides it's an invasion of personal privacy.
88,so you travel a lot.
89,they were going to wait.
90,any kind of a good environment to live in.
91,the best of android.
92,i don't know what you think about the point.
93,i believe it cost about ten dollars.
94,what in the world drugs are you on to?
95,android tv box.
96,a couple of times.
97,i had the brakes done on it.
98,what i use as a reference and has been real handy.
99,they knew when i was working.
100,it's a package deal.
101,i have seen it.
102,the measure already passed the senate committee.
103,they told me that this was a topic.
104,in the red store or wherever said.
105,they did a lot of play work and stuff.
106,you can gain too much weight.
107,recent legislation.
108,i'm a car buff too.
109,joy springs from a grateful heart.
110,still in over drill never lay all to smoke.
111,do cars cause air pollution?
112,and then you sprinkle the seeds on top of that.
113,just seeing that clear vision is a necessity.
114,factors that affect earnings of an employee.
115,if you drink a lot of caffeine you'll stay awake.
116,that's a nice car.
117,visionary leaders.
118,the only other place i've ever vacationed.
119,i just kind of went through.
120,this is inviting voice we need.
121,do you have your bag?
122,so you know it keeps us pretty busy.
123,that's a science in itself.
124,so when you get in tight situations.
125,i can relate to that.
126,it's all very well playing.
127,if they're around anymore.
128,i am not even aware that i could have seen it.
129,the ranks of asian brides are filling too.
130,einstein's equation.
131,most points at the end ones.
132,i think it's one hundred and eighty miles.
133,we don't usually take the kids when we go there.
134,one of those generation novels.
135,they'll never get hot.
136,i don't buy the newspaper.
137,bringing something for a potluck picnic.
138,i'll think it out.
139,improved vision does not work.
140,casualties were reported.
141,you just like to sit down and watch it.
142,he helps by giving little points.
143,just the all grew up in new york city.
144,you make such a choice.
145,but they have six over there.
146,a good positive direction.
147,that's what i was going to point out.
148,i turned mine in about twelve hours early at noon.
149,it's a allocations type of company.
150,i work out of my home.
151,the way it works.
152,it doesn't have an air conditioner.
153,then you have to make a salad.
154,solving the variables in the equation.
155,i read in the paper.
156,i'm in the space processing business.
157,once every year or two.
158,you don't eat it at all.
159,i've been tried and true.
160,i think that's something we might want.
161,she thought for a few minutes.
162,that is a sad situation.
163,they do have capital punishment.
164,it was nice talking to you totally.
165,my favorite team is the rangers.
166,kind of goes along with what you were saying.
167,why they don't go with person one.
168,we just avoid.
169,here are the detroit delegates.
170,he went to begin 'em one man and came back another.
171,as any city grows up.
172,so you did buy a pattern.
173,it's about six and a half percent.
174,i agree with the phone.
175,so i think it's going to be a lot easier.
176,not too much soy sauce.
177,we take a certain portion of your paycheck.
178,who sponsors you?
179,and i don't know what's going to happen.
180,i think we have about thirteen months left on it.
181,i do particularly find it.
182,they have clubs and a swimming pool.
183,our point of view.
184,it really is worth while to know.
185,i felt that was a little insensitive.
186,public transportation.
187,focal point.
188,they turn on and on disability.
189,what are we doing?
190,my job tends to be very demanding.
191,you know it was just in jest.
192,and most people like that are old.
193,that's what i was doing before.
194,the best teachers and the best students.
195,i don't like it cold.
196,she was inaugurated in january.
197,wait a minute.
198,those are no good anymore.
199,i do want to have a raised bed.
200,i see that but then i know too.
201,it wasn't organized enough for me.
202,if i don't know the story line.
203,that i've liked in the past.
204,your time my pleasure.
205,he had a choice to make the counselor told him.
206,the last time he came was in march.
207,i'm getting pretty.
208,it's really a cost.
209,have little better color but don't a lot more.
210,you guys really are notified.
211,we've got a son from austin.
212,competition with demand.
213,it still makes most of its difference in asia.
214,i think that is important too.
215,have a good evening.
216,instantly we tend to make this equation.
217,she didn't eat flies.
218,most of the time they don't bother with it.
219,they didn't keep it so he got it back.
220,i'm sure all the gangs are in it.
221,the family is that good.
222,a lot of the industry's moving southward.
223,when disclosure isn't enough.
224,contact points.
225,this morning it was twenty nine.
226,satan rejoiced with his birth.
227,they fell out because of the drug issue.
228,they are done with a flower studio.
229,don't seek unemployment.
230,that is usual for some people.
231,i'm weary from my other son doing those hours.
232,where do you have to do a whole bunch of work?
233,i take it she was an accountant.
234,go to a trip for the nation.
235,no problem there at all.
236,the way of life ends.
237,that me that want make account payment.
238,filters for air aeration for hospitals.
239,i do that when we travel.
240,i only saw the end of the first quarter.
241,is there work to support this conclusion?
242,buy a staring machine.
243,as soon as we get this house finished.
244,and just keep chipping away at the ice.
245,all the money.
246,my husband has a tool shed out back.
247,certain kinds of scenes.
248,i always threatened my daughters with time out.
249,the country is still allowed to receive oil.
250,let's see about getting parents more involved.
251,this mean that joint bank account demon.
252,what you need is a tougher punishment regime.
253,so it was really too late to do much.
254,i want to go to that golf course down south.
255,you get a little taste of it and you say no.
256,they don't even check my story according number.
257,chicago and philadelphia.
258,i don't know if you have ever heard of it.
259,social artist.
260,that's exactly the way he feels.
261,do you really not remember?
262,it is enjoying that side of it.
263,the ranks of asian writers are swelling too.
264,the mission will draw the corresponding conclusions.
265,people really happen doing the morning.
266,be kind to your whole self.
267,that's the other bar that we went to that night.
268,i don't know why.
269,you can fix sex love explosion presents her.
270,he's in first grade now.
271,i guess you some companies that aren't going fast enough.
272,increasingly democratically joined.
273,seems a little extra.
274,i kind of wish that they had a little like for the boys.
275,killer bee instinct.
276,i hadn't heard about that.
277,the ability of people to access healthcare.
278,that's probably one of the reasons.
279,quite a few movies are based off of that.
280,but when i went home that's all i could think about.
281,i'm north of that actually.
282,a couple charges on here kinda.
283,it was something easy i could do.
284,i think not a lot of people go to rest prison.
285,brown and black pictures of her.
286,the jury is expected to announce its decision.
287,somebody points.
288,i don't get to watch.
289,we're all busy now each.
290,apparently that's more.
291,payment everything.
292,they're probably use it to their benefit.
293,it do that is good that they like that.
294,there is some different talk in her report.
295,i remember ticket times in schooling when boys on work.
296,the new york taxi drivers spent the day.
297,when we were in high school it was always fun.
298,she knows how to do that.
299,are you going to go see the wreckers of lovers?
300,i'm sure there are some.
301,that's kind of like what we'd like to do.
302,quite a lot of variety.
303,i haven't been to a baseball game in years.
304,print out papers any more.
305,a trend of oil and mineral.
306,it's just kind of getting on forever.
307,that's the only way you can get to canada from here.
308,she got a very low.
309,here are the test excerpts from the draft.
310,i have to think about it some more now.
311,i was really kind of excited to start reading.
312,what are you saying?
313,very interesting.
314,i enjoyed it very much.
315,he had occasion on her mother's money.
316,and earlier versions of this article.
317,you put in be able to get a job there.
318,enjoyable to use.
319,we came to a fork in the road at night.
320,he really likes it and i don't.
321,it's nice and small.
322,i think there is confusion.
323,they go someplace for the day.
324,but they're going to learn it sometime.
325,it was the big one.
326,it's kind of a depressing topic.
327,every six months i have to pay my taxes.
328,i've never been gallon.
329,i have six years of college.
330,and then the next one down is in the marines.
331,enjoy the adventure.
332,not lately though.
333,too many city problems for the long term.
334,are there any other countries or said or edited in exploiting?
335,this i kinda missis what they call a full summer.
336,more family oriented.
337,do you know that i've never seen a monkey?
338,i know both people.
339,i recommend the hunters to a lot of people.
340,do you have a computer for yourself at home?
341,it's the original.
342,you can't blame them.
343,more choice for caterpillars.
344,i guess traffic could be an annoyance.
345,we've gone for ruminating food and levantine food.
346,i had to dust and cleaning.
347,football is an exciting sport.
348,i'm glad it's on.
349,i don't know the details.
350,can you speak more about this system of treasury a centralization?
351,so many horror stories out there.
352,have a major city as a theater.
353,go to the zoo and see elephants and tigers and things like that.
354,it be kind of fun.
355,that appeared to be eight or nine years old.
356,i'm kind of out of it right now.
357,i don't get wood ravings in the paper.
358,my brother can do it.
359,not everybody shows up.
360,ricans have with them out of their native land.
361,it was just based on the facts.
362,wasn't it your state that had police involved?
363,did you like your drink at all?
364,i don't have to much either.
365,i can fit it in a day.
366,very well spilled.
367,the same box.
368,the key was to parent.
369,some reading charts.
370,you have some baking time.
371,where did you get this sick bag?
372,better in the case of evil.
373,without the people it's meaner.
374,i'll try that next week.
375,we do as a matter of fact.
376,i have some games.
377,we're going to feel it watch out.
378,the news is a good way to keep up to date.
379,point blank in the face.
380,just walking the streets.
381,he did not want to be in it any more than i did.
382,the teacher had eleven kids.
383,we were promised civil liberties.
384,click here to join infinitely.
385,those are changes in politics.
386,don't let them see violence at home.
387,the issue is that you mother is going under.
388,what do you write for them?
389,we spent a few.
390,the lot we lived in is now a ranch.
391,do you like vehicle do you want a truck.
392,it's all seasonal chicken.
393,they pass your phone number on to another company.
394,they had sixty four of them.
395,well i like the seventies.
396,this is fashion as liberation.
397,it's probably going to be a real old used one.
398,enjoy your day.
399,the mental space to raise them.
400,pretty evident at five thirty.
401,i make passed a measure last year.
402,i mean a large flat plate.
403,i'd like to see it be more of an and mary part.
404,all of our tin cans.
405,paying more often than usual.
406,capital proficient.
407,everyone knows they're going to get it.
408,my in laws listen to the kind of music i hate.
409,download on your printer or television.
410,and we play out here in the summertime.
411,it never did run right again.
412,you are physically depleted.
413,especially the ones that came out and said their piece.
414,be an exporter too you know.
415,we never won one.
416,former employees.
417,it looks like they've got a weapon.
418,but you don't know that.
419,i noticed something interesting last time.
420,they wouldn't have to.
421,do you just like home cooking?
422,so it seems to be.
423,the decision to censor the article.
424,they will for employment cases.
425,it would just depend.
426,i like this station.
427,they've got the full right home.
428,you had to have a supply.
429,that's neat that you like first cd all.
430,the measure now heads to common.
431,my three year old.
432,that's not feasible you know.
433,i can't really think of anything else offhand.
434,i'm not sure how to go about it.
435,it's very tedious if you have a whole group.
436,it was a cordless phone.
437,but it's kind of hard.
438,you can do so much with them.
439,my skill set got diminished by the syrian.
440,it was like four hundred times as much.
441,it's possibly done.
442,i would feel that i had the right to.
443,you just call him derek.
444,i know there is.
445,it's really hard maybe.
446,the experience.
447,you have to wait until all the land fell.
448,very scary to me.
449,i think it is getting worse.
450,i really would like to see them do well.
451,i don't live in a house.
452,people put them in.
453,it can come where fast enough and go hard.
454,for about two hundred dollars.
455,in that time frame.
456,trying to make it for that.
457,anything like that we discovered.
458,seven years in the pros.
459,many years or so.
460,i think it does help.
461,that has got to be blooming this time of year.
462,even the buses.
463,take your pick of.
464,it's been kind of scary.
465,the leaves are just red.
466,we try to go so often.
467,it took four days.
468,the pros and cons of both.
469,were those bad?
470,you get programs and.
471,not that i like reading.
472,i think a cup or two.
473,i don't mean to be talking.
474,i'd like to see those.
475,a controlled substance.
476,real close.
477,i guess he's trained in this.
478,it might be kind of touchy.
479,perhaps not in the manner that we do it.
480,do you have friends with older children?
481,one had more pull to it.
482,i just try visual inking some nights every year.
483,i grew up on a farm.
484,that was the one that's been really nice to have.
485,they've done it before.
486,the engine was pretty good.
487,how different the people there really are.
488,we get out on the water occasionally.
489,maybe once every quarter or so.
490,that's fine with porn.
491,i make that once in a while.
492,how to do things.
493,i typically am not a cat person.
494,the junk mail that you get.
495,they put him in the nurse's office.
496,since this time last year i've changed.
497,they didn't fight together.
498,he seemed to know what he was doing.
499,they just live in the community.
500,it had to be different anyway.
501,if you do decide to go with child care.
502,the insurance paid for the pretty public.
503,one is eight and one is eleven.
504,i was drug tested.
505,do naps and developing communities.
506,they are going to get a gun no matter what.
507,when i was in high school we had a choice.
508,never painted the outside.
509,that's how we got started.
510,a nicer dress than i could afford.
511,it's really beautiful.
512,more people want.
513,i think what they will do is start paying mexico.
514,i haven't experienced it.
515,you have to have a pretty good team.
516,they're small little trucks and cars like that.
517,they don't have the ability to develop it.
518,you got to have a one death indicator.
519,there's so much going on here.
520,the victim's family and things.
521,playing one of these late in life mother.
522,the drug dealers.
523,my wife's mother is the only grandparent left.
524,they're gone now.
525,i have never skied before.
526,i don't know what we're going to do.
527,it's second nature.
528,find out where the languages are.
529,we don't get to see too many.
530,it's like a bullet going by.
531,i mean lunch today was eighteen dollars.
532,it's really unfortunate.
533,the next morning you want to take them out.
534,if the news we're gaining is any good.
535,if something goes wrong.
536,i haven't seen any.
537,how to see each other all through the house.
538,you don't worry about them too much.
539,that kind of gas mileage.
540,it really doesn't make any difference.
541,i was born in texas and i read other areas.
542,i guess because i work quite a bit with lawyers.
543,i guess i haven't had that much experience.
544,reports and papers and that sort of thing.
545,training means that does not belong to them.
546,does it have to be a special color?
547,that's the freedom of choice.
548,i didn't know too much about it.
549,my son plays football.
550,see how the family likes it.
551,one in college always.
552,were his civil rights violated?
553,it looks like it would be.
554,doing laundry by hand and that kind of thing.
555,i don't want steps in my lawn.
556,we can keep that out of our minds.
557,from for his country business.
558,we are seeing that here as well.
559,that's what made me happy.
560,it descends on the person.
561,i don't make that much.
562,it's been a long time.
563,no one can live on ice.
564,maybe they based it on that mr mom movie.
565,it seems like they would be able to.
566,they didn't find the car.
567,she's one of those that loves.
568,now i just have to face it though.
569,mostly with adolescents.
570,i'm not a carpenter or anything like that.
571,i like to listen to piano music a whole lot.
572,two hour classes.
573,basically.
574,do you enjoy camping?
575,it's kind of a slow piece.
576,maybe not down there.
577,how do you like your trade bill?
578,it was just too perfect at all times.
579,their self endurance is wrong.
580,it is pretty okay.
581,i thought that that was what celery seed was for.
582,i couldn't get her up.
583,was it six weeks old?
584,fifteen feet wide.
585,to a bigger city.
586,this chocolate and dip it in the fondue.
587,when you found out who it was.
588,because they bring guns to school.
589,they will up.
590,have you ever been drug tested?
591,he could get hurt.
592,i'm originally a texan.
593,do you've got a lot of traffic noise real close?
594,really liking it quite a bit.
595,i know a girl.
596,we've got to eat most of the time.
597,to the price of what i buy.
598,even in my case.
599,can do whatever they want.
600,because you own it.
601,a little more flexibility.
602,they even looked every distant.
603,i food prices.
604,i think the decision has been made.
605,they are not sure of themselves.
606,two sides of the same coin.
607,she doesn't really pay attention.
608,if you're ever looking for that.
609,are you on conclusions?
610,that's from the child component.
611,there is no timetable for a decision.
612,children recover.
613,just get so worn down.
614,the six times you say it.
615,i mean you can earn a lot more money.
616,but at that point i was too far gone.
617,his voice was nearly drowned out by the crowd.
618,i didn't notice it.
619,that was a great little car.
620,over a very long period of time.
621,guards and precedents.
622,the presence of companies.
623,i want people to plan for it.
624,you also choose.
625,there are probably.
626,we see more and more women being involved.
627,i have to make this one last as long as i can.
628,and to the airport.
629,well tell me this.
630,that would be really awful.
631,questions and answer period.
632,because you don't know.
633,pour in the red wine and bring to a boil.
634,i'll turn the radio on.
635,they say if you're not tall in this line.
636,that's the way i feel.
637,what happened to get us to this point?
638,trump has said there was no collusion.
639,it was a great pleasure speaking with you.
640,i had the opposite.
641,we sit around and eat popcorn.
642,i don't have busy.
643,that would have been best time to go.
644,if they didn't have to.
645,that's certainly true.
646,you developed your compassion.
647,we have that here.
648,usually busy fighting for survival.
649,i've had so many people.
650,i don't even get to see have my project.
651,we put some paper on the floor.
652,that's the closest thing.
653,kind of funny actually.
654,it was worth the bucks i guess.
655,a pop up trailer.
656,you're with the home office now.
657,they seem to be economically driven also.
658,that would be a really good thing to do.
659,too much business.
660,is retired now.
661,i heard this on a christian program.
662,even though they're so close.
663,during his money.
664,i had never seen anything.
665,this week people started.
666,used to be six bucks.
667,i caught a group.
668,i feel so silly.
669,are they all here in the area?
670,i kind of look at it this way.
671,public marketing.
672,sewing and quilting.
673,good to hear from you.
674,their oklahoma state.
675,i read a lot and then i know people.
676,did you pull them?
677,that would make me happy though.
678,it's nice to get out in the open air.
679,i think it would do something for it.
680,it has really been nice here.
681,it's the rent dollars.
682,it works out real nice.
683,we've had lots of them in the past.
684,it's only been that way in the last five years.
685,i left right in the middle of it.
686,it's depressing to.
687,i don't own my home.
688,i've always wondered how he gets around.
689,it's just stuff.
690,fiction books that i really like.
691,you got any more?
692,i'm beginning to think it's not.
693,that's something i miss quite a bit.
694,they finally came up with evidence.
695,that's why i didn't think about that.
696,good together as a team.
697,part of it would probably work out.
698,it's necessarily going to involve more taxes.
699,it's just going to follow.
700,i'm kind of a car buff myself.
701,buying of a piece.
702,sometimes it will stop.
