id,text
701,biting off a piece.
702,sometimes it will stop.
703,i just don't like that.
704,usual training to talk about.
705,i am close to receiving my english degree.
706,everything's two inches.
707,he made a real big stake himself.
708,they're actually great for them.
709,it was for a murder trial.
710,are you a professional musician?
711,it's far beyond me.
712,we've been an awful lot from the space program.
713,two sets of grandparents.
714,i call and find out.
715,you want quality too but what?
716,i've heard about him.
717,we've had more freezing this winter.
718,if we can't get a handle on that.
719,they would vote for choice.
720,they were okay.
721,to find a man.
722,on a working farm.
723,after we had them for several years.
724,if they work at it a little bit.
725,we don't have enough.
726,what are you making?
727,absolutely nothing.
728,i had a carpet service call up there times.
729,either he's probably better than a lot of them.
730,just about any kind of music.
731,we like mexican food.
732,i know the day care centers are not cheap either.
733,i found it a lot of times.
734,you've got to find an even line.
735,i think he barely makes it.
736,where you got the boy?
737,it all starts to become similar.
738,i could go along with that.
739,it's like one second of recording.
740,that's a big thing with me.
741,i'm the only one.
742,i've been calling you on that.
743,if there starts to be a lot of violence.
744,walking seems to be the best.
745,i don't think too many of them are anymore.
746,how do you feel about your game?
747,when i lived out in the country.
748,i'm generally from mn.
749,to grow up and to do what they want to do.
750,we just keep chunks of it on paper.
751,i had friends.
752,i've worked in hotels.
753,they can pretty much get everybody there.
754,you can guess i'm sorry.
755,the engine build up in it.
756,the storm worries it so much.
757,i don't have a lot of time.
758,i know they will.
759,sometimes they're not very open.
760,we start the bottom.
761,i make a lot of my christmas presents.
762,we were talking about that just the other day.
763,in the houston area.
764,i'm not counting on it.
765,i like to have somebody come with me.
766,was always kind of tough.
767,not sure that's something i want to do.
768,most of the stores will accept those.
769,that is pretty unusual.
770,that's what he grew up questioning too.
771,she'll be two in just.
772,i just get isn't been any money.
773,the news or something.
774,i do have my radio going most of the day though.
775,a girl and a boy.
776,he has used a lot.
777,it's a little bit financial type thing.
778,an economic incentive for people to vote.
779,i'm guessing from that.
780,some for a sure thing in about four hours.
781,it's going to happen.
782,i only weigh seconds away.
783,horrible stuff like that.
784,an opera or the symphony or something.
785,if they don't have any living relatives.
786,i watched the news on tears.
787,a record of the top songs of the eighties.
788,i do not have much to compare it to.
789,i don't read as much as i would like to either.
790,this was faster than.
791,i want them to come back up next year.
792,did that when i was a kid.
793,things that are under state resection.
794,i was an independent.
795,i don't have a lot of time to do it.
796,and i'm up here.
797,i enjoy them coming.
798,but it has a pretty low crime rate.
799,big closet space.
800,they're willing to go some place else.
801,i would start.
802,we do a lot of things on the weekends together.
803,i've heard different.
804,we'd have to build less prisons.
805,it's light reading.
806,well we just started.
807,we started taking her.
808,my mother and i were.
809,we are so busy.
810,i'd like to go bird hunting.
811,sometimes you have to ask them for that.
812,then do it all over again.
813,what do you think are some current trends?
814,about a thousand bad sticks.
815,do you watch star trek?
816,now you don't have to put it down.
817,i don't see much tv mostly when i'm in school.
818,they could probably come in and see.
819,i don't get too many of those.
820,did they do that before he went in or what?
821,i'm getting rid of this car.
822,i have three kids and a dog.
823,they don't need that seven day waiting period.
824,of course it's real convenient.
825,my husband and i both went.
826,you learn better about the textures and stuff.
827,just a little while to go on a shoot.
828,then we put a receipt in there.
829,where is it going to be?
830,fifty nine kilometers for canning.
831,they need it early.
832,it couldn't be decided.
833,simple division to come.
834,which which i thought was a real interest casting.
835,well that's about it really.
836,if i don't have a real with a button on it.
837,you get a lot of sunfish.
838,i enjoy going to the beaches and to beach areas.
839,i guess i'm coastal too big square country.
840,they are both remarried.
841,the higher school i went to.
842,you have to think grandchildren.
843,you could do it.
844,he was treated like all the rest of students.
845,i don't think so anymore.
846,that's just not enough for a total.
847,one thing led to another.
848,you different points of the country.
849,i wasn't of any sum anyone to speak off.
850,it really hits those people.
851,put a cap in your version.
852,it's a pretty good size church.
853,something for you in a motor home.
854,if you've only got a talking post there.
855,this time of the year.
856,i'd just as soon a lot very people did.
857,they think it's kind of cool.
858,crime is too much.
859,i didn't know how my father did it.
860,lives on a farm for tax years.
861,i look at something as a job also.
862,really kind of done the rounds.
863,i never even knew that.
864,grilling and gas.
865,the commercial district.
866,what's the difference there?
867,i like that kind of stuff.
868,we might as well.
869,savings and loans.
870,they plastered over detail.
871,all sliced white grape.
872,the time element.
873,on the outskirts of houston.
874,i forget how she got it.
875,your decision reimbursement.
876,getting back seats for the bus seats.
877,if you have any tips whatsoever.
878,literary movies.
879,i can't remember where.
