id,text
0,the artist reconsidered.
1,takes purchased several hand lithograph.
2,the rules were made in indirect collusion.
3,where's custom needed back loved to be completely ellen.
4,the tooth fairy forgot to come when workers to fill out.
5,that singing makes our weather cause a tried deeper i listen.
6,bar for thursdays attempt reason ever permanently.
7,god or two hundred has sparked a.
8,the word means it won't boil away easily nothing else.
9,would a bowl feeder in a man's hat makes him upset all day?
10,i talk about an authentic story line you are.
11,most young was early every morning.
12,with this no loyal kid can fuel.
13,maybe times have an upbeat attitude.
14,and was not a dangerous but a choice of the place who made the decision.
15,we seem to be running the patcher lilian explosions right in our own backyards.
16,combine disparate measures and also turn into at most for this feature.
17,the angels will be states voted off if you think them through carefully first version.
18,the keys get dressed faster and spend less energy making clothing decisions.
19,excellent executed countries your diploma.
20,to some extent respirations are shipped by expressions to group environments.
21,an adult male responds keys are not suitable for eating shellfish.
22,in the context it would so well for us to put in mind the vision of first.
23,your boiling milk and you?
24,we look for spotted hyenas and daggers on the supporters.
25,traffics frequently has appealed to medicine up to engineers were estimates.
26,well prepared red tape with fresh lemon slice for dinner.
27,did you buy any corduroy overalls?
28,their pronunciation is completed.
29,we couldn't this cot for choice.
30,who authored the unlimited expenses account?
31,the family uses that papers be amended.
32,the museum hires masseuses every evening.
33,well stuff perturbed by after sexual talk.
34,they can do it when i audition.
35,the oracle should have a gift to it as you call when it is ripe.
36,any spiders usually deal with this by conducting regularly inspections and strawman.
37,the store is booking so stop the wood instead.
38,the cleaned version is different lol.
39,they seem got powder of it.
40,a shop member was followed by a turkey roll.
41,by you and resulting everybody but yourself.
42,teaching guides are included with each record.
43,the man's ideas fluttered.
44,this could cause bad.
45,the greatest warmth and good fellowship.
46,do you know where it might have gone?
47,in the place for them his unless we can.
48,join us on twitter and facebook.
49,he said they'll be working toward a decision.
50,every crime is a popular time on halloween.
51,then summer version minutes longer.
52,a third got at the light.
53,the guttural language from the little steps.
54,like as if it were built of books.
55,then he then what?
56,i am an artist just in my own vision.
57,but kids is one answer over by experts.
58,no musicians harmonize marvelously.
59,it all does look very efficient and shipshape.
60,that was no longer feel any.
61,in summary hail was strikingly happen i.
62,it can support long trail files for itself.
63,induction saturday at him occasionally.
64,do you hear the stable bells union?
65,there was much complaining much acclaim.
66,well is a specific guide keys to the lander.
67,finally he asked do you object to playing?
68,i'll pay you back of all let us.
69,they closed sometime after it.
70,and we are off again!
71,he was sudden kill a friend she'd heard.
72,for a man of his mess is our colonies should.
73,sam is giving lessons on thursday.
74,what the station by?
75,received no answer the set the fire.
76,where is you usual upbeat fervently?
77,a country to be a line in fist to face.
78,with a really top it could get into gl.
79,makes many.
80,it's really hard to find something that works.
81,and i love the timing.
82,i do have a friend that ran.
83,just way in the back.
84,actually it makes sense to a certain extent.
85,see the government that he was employed.
86,they feel good about what they're doing.
87,besides it's an invasion of personal privacy.
88,so you travel a lot.
89,they were going to write.
90,any kind of a good environment to live in.
91,the best of android.
92,i don't know what you think about the point.
93,i believe it cost about ten dollars.
94,what in the world does are you on to?
95,android tv box a.
96,a couple of times.
97,i had the brakes done on it.
98,what i use as a reference and have been real handing.
99,i know when i was working.
100,it's a package deal.
101,i have seen it.
102,the measures already passed a senate committee.
103,they told me that this was a topic.
104,in the red squares are weaver said.
105,they did a lot of play work and stuff.
106,you can gain too much weight.
107,recent legislation.
108,i'm a car buff too.
109,laura springs from a grateful heart.
110,so in every drill never a call to some.
111,no cars causing air pollution.
112,and then you sprinkle the cheese on top of that.
113,just saying that their vision is a necessity.
114,factors that effect turning of an employee.
115,if you drink a lot of caffeine will stay work?
116,that's a nice car.
117,visionary leaders.
118,the only other place i've ever vacationed.
119,i just kind of went through.
120,this is interesting voice we need.
121,do you have your bag?
122,so you know it keeps us pretty busy.
123,that's a science in itself.
124,so when you get in tight situations.
125,i can relate to that.
126,it's all ready quit playing.
127,if they're around anymore.
128,i am not even aware that i could have seen it.
129,the ranks of asian riders are willing to.
130,einstein equation.
131,most points at the end ones.
132,i think it's one hundred and eighty miles.
133,we don't usually take the kids when we go there.
134,one of those generation novels.
135,we'll never get caught.
136,i don't buy the newspaper.
137,bringing something for a potluck picnic?
138,i'll stick it out.
139,improved vision does not work.
140,casualties were reported.
141,you just like to sit down and watch it.
142,he helps by giving little point.
143,just they all grew up in new york city.
144,you make such a choice.
145,but they have sticks over there.
146,a good positive direction.
147,that's what i was going to point out.
148,i turned mine in about never are usually at noon or.
149,it's a celebration type of company.
150,i work out of my home.
151,the way it works.
152,it doesn't have an air conditioner.
153,then you have to make a salad.
154,solving the variables in the equation.
155,i read in the paper.
156,i'm in the peace processes business.
157,once every year or two.
158,you don't need it at all.
159,i've been tried and true.
160,i think that's something we might want.
161,she thought for a few minutes.
162,that is a sad situation.
163,they do have capital punishment.
164,it was nice talking to you today.
165,my favorite time is the ranges.
166,kind of goes along with what you were saying.
167,why they don't go with porting one.
168,reader's choice award.
169,where are the distraught delegates?
170,he wants to begin name one man and come back another.
171,as any city grows up.
172,so you did buy a pattern.
173,it is about six and a half percent.
174,i agree with the phone.
175,so i think it's going to be a lot easier.
176,not too much soy sauce.
177,we take a seeing person of your project.
178,how sexy you are!
179,and i don't know what's going to happen.
180,i think we have about thirteen points live on it.
181,i do particularly find it.
182,they have cars and a swimming pool.
183,our point of view.
184,it really is worth while to know.
185,i felt that was a little insensitive.
186,public entertainment.
187,focal point.
188,i run on and on.
189,what are we doing?
190,my job tends to be very demanding.
191,you know it was just in jest.
192,and most people like that are old.
193,that's what i was doing before.
194,the best teachers and the best students.
195,i don't like it cold.
196,she was interested in jan.
197,wait a minute.
198,shoes are no good anymore.
199,i do want to have a red band.
200,i see that but that i know too.
201,it wasn't organised enough for me.
202,if i don't know the story line.
203,it's over like in the past.
204,your same my pleasure.
205,he had choices to make a counselor told him.
206,the last time he came was in march.
207,i'm getting pretty.
208,it's really a cost.
209,i've little material luxury but don't a lot more.
210,you guys really are newlyweds.
211,we've got a ton from austin.
212,competition with demand.
213,it still makes most of its office in asia.
214,i think that is important too.
215,have a good everything.
216,instantly we can to make these equations.
217,i didn't eat fries.
218,most of the time they don't bother with it.
219,they didn't keep it so i got it back.
220,i'm sure all the geeks are in it.
221,the family is that good.
222,a lot of the entries moving southward.
223,when disclosure isn't enough.
224,contact points.
225,this morning it was quietly done.
226,season reviews with his birth.
227,they fell out because of the drug issue.
228,these are done with a flower too.
229,don't select independent.
230,that is usually for some people.
231,i'm really from my other son during those hours.
232,where do you have to do a whole bunch of work?
233,i take it she was an accountant.
234,go to a cheap for the intonation.
235,no problem there at all.
236,the way of life and.
237,let me that want make account stamen.
238,filters for a illustration for hospitals.
239,i do that when we travel.
240,i only saw the end of the first quarter.
241,is there work to support this conclusion?
242,buy a staring mission.
243,as soon as we get their house business.
244,and just keep chipping away at the ice.
245,all the money.
246,my husband has a tool shed out back.
247,certain kinds of scene.
248,i always threaten my daughters with time out.
249,the curry is still allowed to receive oil.
250,let's see about getting settings more involved.
251,just more that joint bank account shipment.
252,what you need is a tougher punishment regime.
253,so it was really too late to do much.
254,i wanted to go to that golf course down south.
255,you get a little taste of it and you say no.
256,they don't even check my story relating number.
257,she quarters and philadelphia.
258,i don't know if you have ever heard of it.
259,social robots.
260,that's exactly the way he feels.
261,do you really not remember?
262,it has mentioned that side of it.
263,the ranks of vision writers are swelling to awe.
264,the mission will draw the corresponding conclusions.
265,videos usually happens during the morning.
266,be kind to your whole self.
267,that's the other bar that we went to that night.
268,i don't know why.
269,you can flank steaks love explosion predicates are.
270,he's in first grade now.
271,i guess to some companies that aren't going fast enough.
272,instantly deterministically gardens.
273,something a little extra.
274,i kind of wish that they had a little liking for the boys.
275,killer bee instinct?
276,i hadn't heard about that.
277,the ability of people to access healthcare.
278,that's probably one of the reasons.
279,quite a few movies are based off of that.
280,but when i went home that's all i could think about.
281,i'm north of that actually.
282,a crumble rockets on here contender.
283,it was something easy i could do.
284,i think was a lot of people go to west virginia.
285,ben and black princes of her.
286,the jury is expected to announce its decision.
287,somebody points.
288,i don't get to watch.
289,we all been there.
290,apparently that more.
291,pullman everything.
292,they're probably doing it to their business.
293,it is good that the like that.
294,there is some definite stuck in her report.
295,i remember different times in calling men boys on work.
296,the new york actually comes past the mayor.
297,when i was in high school it was always fun.
298,you know how to do that.
299,are you going to go see the existence of love?
300,i'm sure there are some.
301,that's kind of like what we'd like to do.
302,quite a lot of very.
303,i haven't been to a baseball game in years.
304,french and painting any more?
305,a dance of oil and mineral.
306,it's just kind of waiting on forever.
307,that's the only way you can get to cancel from here.
308,she's not a very low.
309,here are the testers excerpts from the draft.
310,i have to think about it some more now.
311,i was really kind of excited to start reading.
312,what are you saying?
313,very interesting.
314,i enjoyed it very much.
315,he had occasions when her mother money.
316,an earlier version of this article.
317,you put in by people to get a job there.
318,enjoyable to use.
319,we came to a fork in the road it needs.
320,he really likes it and i don't.
321,it's nice and small.
322,i think there is confusion.
323,they go homeless for the day.
324,but they're going to learn it sometime.
325,it was the big one.
326,it's kind of a different topic.
327,every statement i have to pay my taxes.
328,i've never been sailing.
329,i have six years of college.
330,and then the next one down is in the period.
331,enjoy the adventure!
332,not really though.
333,too many serious problems for the long term.
334,are there any other countries or sounds or interested in exploiting?
335,this i cancel myself what they call a full number.
336,more family oriented.
337,do you know that i've never seen a monkey?
338,i know both people.
339,he recommends the hundred to a lot of people.
340,do you have a mentor for yourself at home?
341,it's the original.
342,you can't blame them.
343,more choice more cannibals.
344,i guess traffic could be an endurance.
345,we've got four remaining food and evidence food.
346,i had to dust and cleaning is.
347,football is an exciting sport.
348,i'm glad it's on.
349,i don't know the details.
350,when you speak more about this system of treasury decentralization.
351,too many horror stories out there.
352,every major city has a theater.
353,go to the zoo and see elephants and tigers and things like that.
354,it'd be kind of one.
355,that appeared to be eight or nine years old.
356,i'm kind of out of it right now.
357,i don't want would reveling in the paper.
358,my brother can do it.
359,not everybody shows up.
360,rebuilding have with them out of their native land.
361,it was just based on the facts.
362,wasn't it your take that had police involved?
363,did you actually use strings at all?
364,i don't have to much either.
365,i can fit it in a day.
366,there will sustain.
367,the same box.
368,the day was so pungent.
369,some reading charts.
370,you have some vacation time.
371,where did you get this kick back?
372,britain in the case of evil.
373,but out the people its manner.
374,i'll see that next week.
375,we do as a matter of fact.
376,i have some times.
377,we're going to feel it watch out!
378,the news is a good way to keep up to date.
379,went back in the past.
380,just walking the streets.
381,he did not want to be in it any more than i did.
382,the teacher had eleven kids.
383,we were promised civil liberties.
384,click here to join fantasy.
385,that's our engine into politics.
386,don't let them see violence at home.
387,the issue is that you import is going into.
388,what do you write for them?
389,our print of you.
390,that that we lives in is now a chance.
391,for your next vehicle do you want a truck?
392,it's also seasonal skin.
393,they pass your phone number on to another company.
394,they had sixty four of them.
395,well i like the salmon.
396,this is fashion as liberation.
397,it probably going to be a full hold use one.
398,enjoy your day!
399,the mental space to raise them.
400,pretty deafening its love larry.
401,i'll make us a measure last year.
402,i mean a lock plate plate.
403,i'd like to see it be more of an an amateur sport.
404,all of our tin cans.
405,praying more often than usual?
406,people propulsion.
407,everyone knows they're going to get it.
408,my in laws listed to the kind of music i hate.
409,controls on your semester or television.
410,and we play out here in the summertime.
411,it never is one right again.
412,you are physically exploited.
413,especially the ones that come out and said the place.
414,p and expressed to you know.
415,we later on won't.
416,somebody because.
417,it looks like they've got a weapon.
418,but you don't know that.
419,i noticed something interesting last time.
420,they won't have to.
421,do you just like home cooking?
422,so it seems to be.
423,the decision to test the article.
424,that's all for employment classes.
425,it would just depend.
426,i like this station.
427,we've got the full right home.
428,you had to have a polite.
429,that's nice that you like first season all.
430,the medicine i had to government.
431,my three year old.
432,just not feasible you know.
433,i can't really think of anything else offend.
434,i'm not sure how to go about it.
435,it's very tedious if don't have a whole group.
436,it was a cordless phone.
437,but it's kind of hard.
438,you can do so much with them.
439,my skill set got cemented by the story.
440,it was like four hundred times as much.
441,it's possibly been.
442,i would feel that i had the right to.
443,you just call him tracks.
444,i know there is.
445,it's really hard may.
446,the experience.
447,do we have to wait until all the land sale?
448,very scary to me.
449,i think it is getting worse.
450,i really would like to see them do well.
451,i don't live in a house.
452,people put them in.
453,it can from where fast enough and go hard.
454,for about two hundred dollars.
455,in that time frame.
456,trying to make it through that.
457,anything like that we protested.
458,seven years in the bowl.
459,many years or so.
460,i think it does help.
461,that has got to be robbing this time of year.
462,given this process.
463,take your sick leave.
464,it's been kind of scary.
465,the leaves are just had.
466,we had to go so often.
467,it took four days.
468,the pros and cons of both.
469,for those brands.
470,you get parliament.
471,not that i like writing.
472,i think a cup or two.
473,i don't mean to be knocking.
474,i'd like to see those.
475,a controlled substance.
476,will close.
477,i guess he's trained in this.
478,it might be kind of tricky.
479,perhaps not in the manner that we do it.
480,do you have friends with older children?
481,one had more blue to it.
482,i just try federal income time tax every year.
483,i grew up on a farm.
484,that was the one that's been really nice to have.
485,they've done it before.
486,the engine was pretty good.
487,how different the people there really are.
488,we get out on the water occasionally.
489,maybe once every call or so.
490,that brand was born.
491,i make that once in a while.
492,how to do things?
493,i typically am not a cat person.
494,the link error that you get.
495,they put him in the nurse's office.
496,since this time last year of change.
497,they didn't write together.
498,i seemed to know what he was doing.
499,they just live in the society.
500,it had to be different anyway.
501,if you do decide to go with child care.
502,the insurance paid for the party subject.
503,one is eight and one is eleven.
504,i was drug tested.
505,do nematodes and developing communities e.
506,they are going to get a gun no matter what.
507,when i was in high school we had a choice.
508,never found the outside.
509,that's how we got started.
510,a nicer dress than i could afford.
511,it's really beautiful.
512,more people want.
513,i think what they will do is start paying mexico.
514,i haven't experienced it.
515,you have to have a pretty good team.
516,they're small little trucks and cars like that.
517,they don't have the ability to develop it.
518,you got to have a one month indicator.
519,there's so much going on here.
520,the brixton apples and things.
521,playing one of these steps in life mother.
522,the drug dealers.
523,my wife's mother is the only good point if.
524,they're going now.
525,i have never skied before.
526,i don't know what we're going to do.
527,it's second nature.
528,find out where the links are.
529,we don't get to see too many.
530,it's like a bullet going by.
531,i mean lunch today was eighteen dollars.
532,it's really unfortunate.
533,the next morning you want to take them out.
534,if the news we're getting is any good.
535,if something goes wrong.
536,i haven't seen any.
537,how to teach each other all through the house.
538,you don't worry about them too much.
539,that kind of gas pollution.
540,it really doesn't make any difference.
541,i was born in texas and i read other areas.
542,i guess because i work quite a bit with lawyers.
543,i guess i haven't had that much experience.
544,reports and papers and that sort of thing.
545,training and that does not belong to them.
546,does it have to be a special color?
547,that's the freedom of choice.
548,i didn't know too much about it.
549,my son plays football.
550,see how the family likes it.
551,one in college always.
552,were his civil rights violated?
553,it looked like it would be.
554,doing laundry by hand and that kind of thing.
555,i don't want stops in my lawn.
556,we can keep that out of our minds.
557,from here his country business.
558,we are seeing that here as well.
559,that's what made me happy.
560,it responds on the person.
561,i don't make that much.
562,it's been a long time.
563,no one can live on ice.
564,maybe they based it on that mr. mom movie.
565,it seems like they would be able to.
566,just didn't find the car.
567,she's one of those that love.
568,now i just have to fill it though.
569,mostly with adolescents.
570,i'm not a company or anything like that.
571,i like to listen to piano music a whole lot.
572,two hour class.
573,basically.
574,do you enjoy camping?
575,it's kind of a so various.
576,maybe on down there.
577,how do you like your red bill?
578,it was just too perfect at all times.
579,their self evidence is stronger.
580,it is pretty okay.
581,i thought that that was what kelly said was for.
582,i couldn't get her up.
583,was it six weeks old?
584,haven't read wired?
585,you're a bigger city.
586,we talked and keep it in the finder.
587,when you found out who it was.
588,because the big gone to school.
589,they will up.
590,have you ever been drug tested?
591,he could get hurt.
592,i'm usually a texan.
593,do you've got a lot of traffic during real close?
594,really liking it quite a bit.
595,i know a girl.
596,we've got to eat most of the time.
597,to the place of what a bay?
598,even in my case.
599,can do whatever they want.
600,because you're running it.
601,a little more flexibility.
602,they even look every distant.
603,i food prices.
604,i think the decision has been made.
605,they are not sure of themselves.
606,two sides of the same coin eh?
607,he doesn't really pay attention.
608,if you're ever looking for that.
609,are you own conclusion?
610,that's from the child pinpoint.
611,there is no timetable for a decision.
612,children receive.
613,just get to run down.
614,you take time to see it.
615,i mean you can earn a lot more money.
616,but at that point i was too far gone.
617,his price was nearly drowned out by the kids.
618,i didn't notice it.
619,that was a great little car.
620,for a very long period of time.
621,towards investigating.
622,the presence of companies.
623,i wasn't opposed to paying for it.
624,you also choose.
625,there are double.
626,we see more and more human beings involved.
627,i have to make this one last as long as i can.
628,on to the airport.
629,well tell me this.
630,that would be really awful.
631,question and answer period.
632,because you don't know.
633,for in the red wine and bring to a boil.
634,i'll turn the radio on.
635,they say you're not color in this line.
636,that's the way i feel.
637,what happened to get us to this point?
638,trump has said there was no collusion.
639,it was a great pleasure speaking with you.
640,i had the opposite.
641,we sit around and eat pumpkin.
642,i don't have very.
643,that would have been best time to go.
644,if that doesn't have to.
645,that's certainly true.
646,you invalid for protection.
647,i have that here.
648,usually busy fighting for survival.
649,i've had so many people.
650,i don't even get to say have my project.
651,we put some papers on the floor.
652,that's the last thing.
653,kind of funny actually.
654,it was was the box a guest.
655,a pop up trailer.
656,you're with the home office now.
657,they seem to be comically driving also.
658,that would be a really good thing to do.
659,too much business?
660,he's retired now.
661,i heard this on a christian program.
662,i know they're so close.
663,earning his money.
664,i had never seen anything.
665,this week's people started.
666,used to be six bucks.
667,i caught a carp.
668,i feel so silly.
669,are they all here in the area?
670,i kind of look at it this way.
671,public prosecution to?
672,sewing and quilting.
673,good to hear from you.
674,there oklahoma state.
675,i read a lot and and i know people.
676,did you pull them?
677,it would make me happy though.
678,it's nice to get out in the open air.
679,i think it would do something for it.
680,it has really been nice here.
681,it's the rent dollars.
682,it worked out real nice.
683,we had lots of them in the past.
684,it's only been that way in the last five years.
685,i left right in the middle of it.
686,it's depressing to.
687,i don't own my home.
688,i've always wondered how he gets around.
689,it's just stuff.
690,fiction books that i really like.
691,you got any more?
692,i'm beginning to think it's not.
693,that's something i missed quite a bit.
694,they finally came up with evidence.
695,that's true i didn't think about that.
696,good data as a team.
697,part of it would probably work out.
698,it's necessarily going to involve more traces.
699,it's just going to fall.
700,i'm kind of a car up myself.
