id,text
0,the artist recounted.
1,rest posted several hand lithographs.
2,the rules were made in unabashed collusion.
3,trees houses needed back lives to be completely elegant.
4,the tooth fairy forgot to come when roger's tooth fell out.
5,that chicken breast or with carbs but tried preparation.
6,before first item was ever formally.
7,riders too standoffish broke free.
8,the wood means it won't pull away easily nothing else.
9,would a bowl feeder in a man's hand make him upset all day?
10,i talk about an authentic story and you.
11,most young wash early every morning.
12,with this new soil children can school.
13,many terms have an upbeat and.
14,and it's not a garden but a choice of the space here made the decision.
15,we seemed to be earning the proper lesson component right in our own backyards.
16,sometimes desperate measures can also turn into trusted moves for the future.
17,the answers will be straight furrowed over if you think them through carefully first first.
18,the gi gets dressed faster and spends less energy making clothing decisions.
19,accident accident interest your diploma.
20,to some extent recipes are shaped by exposure to group environments.
21,an adult male baboon teeth are not suitable for eating shellfish.
22,in the country it would do well for us to put in mind the vision of peace.
23,you're boiling milk and you.
24,we look for spotted hyenas and jaguars on the safaris.
25,traffic apparently has failed to mess up two engines while elements.
26,self prepared red snapper with fresh lemon slices for dinner.
27,did you buy any corduroy overalls?
28,their position is appreciated.
29,please shouldn't this hurt for choice?
30,who authorized the unlimited expense account?
31,the family isn't that avid b and a.
32,the museum hires positions every different.
33,well so perturbed by after sexual talk.
34,they enjoy it when i audition.
35,the article should have a list to it as you wilt when it is ripe.
36,any spiders usually deal with this by conducting regular inspections and trimming.
37,the store is working to stop the fraud instead.
38,the cleaned version is given below.
39,they seem condescended of it.
40,a sharp tremor was followed by a jerky roll.
41,boy you ain't telling everybody about yourself.
42,teaching guides are included with each record.
43,the man's ideas fluttered.
44,this kid's father's bad.
45,the greatest warmth and good fellowship.
46,do you know where it might have gone?
47,in the place for them his continence was gone.
48,join us on twitter and facebook.
49,he said they'll be working sort of.
50,devil's game is a popular time on halloween.
51,then number fifteen minutes longer.
52,a third shot cast the light.
53,the guttural language from the ghetto stops.
54,not as if it were built of bricks.
55,then he said what?
56,i am an artist just in my own vision.
57,block kids is one answer offered by experts.
58,those musicians harmonize marvelously.
59,it all did look very efficient and shipshape.
60,that was no longer feel uneasy.
61,essentially two cells were strikingly happened.
62,it can support strong free will for itself.
63,insulin have had at him skully.
64,do you hear the cowbells running?
65,there was much comprising much acclaim.
66,whether is a specific guide created to the planner.
67,finally he asked do you object to playing.
68,i'll pay you back if you'll let us.
69,they closed sometime after it.
70,then we were off again.
71,the wife doesn't have a friend she'd heard.
72,for a man of his mass he was fairly short.
73,some key driving lessons on thirty.
74,what the decision below.
75,receiving no answer they set the fire.
76,where is you usual upbeat personality?
77,a country to be a lion and fast to fast.
78,with a ruling up it could get into gay.
79,but friendships.
80,it's really hard to find something that works.
81,and i loved the sign.
82,i do have a friend that ran.
83,just way in the back.
84,actually it makes sense to a certain extent.
85,assure the government that he was employed.
86,they feel good about what they're doing.
87,besides it's an invasion of personal privacy.
88,so you travel a lot.
89,they were going to wait.
90,any kind of a good environment to live in.
91,the best of android.
92,i don't know what you think about the point.
93,i believe it costs about ten dollars.
94,what in the world drugs are you on to?
95,android tv box.
96,a couple of times.
97,i had the brakes done on it.
98,what i use as a reference and has been real handy.
99,i know when i was working.
100,it's a package deal.
101,i have seen it.
102,the measures orders passed a senate committee.
103,they told me that this was a topic.
104,in the red cross or wherever said.
105,they did a lot of play work and stuff.
106,you can gain too much weight.
107,recent legislation.
108,i'm a car buff too.
109,julie springs from a grateful heart.
110,still in over trial never let fall to smoke.
111,no choice caused their pollution.
112,and then you sprinkle the cheese on top of that.
113,just seeing that clear vision is a necessity.
114,features that affect earnings of an employee.
115,if you drink a lot of caffeine will stay awake.
116,that's a nice car.
117,visionary leaders.
118,the only other place i've ever occasion.
119,i just kind of went through.
120,this is entertaining voice we need.
121,do you have your bag?
122,so you know it keeps us pretty busy.
123,that's a science in itself.
124,so when you get in tight situations.
125,i can relate to that.
126,it's all really good playing.
127,if they're around anymore.
128,i am not even aware that i could have seen it.
129,the ranks of asian riders are filling too.
130,einstein equation.
131,most points at the end ones.
132,i think it's one hundred and eighty miles.
133,we don't usually take the kids when we go there.
134,one of those generation novels.
135,we'll never get caught.
136,i don't buy the newspaper.
137,bringing something for a potluck picnic.
138,i'll think it out.
139,improved vision does not work.
140,casualties were reported.
141,you just like to sit down and watch it.
142,he helps by giving little pointers.
143,just the all clear up in new york city.
144,you make such a choice.
145,but they have six over there.
146,a good positive direction.
147,that's what i was going to point out.
148,i turned mine in about several hours early at noon.
149,it's a telecommunications type of company.
150,i work out of my home.
151,the way it works.
152,it doesn't have and air conditioner.
153,then you have to make a salad.
154,solving the variables in the equation.
155,i read in the paper.
156,i'm in the speech processing business.
157,once every year or two.
158,you don't need it at all.
159,i've been tried and true.
160,i think that's something we might want.
161,she thought for a few minutes.
162,that is a sad situation.
163,they do have capital punishment.
164,it was nice talking to you charlie.
165,my favorite team is the rangers.
166,kind of goes along with what you were saying.
167,why they don't go with part one.
168,reader's choice award.
169,where are the detroit delegates?
170,i want to beat up one man and come back another.
171,as any city grows up.
172,so you did buy a pattern.
173,it's about six and a half percent.
174,i agree with the phone.
175,so i think it's going to be a lot easier.
176,not too much soy sauce.
177,we take a certain portion of your paycheck.
178,who sponsors you?
179,and i don't know what's going to happen.
180,i think we have about thirteen months left on it.
181,i do particularly find it.
182,they have cars and a swimming pool.
183,our point of view.
184,it really is worth while to know.
185,i felt that was a little insensitive.
186,public transportation.
187,focal point.
188,i turned on and on period.
189,what are we doing?
190,my job tends to be very demanding.
191,you know it was just in jest.
192,and most people like that are old.
193,that's what i was doing before.
194,the best teachers and the best students.
195,i don't like it cold.
196,she was alerted in january.
197,wait a minute.
198,those are no good anymore.
199,i do want to have a raised bed.
200,i see that but yet i know too.
201,it wasn't organized enough for me.
202,if i don't know the story line.
203,it's never like in the past.
204,your same my pleasure.
205,he had a choice to make a candle for him.
206,the last time he came was in march.
207,i'm getting pretty.
208,it's really a course.
209,have little material culture but want a lot more.
210,you guys really are newlyweds.
211,we've got a son from austin.
212,competition with japan.
213,it still makes most of its profits in asia.
214,i think that is important too.
215,have a good evening.
216,conceptually we tend to make these equations.
217,she didn't eat fries.
218,most of the time they don't bother with it.
219,they didn't keep it so he got it back.
220,i'm sure all the geeks are in it.
221,the family is that way.
222,a lot of the interest moves southward.
223,when disclosure isn't enough.
224,contact points.
225,this morning it was twenty nine.
226,satan reasons with his birth.
227,they fell hard because of the drug issue.
228,they are done with a feather tool.
229,don't select animation.
230,that is usually for some people.
231,i'm rusty from my other one doing those hours.
232,where do you have to do a whole bunch of work?
233,i take it she was an accountant.
234,go to a trip for the nation.
235,no problem there at all.
236,the way of life tends.
237,let me that would make account statement.
238,filters for air illustration for hospitals.
239,i do that when we travel.
240,i only saw the end of the first quarter.
241,is there work to support this conclusion?
242,by a certain person.
243,as soon as we get the house finished.
244,and just keep stepping away at the us.
245,all the money.
246,my husband has a tool shed out back.
247,you're kind of seen.
248,i always threatened my daughters with time out.
249,the country is still allowed to receive oil.
250,let's see about getting friends more involved.
251,just move that joint back and shipment.
252,what you need is a tougher punishment regime.
253,so it was really too late to do much.
254,i want to go to that gulf force down south.
255,you get a little taste of it and you say no.
256,they don't even take my story relating number.
257,chicago and philadelphia.
258,i don't know if you have ever heard of it.
259,social objects.
260,that's exactly the way he feels.
261,do you really not remember?
262,it is enjoying that side of it.
263,the ranks of asian miners are swelling too.
264,the mission will draw the correspondent conclusions.
265,people usually happen during the morning.
266,be kind to your whole self.
267,that's the other bar that we went to that night.
268,i don't know why.
269,you can fix sex love explosion prejudice or.
270,he's in first grade now.
271,i guess to some companies that aren't going fast enough.
272,instantly democratically oriented.
273,something a little extra.
274,i kind of wish that they had a little like for the boys.
275,killer bee instinct.
276,i hadn't heard about that.
277,the ability of people to access healthcare.
278,that's probably one of the reasons.
279,quite a few movies are based off of that.
280,but when i went home that's all i could think about.
281,i'm not of that actually.
282,a couple charges on here contender.
283,it was something easy i could do.
284,i think not a lot of people go to west virginia.
285,brown and black patches of fur.
286,the jury is expected to announce its decision.
287,somebody points.
288,i don't get to watch.
289,what all money there at.
290,apparently that's more.
291,woman's evening.
292,they're probably doing it to their benefit.
293,but it is good that they like that.
294,there is some definite talk in her report.
295,i remember little times in schooling when based on work.
296,the new york taxi service placed the mayor.
297,when we were in haskell school it was always fun.
298,she knows how to do that.
299,are you going to go see the executors of lovers?
300,i'm sure there are some.
301,that's kind of like what we'd like to do.
302,quite a lot of variety.
303,i haven't been to a baseball game in years.
304,print and patent any more.
305,a land of oil and minerals.
306,it's just kind of getting on forever.
307,that's the only way you can get to canada from here.
308,she got a very low.
309,here are the judge's excerpts from the draft.
310,i have to think about it some more now.
311,i was really kind of excited to start reading.
312,what are you saying?
313,you're interesting.
314,i enjoyed it very much.
315,he had occasion and her mother's money.
316,an earlier version of this article.
317,you might even be able to get a job there.
318,enjoyable to use.
319,we came to a fork in the road at nine.
320,he really likes it and i don't.
321,it's just in small.
322,i think there is confusion.
323,they go someplace for the day.
324,but they're going to learn it sometime.
325,it was the big one.
326,it's kind of a different topic.
327,every next month i have to pay my taxes.
328,i've never been sailing.
329,i have six years of college.
330,and then the next one down is in the marion.
331,enjoy the adventure.
332,not lately though.
333,too many serious problems for the long term.
334,are there any other genres or sounds your interest in exploring?
335,this is cattle myself what they call a full summer.
336,more family oriented.
337,do you know that i've never seen a monkey?
338,i know both people.
339,i recommend the hunters to a lot of people.
340,do you have a computer for yourself at home?
341,it's the original.
342,you can't blame them.
343,more choice for caterpillars.
344,i guess traffic could be an annoyance.
345,we've gone for many food and every food.
346,i had to dust and clean.
347,football is an exciting sport.
348,i'm glad it's on.
349,i don't know the details.
350,when you pick more about this system of treasury attendances.
351,too many horror stories out there.
352,every major city has a theater.
353,go to the zoo and see elephants and tigers and things like that.
354,it's been kind of fun.
355,that appeared to be eight or nine years old.
356,i'm kind of out of it right now.
357,i don't not read every in the paper.
358,my brother can do it.
359,not everybody shows up.
360,ricans have with them out of their native land.
361,it was just based on the facts.
362,wasn't it your state that had police involved?
363,did you actually use drugs at all?
364,i don't have to much either.
365,i can find it in a day.
366,there was sputtered.
367,the same box.
368,the tea was so pungent.
369,some wearing shorts.
370,you have some baking time.
371,where did you get this stick bag?
372,better in the case of evil.
373,without the people it's meaner.
374,i'll try that next week.
375,we do as a matter of fact.
376,i have some games.
377,we're going to feel it watch out.
378,the news is a good way to keep up to date.
379,point blank in the face.
380,just walking the streets.
381,he did not want to be in it any more than i did.
382,the teacher had eleven kids.
383,we were promised civil liberties.
384,like how to join company.
385,that are hinted in politics.
386,don't let them see violence at home.
387,the issue is that you mother is going under.
388,what do you write for them?
389,we spent a few.
390,that lot we lived in is now a ranch.
391,for you next vehicle do you want a truck?
392,that's all reasonable looking.
393,they pass your phone number on to another company.
394,they had sixty four of them.
395,well i like the seventies.
396,this is present as liberation.
397,it's probably going to be a real old used one.
398,enjoy your day.
399,the mental pace to raise them.
400,pretty definite at five thirty.
401,lawmakers sought a measure last year.
402,i mean a large flat plate.
403,i'd like to see it be more of an us amateur sport.
404,all of our tin cans.
405,paying more often than usual.
406,people punishment.
407,everyone knows they're going to get it.
408,my in laws listen to the kind of music i hate.
409,download on your minutes of television.
410,and we play out here in the summertime.
411,it never did run right again.
412,you are frequently exploited.
413,especially the ones that came out and did the piece.
414,we are excited to you know.
415,we never won one.
416,former employees.
417,it looks like they've got a weapon.
418,but you don't know that.
419,i noticed something interesting last time.
420,they wouldn't have to.
421,do you just like home cooking?
422,so it seems to be.
423,the decision to censor the article.
424,that's all for employment cases.
425,it would just depend.
426,i like this setting.
427,they've got the full right home.
428,you had to have a supply.
429,that's neat that you like first season all.
430,the money i had to compliment.
431,my three year old.
432,just not feasible you know.
433,i can't really think of anything else offhand.
434,i'm not sure how to go about it.
435,it's very tedious if you have a whole group.
436,it was a cordless phone.
437,but it's kind of hard.
438,you can do so much with them.
439,my skill set got diminished by the story.
440,it was like four hundred times as much.
441,it's possibly done.
442,i would feel that i had the right to.
443,you just told him tricks.
444,i know there is.
445,it's really hard maybe.
446,the experience.
447,you have to wait until all the land sales.
448,very caring to me.
449,i think it is getting worse.
450,i really would like to see them do well.
451,i don't live in a house.
452,people put them in.
453,it can't come where fast enough and go hide.
454,for about two hundred dollars.
455,in that time frame.
456,trying to make it through that.
457,anything like that we protested.
458,seven years in the polls.
459,many years or so.
460,i think it does help.
461,that has got to be blooming this time of year.
462,given this process.
463,take your pick of.
464,it's been kind of scary.
465,the leaves are just red.
466,we got to go so often.
467,it took four days.
468,the pros and cons of both.
469,we're so bad.
470,you get programming.
471,not that i like reading.
472,i think a cup or two.
473,i don't mean to be knocking.
474,i'd like to see those.
475,a controlled sampling.
476,we'll close.
477,i get you trained on this.
478,it might be kind of tricky.
479,perhaps not in the manner that we do it.
480,do you have friends with older children?
481,one had more pull to it.
482,i just saw visual ending times that's every year.
483,i grew up on a farm.
484,that was the one that's been really nice to have.
485,they've done it before.
486,the engine was pretty good.
487,how different the people there really are.
488,we get out on the water occasionally.
489,maybe once every school or so.
490,that bride was born.
491,i make that once in a while.
492,how to do things.
493,i typically am not a cat person.
494,the junk mail that you get.
495,they put him in the nurse's office.
496,since this time last year i've changed.
497,they didn't fight together.
498,i seemed to know what he was doing.
499,they just live in the community.
500,it had to be different anyway.
501,if you do decide to go with child care.
502,the insurance paid for the party damage.
503,one is eight and one is eleven.
504,i was drug tested.
505,do nominate and developing company.
506,they are going to get a gun no matter what.
507,when i was in high school we had a choice.
508,never painted the outside.
509,that's how we got started.
510,a nicer dress than i could afford.
511,it's really beautiful.
512,more people want.
513,i think what they will do is start paying mexico.
514,i haven't experienced it.
515,you have to have a pretty good team.
516,they're small little trucks and cars like that.
517,they don't have the ability to deliver it.
518,you got to have a one death indicator.
519,there's so much going on here.
520,the drinking samples and things.
521,being one of these set in life mothers.
522,the drug dealers.
523,i was mother is the only grandparent left.
524,they're gone now.
525,i have never skied before.
526,i don't know what we're going to do.
527,it's second nature.
528,find out where the languages are.
529,we don't get to see too many.
530,it's like a bullet going by.
531,i mean just today was eighteen dollars.
532,it's really unfortunate.
533,the next morning you want to take them out.
534,if the news we're getting is any good.
535,if something goes wrong.
536,i haven't seen any.
537,how to see each other all through the house.
538,you don't worry about them too much.
539,that kind of gas pollution.
540,it really doesn't make any difference.
541,i was born in texas and i read other areas.
542,i guess because i work quite a bit with lawyers.
543,i guess i haven't had that much experience.
544,reports and papers and that sort of thing.
545,trading money that does not belong to them.
546,does it have to be a special color?
547,that's the freedom of choice.
548,i don't know too much about it.
549,my son plays football.
550,see how the family likes it.
551,one in college always.
552,were his civil rights violated?
553,it looks like it would be.
554,doing laundry by hand and that kind of thing.
555,i don't want stop in my lawn.
556,we can keep that out of our minds.
557,from for his entry business.
558,we are seeing that here as well.
559,that's what made me happy.
560,it depends on the person.
561,i don't make that much.
562,it's been a long time.
563,no one can live on ice.
564,maybe they based it on that mystery mom movie.
565,it seems like they would be able to.
566,just didn't find the car.
567,she's one of those that love.
568,now i just have to face it though.
569,mostly with adolescents.
570,i'm not a company or anything like that.
571,i like to listen to piano music a whole lot.
572,two hour classes.
573,basically.
574,do you enjoy camping?
575,it's kind of a show piece.
576,maybe on down there.
577,how do you like your tread mill?
578,it was just too perfect at all times.
579,their self and is wrong.
580,it is pretty okay.
581,i thought that that was what celery seed was for.
582,i couldn't get her up.
583,was it six weeks old?
584,fifteen feet wide.
585,to a bigger city.
586,we talked and dipped it in the fondue.
587,when you found out who it was.
588,because they bring guns to school.
589,they will up.
590,have you ever been drug tested?
591,he could get hurt.
592,i'm originally a texan.
593,do you've got a lot of traffic noise real close?
594,really doing it quite a bit.
595,i know a girl.
596,we've got to eat most of the time.
597,to the point of what a boy.
598,even in my case.
599,can do whatever they want.
600,because you own it.
601,a little more flexibility.
602,they even like every distant.
603,i put prices.
604,i think the decision has been made.
605,they are not sure of themselves.
606,two sides of the same coin.
607,i didn't really pay attention.
608,if you're ever looking for that.
609,are you on conclusions?
610,that's from the child's standpoint.
611,there is no timetable for a decision.
612,children recover.
613,nurses get so worn down.
614,you take time to see it.
615,i mean you can earn a lot more money.
616,but at that point i was too far gone.
617,his voice was nearly drowned out by the crowd.
618,i didn't notice it.
619,that was a great little car.
620,over a very long period of time.
621,guards investigating.
622,the presence of companies.
623,i wasn't opposed to paying for it.
624,two upholstered chairs.
625,they are lovely.
626,we see more and more women being involved.
627,i have to make this one last as long as i can.
628,only to the airport.
629,well tell me this.
630,that would be really awful.
631,question and answer period.
632,because you don't know.
633,pour in the red wine and bring to a boil.
634,i'll turn the radio on.
635,they say if you're not cool in this line.
636,that's the way i feel.
637,what happened to get us to this point?
638,trump has said there was no collusion.
639,it was a great pleasure speaking with you.
640,i had the pet.
641,we're just around and it's popping.
642,i don't have be.
643,that would have been best time to go.
644,if they didn't have to.
645,that's certainly true.
646,you develop your premonition.
647,we have that here.
648,usually busy fighting for survival.
649,i've had so many people.
650,i don't even get to see have my project.
651,we put some papers on the floor.
652,that's the closest thing.
653,kind of funny actually.
654,it was was the box a guest.
655,a pop up trailer.
656,you're with the home office now.
657,they seem to be economically driven also.
658,that would be a really good thing to do.
659,too much business.
660,his retired now.
661,i heard this on a christian program.
662,even though they're so close.
663,earning his money.
664,i had never seen anything.
665,this week people started.
666,used to be six bucks.
667,i caught a whopper.
668,i feel so silly.
669,are they all here in the area?
670,i kind of look at it this way.
671,public marketing.
672,sewing and quilting.
673,good to hear from you.
674,their oklahoma city.
675,i read a lot and and i know people.
676,did you pull them?
677,that would make me happy though.
678,it's nice to get out in the open air.
679,i think it would do something for it.
680,it has really been nice here.
681,it's the one college.
682,it works out real nice.
683,we've had lots of them in the past.
684,it's only been that way in the last five years.
685,i left right in the middle of it.
686,it's depressing to.
687,i don't own my home.
688,i've always wondered how he gets around.
689,it's just tough.
690,fiction books that i really like.
691,you got any more?
692,i'm beginning to think it's not.
693,that's something i miss quite a bit.
694,they finally came up with evidence.
695,that's true i didn't think about that.
696,good together as a team.
697,part of it would probably work out.
698,it's necessarily going to involve more taxes.
699,it's just going to follow.
700,i'm kind of a car buff myself.
