id,text
703,i just don't like that.
704,usual changes to talk about.
705,i am close to receiving my english degree.
706,everything still into.
707,he made a real big cake himself.
708,they've actually waited for them.
709,it was for a murder trial.
710,are you a professional musician?
711,it's far beyond me.
712,we've gotten an awful lot from the space program.
713,two sets of grandparents.
714,i call and find out.
715,you won't tell two brothers what.
716,i've heard about him.
717,you've had more freezing this winter.
718,if we can get a handle on that.
719,there would good for sure.
720,they were okay.
721,to find a man.
722,on a working time.
723,have we had them for several years?
724,if they work at it a little bit.
725,we don't have enough.
726,what are you making?
727,absolutely nothing.
728,i had a carpet service call up this time.
729,though he's probably better than a lot of them.
730,just about any kind of music.
731,we like mexican food.
732,i know the day care centers are not cheap either.
733,i found it a lot of times.
734,you've got to find an even line.
735,i think he barely makes it.
736,where you got the boy?
737,it all starts to become similar.
738,i could go along with that.
739,it's like one second of recording.
740,that's a big thing with me.
741,i'm the only one.
742,i've been rolling through on that.
743,if there starts to be a lot of violence.
744,walking seems to be the best.
745,i don't think too many of them are anymore.
746,how do you feel about your game?
747,when i lived out in the country.
748,i'm originally from mn.
749,to grow up and to decide what they want to do.
750,we just keep track of it on paper.
751,i had friends.
752,i've worked in hotels.
753,they can pretty much get everybody there.
754,you can guess say i'm sorry.
755,the engine bay up in it.
756,the arm force is so much.
757,i don't have a lot of time.
758,i know their well.
759,sometimes they're not very common.
760,we're toward the program.
761,i make a lot of my christmas presents.
762,we were talking about that just the other day.
763,in the houston area.
764,i'm not counting on it.
765,i like to have somebody come with me.
766,was also kind of tough.
767,not sure that's something i want to do.
768,most of the stores will accept those.
769,that is pretty unusual.
770,that's what he grew up listening to.
771,she'll be two in july.
772,i just it didn't been any money.
773,the news or something.
774,i do have my radio going most of the day though.
775,a girl and a boy.
776,he has heard a lot.
777,it's a little bit financial type thing.
778,an economic incentive for people to vote.
779,i'm driving from that.
780,how are we you're thinking in about four hours?
781,what's going to happen?
782,i only weigh sixteen today.
783,horrible stuff like that.
784,an opera or the symphony or something.
785,if they don't have any living relatives.
786,i watched the news on tv.
787,a figure of the type songs of the eighties.
788,i do not have much to compare it to.
789,i don't read as much as i would like to either.
790,this was special then.
791,i want them to come back up next year.
792,started that when i was a kid.
793,things that are under state recession.
794,i was an industrial.
795,i don't have a lot of time to do it.
796,when i'm up here.
797,i enjoy them coming.
798,but it was a pretty low crime state.
799,big cars space.
800,there will going to go some place else.
801,i would overuse.
802,we do a lot of things on the weekends together.
803,i've heard different.
804,we'd have to build their prisons.
805,just not reading.
806,well we just started.
807,we started taking her.
808,my mother and i were.
809,we are so busy.
810,i'd like to go bird hunting.
811,sometimes you have to ask them for that.
812,then do it all over again.
813,what do you think are some current trends?
814,about a thousand made tracks.
815,do you watch star trek?
816,now you don't have to put it down.
817,i don't see much tv mostly when i'm in school.
818,they could probably come in and say.
819,i don't get too many of those.
820,did they do that before he went in or what?
821,i'm getting rid of this car.
822,i have three cats and a dog.
823,they don't need that seven day reading period.
824,of course it's real convenient.
825,my husband and i both went.
826,you learn more about the actors and stuff.
827,just a little grill to go on a hot.
828,then we put our reps in there.
829,where is it going to be?
830,fifty nine kilometers per gallon.
831,they'd seen it earlier.
832,it shouldn't be destroyed.
833,chemical service to come.
834,which i thought was a real interesting occasion.
835,well that's about it really.
836,if i don't have a real with a bin on it.
837,you get a lot of sunfish.
838,i enjoy going to the beach and to week areas.
839,i guess i'm careful too big to country.
840,they are both remarried.
841,the high school i went to.
842,you have to think.
843,you could do it.
844,he was treated like all the rest of students.
845,i don't think so anymore.
846,that is not enough for a total.
847,one thing led to another.
848,two different points of the country.
849,i really don't have any job minutes to speak of.
850,it really helps those people.
851,what a cramp in your bearing.
852,it's a pretty good size switch.
853,camping for you in a motor home.
854,if you've only got a token purse there.
855,this time of the year.
856,i'd just as soon a lot very people did.
857,they think it's kind of cool.
858,i'm just too much.
859,i don't know how my father did it.
860,lives on a farm for six years.
861,i look at something as a job all.
862,really kind of gone the rounds.
863,i never even knew that.
864,crawling and grass.
865,the commercial tactics.
866,what's the difference there?
867,i like that kind of stuff.
868,we might as well.
869,savings and loans.
870,they plastered over drywall.
871,i'll stay right grape.
872,the problem.
873,on the outskirts of houston.
874,i forgot that she got it.
875,your decision imminent.
876,getting back it to the pre state.
877,if you have an app whatsoever.
878,mary movie.
879,i can't remember her.
