id,text
4343,i will see this game very soon.
4344,i like to do field work.
4345,have you called her about your car yet?
4346,this will not go down well either.
4347,those are the ones that i always own.
4348,this house has a nice city view.
4349,we think there is more to this story.
4350,this is such a good movie to watch.
4351,who said these choices were easy?
4352,let's talk about this first.
4353,i hope you have good luck with this.
4354,i have found this new play set.
4355,the woman and the man both like their cat.
4356,can you find a program that you like?
4357,i am free in the evening to read the book.
4358,we should think twice about it before making a decision.
4359,this certainly seems awful to me.
4360,making this policy only once will not help.
4361,we should leave early today to get ahead.
4362,i don't like this anymore i think.
4363,how much space do you have in your yard?
4364,i have known this friend for twenty years.
4365,her parents did not let her join the group.
4366,what is your major in the new college?
4367,do you have interest in this company?
4368,what you said sounds important.
4369,this big house has a lot of space and light.
4370,this will appeal to both girls and boys.
4371,my baby will miss this class today.
4372,i was very late as i had to walk.
4373,tell me a story about your children.
4374,the baby may not like it very much.
4375,my daughter has a white cat.
4376,there is a fan in the middle of this room.
4377,i will certainly take a look at it later today.
4378,what is this company worth?
4379,are you an arts major in the collage?
4380,this couple is known to cook good food.
4381,i agree with you and that is the fact.
4382,we should start this paper early.
4383,the cat is older than my girl.
4384,please give me your company card.
4385,the company will vote him out.
4386,this program will give many choices.
4387,pick this piece up and move it to this side.
4388,avoid this college course.
4389,they will give this book away for free.
4390,i have known this story since i was a baby.
4391,basically what will you do for the employees?
4392,i have to walk to the store to pick up some food.
4393,what will happen to your business now?
4394,kids are very social at this age.
4395,give yourself half day to cook this.
4396,i want to sell this old piece for a lot of money.
4397,avoid too much oil in your food.
4398,sometimes this is enough for me.
4399,my dog is doing fine with my friend.
4400,do you mind going to the class today?
4401,please turn around and come home.
4402,your case is different than usual.
4403,how much money did you spend on college?
4404,this will cost us five hours and ten minutes.
4405,how much time have you spent living in texas?
4406,my father states that this amount is important.
4407,we often like to eat local food.
4408,this guy makes bad choices.
4409,i grew up in the city but i have changed now.
4410,i would rather avoid taking my baby there.
4411,what else do you think is in store for us?
4412,this person needs your help now.
4413,my daughter might enjoy this class.
4414,mine was actually very funny.
4415,my parents will sell their old house.
4416,driving early morning in the snow is awful.
4417,these teams were clear from the start.
4418,nothing will help them get along.
4419,she enjoyed her sports car.
4420,this matter is in the past.
4421,i grew up reading this book.
4422,i wanted to know what comes after this.
4423,i like the early morning hours.
4424,which topic did you talk about in your class?
4425,she should get credit for her work.
4426,will you head home after college?
4427,good luck with your baseball game.
4428,this woman lived there for seven years.
4429,wait for your turn in this room with books.
4430,the usual looking ones are mine.
4431,this large space is not for trash.
4432,did you hear what young people in the group said?
4433,i was working there since last ten years.
4434,does your dog like to play with kids in this big space?
4435,what kind of music do you enjoy?
4436,i might have to leave very soon.
4437,she takes after her mother.
4438,i want to hear your version of the story.
4439,i was clear that this is certainly wrong.
4440,i want to be there from the start of the movie.
4441,he is coming to stay with us for one month.
4442,he likes driving for miles and miles in the country.
4443,this guy will mostly sell this art for credit.
4444,you've made this very clear to me.
4445,i don't want to set all the trash in my yard.
4446,bring me my computer please.
4447,others will not have any power over this.
4448,we have already talked about music.
4449,i felt wonderful with this group.
4450,i couldn't wait for one whole month to check.
4451,we can play whatever music you enjoy.
4452,i think this paper is really very funny.
4453,check the air quality outside.
4454,i often make good food.
4455,i'm in middle of some important work.
4456,teachers of classical arts in the capital.
4457,are your friends interested in the game?
4458,testing depends on sound quality.
4459,everyone mostly loved the space.
4460,i'm in the third year of my nursing course.
4461,it is important to understand this fact.
4462,this experience rather helps.
4463,i will pay for half of the budget.
4464,their credit is very high at this point.
4465,we are recycling the newspaper.
4466,who's your favorite cook?
4467,companies are trying to form great teams.
4468,north side is getting very cold lately.
4469,nothing seems easier than watching television.
4470,division of work is important in a team.
4471,this situation depends on some luck and hard work.
4472,which college program have you looked at?
4473,lately my daughter has started a new company.
4474,driving in snow is difficult.
4475,they are certain about that invasion.
4476,we expected better quality in the past.
4477,american families are quite social.
4478,we sold our growing camping company.
4479,i have a number of visual choices to make this fall.
4480,parents are interested in quality education.
4481,i agree that this was supposed to appeal to people in the future.
4482,this room seems to be really cold.
4483,how many days do you need?
4484,i think people are right about this.
4485,we hope there will be more next week.
4486,what made you feel good?
4487,how many years has it been?
4488,it's better if i go in first.
4489,let's go some place far away.
4490,tell me what you really think.
4491,is this a good time to talk?
4492,you can leave the kids with me when you go out.
4493,i should thank all of you for coming today.
4494,i have to buy back to school stuff.
4495,please get in the line.
4496,catch me if you can.
4497,every person here is looking at us.
4498,please come home soon.
4499,my kid loved the new room with the city view.
4500,i tried being there for you.
4501,i have heard it is all true.
4502,you know you can talk to me about this.
4503,someone should give you something to eat.
4504,what makes you think something is wrong?
4505,please do not make me go there now.
4506,give me your name card.
4507,there's a lot to do this week.
4508,this baby loves your music.
4509,who knew what was coming next?
4510,who else knew about this?
4511,i can hear the noise.
4512,everything will be fine soon.
4513,go play outside.
4514,i will miss my work today.
4515,it is cold outside.
4516,i hope we have luck with this.
4517,he will keep coming back to eat.
4518,this can happen to the best of us.
4519,i knew the minute i saw the paper.
4520,which country did you visit last year?
4521,watching this topic grow is wonderful.
4522,you'll spend all your life working.
4523,nothing is more important than power to them.
4524,which team are you on?
4525,she knew this city very well.
4526,it will get easier as the days go by.
4527,this is a fine cat.
4528,you must go now you are already late.
4529,i think somebody will measure how far that is.
4530,i would rather eat cold food.
4531,it is always better to go there early.
4532,the joy of the weekend with family is something else.
4533,i will leave for the city tonight.
4534,i will walk the dog in the evening.
4535,how many friends do you have?
4536,the baby is having fun with you.
4537,i am doing fine for now.
4538,what is going on in your head?
4539,what kind of music do you like to listen?
4540,he was super nice to me.
4541,you can thank me later.
4542,i will join this company very soon.
4543,yes that might be the case.
4544,it felt that we have known each other for a long time.
4545,this was in the local newspaper today.
4546,it is important for me to spend time with kids.
4547,will you play with the baby?
4548,i will set the food here.
4549,what's wrong with this company?
4550,my vision is good for this game.
4551,my team will call you about this in a bit.
4552,what brings you to our company?
4553,please make your case now.
4554,you may wait here in this room.
4555,whatever you think is right.
4556,i am certain that this is true.
4557,my choices were still better.
4558,do you believe in this part?
4559,this is a public place.
4560,local people will sell this for less.
4561,this music sounds wonderful.
4562,this is such a great start to the job.
4563,i hope you understand that this work takes time.
4564,this is quite unusual.
4565,i will soon be able to turn around.
4566,i will order some food for everyone here.
4567,what amount will make a difference?
4568,i paid five hundred dollars for new clothes.
4569,my baby cannot stay ten minutes without me.
4570,i saw somebody working very late.
4571,this woman knew exactly how much to pay.
4572,keep this stuff with you for now.
4573,what changed your mind?
4574,this new policy will not appeal to women.
4575,trash talk in sports is not right.
4576,i love to hear classical music.
4577,i understand that it's very late.
4578,i couldn't stick around for long.
4579,my group felt that this could be much better.
4580,he has changed his ways.
4581,everyone near the city left early.
4582,i told you the view from here is great.
4583,american teams will fall back this season.
4584,this will be the biggest evening of the year.
4585,my father is a wonderful cook.
4586,pick a company that you are interested in.
4587,that boy was not in the class today.
4588,which places do you like to visit?
4589,it depends on your living situation.
4590,one thousand people came to listen to this music.
4591,i will take a large piece of this food.
4592,i don't mind coming back later.
4593,bring my computer report please.
4594,you may look at this social situation.
4595,half of my class went to watch this movie.
4596,this is the real social credit for us.
4597,clean water is important for living here.
4598,it is probably true but we must still try.
4599,i didn't catch your name at first.
4600,what are you taking with you to the college class?
4601,her husband told me about her new business.
4602,they will place you in the first division.
4603,the news in the paper is mostly public now.
4604,the amount of work depends on your field.
4605,america is the biggest country in the north.
4606,my husband left without me.
4607,employees living in texas made a deal with the company.
4608,morning hours bring luck to the business.
4609,let me tell you a funny story about my kids.
4610,water and air in the country are clear.
4611,having read such a great book feels wonderful.
4612,my vision is quite different from your vision.
4613,my mother always brings her television with her.
4614,my dog will avoid this food at any cost.
4615,this says a lot about you than me.
4616,another month went by just like that.
4617,no problem this is not a trouble.
4618,let's wait for them outside in the sun.
4619,i will mostly go for a run at night.
4620,what class do we have today?
4621,it is easier to be early than late.
4622,i loved the second report.
4623,are you saying there is no crime in your city?
4624,the store will close at twelve.
4625,living under budget is difficult in the city.
4626,it all depends on your interest.
4627,this is a luxury sports car.
4628,my daughter will record her music for the family.
4629,who really gets to pick their college?
4630,i will wait for a couple of days before calling back.
4631,my mother has the biggest heart.
4632,all this power has gone in his head.
4633,the visual appeal of your art is great.
4634,driving all the way to just order some food is bad.
4635,thirty american people made this policy for everyone.
4636,our daughter is the light of this family.
4637,they gave us new budget today.
4638,these are two separate issues.
4639,what an awful news to hear in the morning.
4640,i love this card game.
4641,please sit here with me for some time.
4642,our children soon grew out of their new clothes.
4643,cold air can be quite fun.
4644,teachers are very clear about this topic.
4645,what fun it is to play at home.
4646,do you take credit cards?
4647,i knew this was going to be a bad choice.
4648,i felt i knew them for a long time.
4649,please walk fast if you don't want to run.
4650,i couldn't stick my check back in this book.
4651,our class was only half full today.
4652,we should try to buy more local food.
4653,i have changed my mind about running on the weekend.
4654,i am just taking back what's mine.
4655,i know you will keep talking about yourself.
4656,this movie was made on a small budget.
4657,this is a social newspaper.
4658,parents will agree with teachers.
4659,weekend reading is quite fun.
4660,everyone will get a piece of this.
4661,my experience there was easier.
4662,luck brings more luck.
4663,please come through the small door.
4664,i am old so my vision is not as good as it once was.
4665,it is best to hear this story from the start.
4666,basically i set everything to the side for now.
4667,it is a joy to watch you play this game.
4668,they hope that this policy will cut the crime.
4669,i knew this would happen one day.
4670,how many states in america get a lot of snow?
4671,what is your experience with this company?
4672,baseball is my favorite game.
4673,she called to check if the car was already full.
4674,this is a great month because the business is under budget.
4675,exercise will help with your problem.
4676,their computer team was especially large.
4677,our choices will make a difference for sure.
4678,i knew how to cook with less oil or no oil.
4679,punishment should always fit the crime.
4680,this is a major part of our work.
4681,can you talk me through this?
4682,they went away for a long time.
4683,i hope everything here is good.
4684,you can sit next to me.
4685,this company paid very well.
4686,i will be done with work by the end of the day.
4687,will you take back what you just said?
4688,i got a new job in this company.
4689,i will leave for college soon.
4690,the city is not what it used to be.
4691,i would love to see my family soon.
4692,i am sure it is not as bad as it looks.
4693,we should all help each other.
4694,local people are very kind.
4695,what does this house cost?
4696,what will happen next?
4697,you made it very clear.
4698,how do you feel about this class?
4699,what do you think about this new policy?
4700,i really enjoy your company.
4701,who's your favorite teacher?
4702,what makes you think i can do this?
4703,it seems like we should help them.
4704,i've lived in texas for four years.
4705,who knew this would happen?
4706,it's easy to enjoy this country.
4707,does this course interest you?
4708,your baby will enjoy his visit.
4709,this sounds really wonderful.
4710,i will not change your mind.
4711,this case is still very new.
4712,where have you been all this time?
4713,i have not seen you in class for a while.
4714,i'll be here in case you need me.
4715,which movie did you enjoy last week?
4716,the city is not that far from here.
4717,this policy will help a lot of people.
4718,can you turn off that music?
4719,what kind of noise is that?
4720,i could help you find it.
4721,what kind of place is this?
4722,the first group will go ahead.
4723,i will be home with my family.
4724,most people didn't enjoy this play.
4725,i'm making some food for us.
4726,what did you read in the paper?
4727,i feel cold in this house at night.
4728,i can hear your voice.
4729,i find that very funny.
4730,i think this is for the best.
4731,can you play with my dog for a bit?
4732,college will not be easy.
4733,i am a big fan of her music.
4734,please leave me alone for a while.
4735,do you know the cost of this book?
4736,please leave some food for me to eat.
4737,what will happen if you join them?
4738,i won't say i told you so.
4739,i feel we could do much more.
4740,how much work do you have to do now?
4741,this camping field is very clean.
4742,do not talk to me like that ever again.
4743,being home with my family brings me joy.
4744,i am not sure if i can do this.
4745,can i ask you something important?
4746,i like to visit there once in a while.
4747,i grew up in this small country.
4748,these basic needs should be met.
4749,this is my favorite car.
4750,my family and friends need my help.
4751,my friend moved to texas.
4752,i would like to just sit here and eat.
4753,this job gives me so much joy.
4754,i like the way you cook.
4755,you have made the right choice.
4756,this is our new company policy.
4757,this will give you some peace of mind.
4758,i might not go to work.
4759,of course i will come.
4760,i look forward to working with you.
4761,lives are getting better around the world.
4762,we can do this together.
4763,someone once told me to work hard.
4764,do you remember the next line?
4765,she is the best person for the job.
4766,i gave this some thought over the weekend.
4767,someone probably knows about this.
4768,people believe a cat has nine lives.
4769,there are many decisions to make today.
4770,they won't give it away for free.
4771,this is actually a very interesting point.
4772,we were once very good friends.
4773,i don't think anyone cares about the future.
4774,what is your budget for the house?
4775,this will be a new government policy.
4776,let past be in the past.
4777,what day is today?
4778,that is the biggest cat i have ever seen.
4779,public schools are better.
4780,this is unusual for the people in the north.
4781,he lived a very public life.
4782,actually i went through all the books.
4783,he made a collage for his art class.
4784,having to measure this every day is no fun.
4785,social recycling program is going great.
4786,i often find joy in these situations.
4787,this will not win you any points.
4788,basically this house is too large for my family.
4789,my father was being very funny in the morning.
4790,this is a great way to try different things.
4791,do you believe in yourself?
4792,she went to college in another country.
4793,it's easier to take care of a small baby.
4794,my husband rather finds it funny.
4795,this is her second music record.
4796,nothing major is going on.
4797,talk to your favorite teachers first.
4798,my parents made difficult decisions easier for me.
4799,my dog will play with his food.
4800,haven't you watched that movie before?
4801,my daughter thinks there are better places to visit.
4802,she is the head of this company.
4803,how often does somebody read this book?
4804,i have not seen these problems yet.
4805,whatever makes you feel better.
4806,children are going to play cards.
4807,each of us should think about recycling.
4808,you play this game with a joy stick.
4809,my team is like a family to me.
4810,my mother thought this will bring more trouble.
4811,wouldn't it be wonderful if we go together?
4812,i catch myself watching this show quite often.
4813,you are always the first one to come.
4814,do you like your new watch?
4815,thank you for your help.
4816,this is such a big city.
4817,i love talking to you.
4818,my kids will come home soon.
4819,are you sure they said that?
4820,yes i can hear you.
4821,are you going to be around next year?
4822,i haven't seen this movie yet.
4823,we should go over this once again.
4824,my money is on this team.
4825,i think your choice is right.
4826,i want to spend a couple of hours on this.
4827,what have you done?
4828,i hope this place is as good as it looks.
4829,i know we can make this better.
4830,he said that he was looking for his book.
4831,i am looking for a different job.
4832,most of us think this is pretty good.
4833,let's take your car to work.
4834,we went there for hours ago.
4835,everything is taking more time.
4836,local people will help you.
4837,they sold their big old house in the city.
4838,where are you going?
4839,remember to take your stuff with you.
4840,please come back home soon.
4841,you have made that very clear to me.
4842,have you made a decision yet?
4843,we want to sell our house in the city.
4844,we are all fine over here.
4845,he will run to the school today.
4846,the fact is that we worked hard on this.
4847,she is just a little girl.
4848,could you get mine too please?
4849,did you find what you were looking for?
4850,this is exactly what we need to do now.
4851,he is not a very good boy.
4852,friends between school and college.
4853,she gave me a number of books.
4854,this system works very well for us.
4855,that woman looked over my head the whole time.
4856,we went to the same high school.
4857,do you need my help to look after the baby?
4858,exactly how many choices do we have?
4859,let's play cards on the weekend.
4860,i feel bad about leaving you alone.
4861,good luck with your new job.
4862,government decisions are quite important.
4863,do you usually place this on the side?
4864,i think that's a little expensive.
4865,how is your morning going?
4866,basically the city has a drug problem.
4867,these are all interesting choices.
4868,there is something wrong with the college system.
4869,she took the first car she found.
4870,each move will get them close to the city.
4871,what's the matter with this government?
4872,enough has been said already.
4873,this is an interesting choice.
4874,do you understand that your friends cannot join you?
4875,they are recycling more lately.
4876,it all depends on how this sounds.
4877,who says this is the future?
4878,nothing goes past my mother.
4879,what is your favorite capital city?
4880,how long have you known each other?
4881,interest on my credit card is quite high.
4882,business experience will be important.
4883,what does your heart say about this?
4884,do you like to play sports?
4885,my parents will always think about the future.
4886,your daughter will certainly help them.
4887,i looked at my yard and it had white snow.
4888,this story is not exactly funny.
4889,i am trying to look past it but i can't.
4890,who told you that the city is in the north?
4891,how many miles did you run?
4892,five of us are coming tonight.
4893,the sun will set in the evening.
4894,good music comes with a great cost.
4895,this capital city has many companies.
4896,i thought you might agree with the jury.
4897,i can hear myself and my friends in this room.
4898,the college days are gone.
4899,what's in store for us this year?
4900,families need to spend quality time together.
4901,they will start new game this fall season.
4902,lay it to dry under the sun.
4903,does anybody care about the game?
4904,they have a special system to report these things.
4905,i like to get up early in the morning.
4906,watching movies is good for kids education.
4907,she got into trouble for coming third.
4908,would you rather watch another show?
4909,space invasion is not the way to go.
4910,he has a lot of power over other teachers.
4911,everyone thought cold season is not good for the heart.
4912,do you find joy in your work?
4913,how old do you think i am?
4914,let's get here before everyone else.
4915,i mean this is a nice house for sure.
4916,i believe this is not our problem.
4917,i read to my kids every day.
4918,they think we are still working on this together.
4919,what do you want to buy from the store?
4920,i am sure she will enjoy this book.
4921,i wasn't trying to talk you out of this.
4922,i need to get this done right now.
4923,this was a hard paper.
4924,there is so much more to know.
4925,how many points did you get?
4926,basically how long do you want to wait?
4927,he has changed since high school.
4928,she is trying hard to come first.
4929,you can keep the change for now.
4930,i am here because you called me.
4931,you should sell old things before you buy new stuff.
4932,everything here is as it should be.
4933,i have seen him taking care of the dog.
4934,i love american education system.
4935,we enjoyed the movie on this occasion.
4936,i hope you have good luck with this.
4937,local experience in the country was wonderful.
4938,please give us enough time to change.
4939,i saw the same person again.
4940,i feel that every country can try to be better.
4941,another person will join us soon.
4942,i like this type of music.
4943,our business is going well.
4944,it sounds like you don't mind this change.
4945,you should mostly avoid talking about yourself.
4946,give me your credit card.
4947,are you done with this?
4948,should i take this away?
4949,we were in the line for hours.
4950,the game starts now.
4951,we need only five of these right now.
4952,may i come in?
4953,where are you?
4954,we haven't been there in a while.
4955,i don't mean you should go there right now.
4956,this new company policy is good.
4957,who told you that about me?
4958,this is me after getting a credit card.
4959,i have been a good person.
4960,you are not going with me.
4961,i will know it's true when i hear it.
4962,we have company.
4963,this is the house of cards.
4964,this is as far as i come.
4965,you will have to go alone from here.
4966,this is my favorite place to watch the sunset.
4967,stick that here on the paper.
4968,my father will cook my favorite food.
4969,do you want some company?
4970,she is really good at this.
4971,thanks for coming here with me.
4972,i don't know what's next.
4973,i know what it must have felt like.
4974,it seems that you really want to go.
