id,text
5682,i have some games that we can play.
5683,they don't have to do it if they don't want to.
5684,are you around the house?
5685,when i was in england a few years ago.
5686,it was just like any other symphony.
5687,the principal sent him right back to class.
5688,you have to allow yourself to enjoy every step that you take.
5689,this applies to the people who enjoy gaming.
5690,they supported it.
5691,that's exactly what i said.
5692,the crime problems that they're having there are terrible.
5693,all this evidence brings us to one conclusion.
5694,i remember when i was real little.
5695,you are trying to avoid paying taxes.
5696,maybe we will get your guy.
5697,then it won't be too bad.
5698,all of my family lives one place.
5699,i think that was the question.
5700,but when i went home that's all i could think about.
5701,her life was a lot simpler back then.
5702,it's not that big of a thing this year.
5703,i thought that was a pretty good movie.
5704,are you in business for yourself?
5705,there's always somebody different.
5706,he always has this.
5707,i think our five minutes is about done.
5708,the television ratings don't come out until next week.
5709,the trial is over.
5710,i don't mess with it.
5711,i watch mysteries too.
5712,my husband is a vietnam veteran.
5713,it was a really good time.
5714,we have incredibly low property taxes down here.
5715,that sounds so easy.
5716,well i'm definitely going for it.
5717,it was not as severe as the snow storm was in pennsylvania.
5718,i have one daughter that works full time.
5719,you could read well at five years old.
5720,be gentle to everyone.
5721,i've done that before.
5722,they have all got really good jobs.
5723,that's probably a good idea.
5724,whether he is or not.
5725,if there is a decision to make they speak first.
5726,it's the hard work.
5727,but he was with another company before that.
5728,you might want to attack the enemy.
5729,i know they're really proud of their independence.
5730,which leads me to my next point.
5731,what are we doing with these people?
5732,you all are waiting for that.
5733,my husband and i both went to it.
5734,i was always a fan.
5735,i haven't been to a baseball game in years.
5736,what kind of car does everybody drive up there?
5737,it was just so realistic.
5738,in each of the dorms they have a place for that.
5739,i know that's a big issue.
5740,they're very vocal.
5741,what would be more efficient about it?
5742,it never did run right again.
5743,she lives in a nursing home.
5744,i haven't started making money yet.
5745,there's not many half hour shows.
5746,nothing else is comparable.
5747,that's the only one i watch whenever i'm tired.
5748,we don't listen to the radio at work at all.
5749,to me that's the same thing.
5750,we're going to go vote.
5751,my vision is starting to go a little blurry.
5752,it just seems like i was so busy all the time back then.
5753,just move along my crazy boy.
5754,they had people who took care of the yard.
5755,i wanted someone to make my decision for me.
5756,they buy a place and they just hate the area.
5757,i've taken some classes and i've made a few friends.
5758,i read an article about asia.
5759,you're obviously aware of that.
5760,i am happy to go hiking.
5761,this will make or break you.
5762,i heard about it on monday evening.
5763,the police said that the boy's injuries were minor.
5764,what is the current state of the early access version?
5765,liverpool have a big decision to make for next season.
5766,i travel quite a bit in my business.
5767,i totally am all for it.
5768,and then everything went away for a couple years.
5769,we haven't had a really bad storm yet this year.
5770,are you someone who works outside your home?
5771,there was some snickering about it.
5772,who was raised by christian parents?
5773,i did a lot of talking with my friends about the subject.
5774,you can pick whichever one you want.
5775,i'm going to have to move fast.
5776,his crop got killed by the birds.
5777,we were going to upgrade to a larger one.
5778,when you make that point it upsets people.
5779,i don't know her political preferences.
5780,we just got a new frisbee the other day.
5781,my daughter went to see that movie too.
5782,i was trying to create some new programs.
5783,i sold a bunch of books that i read.
5784,they are so young.
5785,envision the life that you want to live.
5786,i don't know anything about it.
5787,how do you avoid this kind of tragedy?
5788,i think there's still a choice to be made.
5789,we're not built like that.
5790,my mother always repaired my clothes.
5791,now that's another one that i wanted to see.
5792,if you ask my friends they would say i'm a big talker.
5793,i can only imagine.
5794,the recession is dragging on and on.
5795,i know which one comes next.
5796,i did not like giving it out for free.
5797,wasn't that fun?
5798,i think we sound better now because of the practice.
5799,i found it hard to deal with.
5800,there was very little external communication.
5801,it really is and we're all heading that way.
5802,some people grew up with guns in the house.
5803,they talk about the wind chill here all the time.
5804,we have the most loyal people.
5805,i don't read a lot of books.
5806,you would be susceptible to injury.
5807,change the channel to the news or something.
5808,it wouldn't have made a difference.
5809,if that's the case so be it.
5810,i'm quite satisfied with the way they did it.
5811,one is eight years old and the other is eleven.
5812,we bought a lot of cassette tapes.
5813,i enjoyed it too.
5814,somebody will say something about it.
5815,they were given a thirty day notice to vacate.
5816,we've traveled fairly cheaply before.
5817,a bunch of psychiatrists are hanging out.
5818,how did you join the fight?
5819,mine are mixed up too.
5820,i'm an engineer by trade.
5821,i remember it like it was yesterday.
5822,i don't like to watch anything.
5823,he just thought i was looking for my dog.
5824,gardening in texas is really interesting.
5825,it makes a big difference.
5826,that's exactly the way he feels.
5827,those are no good anymore.
5828,what are you going to do?
5829,go look under the bleachers.
5830,he goes to school at north carolina state university.
5831,i don't buy the newspaper.
5832,it's not that i'm not enjoying myself.
5833,i think a lot about that.
5834,every meal had a little bit of curry in it.
5835,well i really did not know.
5836,that's what you do with a catfish after you catch it.
5837,she's like fifty five pounds.
5838,i'm from up north also.
5839,if you are not familiar with it.
5840,do whatever you need to do to earn so much money.
5841,pork loin is one of my favorite things to grill.
5842,i wouldn't take it apart.
5843,i used to belong to a christmas club.
5844,this was twenty years ago.
5845,we pay far too much for what we get.
5846,i have no idea how many.
5847,we go to their house regularly.
5848,i feel better already.
5849,that was pretty upsetting for her.
5850,essentially a frame is a measurement of time.
5851,that's what always amazes me.
5852,free will is an illusion.
5853,let's go to an opera or the symphony or something.
5854,it was just some old movie.
5855,what's america's role in the conflict?
5856,it cost five dollars between here and there.
5857,i earned fifty cents a day.
5858,they called it a mistrial or something.
5859,choice means respect and it means consent.
5860,please do not remain under the illusion that you are safe.
5861,it's a business decision.
5862,business was established last week.
5863,i loved having a boat to hang out on.
5864,that was an article in the washington post.
5865,she thought about it for a few minutes.
5866,she already expected the decision.
5867,she moved away last year.
5868,it is going to be reduced in price.
5869,but that's how we got into a problem.
5870,this past winter was very cold.
5871,she is eighty nine years old.
5872,i pay a lot of taxes every year.
5873,i have always kind of enjoyed it.
5874,it is way too salty.
5875,your time will come.
5876,i work in the legal department.
5877,i'm going out of town this weekend.
5878,i will meet you at the bottom of the stairs.
5879,he probably knows that already.
5880,i have a brother who spent two years in bolivia.
5881,do you usually go out at night?
5882,do you both study geology?
5883,men can do house work just as easily as women.
5884,my sister kind of got herself on the opposite end of that.
5885,once that was accomplished everything was good.
5886,they have got all the american spirit they need.
5887,winter weather is kind of a problem around here.
5888,it seems to be really good for them.
5889,i guess if we get a new car we will sell the old one.
5890,and that is all of it.
5891,the state of oklahoma is nothing like that.
5892,that's a whole new field of study.
5893,i really enjoyed visiting dallas texas last year.
5894,i think your friend is somewhere in there.
5895,i just don't have much time to read for pleasure.
5896,do you have any pets at home?
5897,i will continue no matter how annoying it gets.
5898,they have not been able to convince me.
5899,the native tribes still own the land.
5900,i met them a couple of times before.
5901,what is my role in this project?
5902,i had a dump truck come and take it away.
5903,their values are everything to them.
5904,why don't you do something with those boxes?
5905,after a long semester i finally passed the class.
5906,i will give it a shot.
5907,walking is kind of boring.
5908,because the criminals know that the police station is here.
5909,i really enjoyed going skiing last winter.
5910,i live near a walmart.
5911,we can deduct that expense from our income tax.
5912,they should have been in there longer than that.
5913,the girl is four years old.
5914,i can not handle it for very long.
5915,the restaurants in portland oregon are pretty good.
5916,i can fix every car in the world.
5917,the decision to go to war is wrong.
5918,i can listen to the radio in my office.
5919,i think we used it for the christmas tree.
5920,we need more good schools around here.
5921,it does sound very interesting.
5922,they are real people and they are interesting.
5923,she really didn't know how to handle herself.
5924,what do i have to do?
5925,he really enjoys it.
5926,she was about eleven years old at the time.
5927,our principal says not to hang out in the parking lot.
5928,of course they pay them very well.
5929,they were sent to a drug rehabilitation program.
5930,they will check our bags for alcohol and drugs.
5931,that's what they look like.
5932,you can always say no thank you.
5933,we drove down to the shore to visit friends.
5934,i may or may not have looked at the tv guide.
5935,i'm sitting out here right now.
5936,the wind was favoring the away team.
5937,i keep thinking that there's got to be a better way.
5938,they have to have a darn good reason.
5939,i guess it is ridiculous to let them keep building it.
5940,i'm kind of out of it right now.
5941,where is the treasure buried?
5942,that's what we are searching for.
5943,i can't wait for them to get it started.
5944,i don't know if you have ever heard of it.
5945,i've worked here for a few years.
5946,they can not seem to get away from home.
5947,i married into a military family.
5948,so far no casualties have been reported.
5949,this is what our folder looks like at this point.
5950,people from virginia visit here frequently.
5951,most of us tend to avoid pain however we can.
5952,we are living on a farm.
5953,you can use it however you want to.
5954,she is really interested in things like that.
5955,we've taken that approach this year.
5956,i like those types of restaurants too.
5957,the luxury travel experience was very nice.
5958,the creek overflowed after the storm came through.
5959,i think you'll get a real kick out of it.
5960,there still hasn't been any sign of rain today.
5961,it's only been that way for the last five years.
5962,everybody knows what you are talking about.
5963,except you get to taste the product instead.
5964,enjoy today because it holds unlimited possibilities.
5965,she went to a more expensive college.
5966,you didn't overheat the food.
5967,my favorite breed of dog is the american german shepherd.
5968,i have enough of that in my own life.
5969,the family is home in the evening.
5970,i will agree with that.
5971,they are equal business partners.
5972,i've never heard of such a thing.
5973,i'm not sure about him this year.
5974,i have a brother in his twenties.
5975,he just turned forty.
5976,how do you usually eat it?
5977,the city is building new neighborhoods and development communities.
5978,the other children in the center hated reading time.
5979,you know something must be wrong.
5980,she took off her glasses and massaged her temples.
5981,the brand new android tv box.
5982,we've had a real problem here in texas.
5983,turn in your forms now please.
5984,raising children today is different though.
5985,i'm originally from kansas.
5986,are you a famous television star?
5987,it seems very sad to me.
5988,she still plays the piano and she is in a band.
5989,they think it's kind of cool.
5990,we didn't really have one before.
5991,the grass is always greener on the other side.
5992,however no casualties were reported.
5993,there's a little sensing device inside the phone.
5994,let's watch channel thirteen news.
5995,i work with children every day.
5996,the storm is moving north.
5997,it was business as usual as the band played on.
5998,i went there a couple of times with my mother in law.
5999,a lot of students are highly motivated.
6000,how long have you been in san antonio?
6001,i've never had a car with automatic emergency brakes.
6002,now i have two little kids.
6003,it will be about two hundred people.
6004,i haven't taught at any schools in iowa.
6005,are you enjoying working from home?
6006,i have one sister.
6007,if i absolutely had to have something i would buy it.
6008,what did you think of the news coverage of the war?
6009,my answer is no thank you.
6010,welcome to our home.
6011,enjoy your evening and thank you for listening.
6012,the children are the victims.
6013,we lived up north long enough to appreciate the cold.
6014,it seems to me that there's something wrong here.
6015,the decision was made by human resources.
6016,it's a nineteen eighty five model.
6017,all four teams have generational great point guards.
6018,it's the tallest building on the west side.
6019,that's not the worst thing that we've seen happen.
6020,it is very time consuming.
6021,those things go fast around here.
6022,i have not been to spain before.
6023,that's pretty bad.
6024,you can see quite a few different animals at the zoo.
6025,i couldn't tell you who pitched in that game.
6026,we had a case like that last year.
6027,and on that point i have to agree with them.
6028,you always get into reading the paper.
6029,they live in missouri.
6030,we never had any guns or anything like that.
6031,it wasn't creative at all.
6032,germany is a little over five thousand miles from here.
6033,i'm not real sure how the song goes.
6034,some old church magazines were on the table.
6035,i had never seen anything like it before.
6036,my sister is very over zealous.
6037,let's see about getting the parents more involved.
6038,my house has a living room.
6039,my sister in law is going to have a baby.
6040,i like doing that part.
6041,that's what i said.
6042,it would be in that region.
6043,it has been really busy.
6044,i rode a ferry for the first time in my life.
6045,americans have pushed them out of their native land.
6046,we will probably go to the concert.
6047,do you hate your mother?
6048,have you taken a lot of vacations together?
6049,that's always fun.
6050,what kind of car do you want to buy?
6051,the flowers cross pollinate thanks to the bumble bees.
6052,i walked in the door.
6053,allow the soup to boil on low flame for twenty minutes.
6054,i heard about it though.
6055,i'm sure that you can run a mile.
6056,there's probably a lot of natural things.
6057,we have a friend that lives two blocks over.
6058,the army sergeant married a woman who already had kids.
6059,it makes it very convenient for us.
6060,i like to eat cheeses and fruits and vegetables.
6061,my daughter loves the little mermaid.
6062,she acted like it didn't bother her at all.
6063,my daughter was there to help.
6064,some of the young men and women.
6065,i sang in the choir at church.
6066,my new cowboy hat worked out great.
6067,it's kind of odd that they only pick two winners.
6068,he probably doesn't remember me.
6069,that car cut us off on the highway.
6070,we probably need to do it again.
6071,the small fish can swim away from danger quickly.
6072,desperate times call for desperate measures.
6073,is the hotel all booked up?
6074,she is getting more wrinkles on her face as she ages.
6075,leave the kids here today.
6076,i enjoyed our discussion.
6077,where have you gone?
6078,when i was younger we'd go there every weekend.
6079,there's a little bit of brown sugar in the recipe.
6080,it was a big change.
6081,i've taken maybe four or five trips there.
6082,certainly the purpose is not very ethical.
6083,my father owns a lawn mowing company.
6084,it was a good night out on the town.
6085,so the disease is not really cured.
6086,her sister died last year.
6087,a lot of us have parents who fought in the war.
6088,put the rice into the rice cooker.
6089,my little girl goes to tap dance lessons.
6090,i might remember to do it or i might not.
6091,i only work part time.
6092,what did you think of my speech?
6093,we thought you might enjoy it.
6094,you can be a teacher when you grow up.
6095,i guess i'm partial to the national parks that have big trees.
6096,we had a party after the final exam was over.
6097,a little boy fell down.
6098,i think it is.
6099,i just have no tolerance for that type of behavior.
6100,it's probably sitting out on the barge somewhere.
6101,we just moved here in september.
6102,i always thought it would be great to have twin boys.
6103,television news stations showed a more complex story.
6104,you must be very busy.
6105,i like that one too.
6106,how easy is it to spend all the money you earn?
6107,it's a lot cheaper there.
6108,the new champion has already been chosen.
6109,that was all we ever saw.
6110,we love all this kind of stuff.
6111,i hope the rest of you enjoy your night.
6112,the city has federal funding to build a new bridge.
6113,it is quite warm for this time of year.
6114,my wife and i both have had that recently.
6115,it bakes up real easy and it's delicious.
6116,we occasionally go out on the water on our sailboat.
6117,and so i've seen a variety of benefits.
6118,what kind of clothes should we wear at work?
6119,it helped him to have a close relationship with his parents.
6120,they're going to get very angry.
6121,sailing on a boat can be very relaxing.
6122,you should study engineering or something like that.
6123,i think that will be good.
6124,you can actually see the stars at night.
6125,try a little taste of it and see what you think.
6126,they had people who did that for them.
6127,he was just beside himself.
6128,there are no hills around here.
6129,i have to admit i'm not as informed as them.
6130,it's kind of a depressing topic.
6131,especially with teenagers.
6132,our children are now eleven and nine years old.
6133,i did not enjoy working in florida.
6134,everything is geared towards young people.
6135,i had two kids in the hospital in july.
6136,we went to six flags on saturday.
6137,it's really hard to find something that works for everyone.
6138,and then she sewed the buttons onto the shirt.
6139,i need to get my vision tested.
6140,i saw that movie too.
6141,i was very impressed by them.
6142,it was a relatively nice environment.
6143,i guess i have to return something at the store.
6144,the further away i get from home the happier i am.
6145,so i have no choice but to get rid of it.
6146,people will do whatever they want to do.
6147,we just moved into this house.
6148,my husband went over to the house and painted the walls.
6149,why did you say that to your husband?
6150,at the beach when the waves start coming in.
6151,be careful because someone might follow you home.
6152,they get mad at themselves when they don't do well.
6153,because of the explosion the refinery shut down for months.
6154,i just kind of do it.
6155,they finally found evidence of a crime.
6156,you actually go in there.
6157,i am a visual effects artist.
6158,taking measures to extend your life further is easy.
6159,that is a problem.
6160,over a very long period of time.
6161,anesthesia for hip or knee replacement surgery.
6162,i caught the disease from my father.
6163,you shouldn't have left it there.
6164,they are afraid of being dependent on other countries.
6165,that's what i was doing before.
6166,i think that about a majority of the places in the united states.
6167,why don't you go ahead and start?
6168,it is about a twelve hour drive.
6169,the trial is now moving towards a conclusion.
6170,everybody has a different thing.
6171,and you get out of the house more.
6172,to help decide what the right thing to do is.
6173,i've got about twelve tickets coming in the mail.
6174,i made a decision.
6175,the land was paid for with cash.
6176,i'm in favor of doing very little clean up.
6177,who did you work for back in nineteen eighty six?
6178,they didn't send him to a public school.
6179,you are the one who signed up for it.
6180,several things about the car need fixing.
6181,i work in facilities and happen to have the key with me.
6182,it's still going on.
6183,i'm a dog person.
6184,i think it needs to be expedited.
6185,they also seem to be economically driven.
6186,i take care of my own yard.
6187,she took it with her.
6188,you just end up throwing it away most of the time.
6189,the water was murky and dark.
6190,we don't have any snow here now.
6191,i have seen a few people do it though.
6192,how do you decide?
6193,do a little bit better next time.
6194,leave it to somebody who does it for a living.
6195,he's probably about fifty three years old now.
6196,i got in on the ground floor.
6197,if he can keep the band together.
6198,my husband finally got his big four car garage.
6199,he gets right into it.
6200,i think that's most of it.
6201,i went to california to see the sequoia trees.
6202,you're a red sox fan too.
6203,leave your choice in the comments.
6204,and another child that they had already met.
6205,i had a nineteen seventy eight version before this one.
6206,you get back into a political thing.
6207,in san antonio it was like every day.
6208,do you stay home with yours?
6209,i kind of look at it this way.
6210,the grassroots were whacked for voicing out.
6211,but they never say who.
6212,so it should be an easy decision right?
6213,the decision will move back down.
6214,if i don't have a real with a button on it.
6215,the whole electronic classroom idea.
6216,which is outside of dallas.
6217,it already costs society much more because of it.
6218,we do an awful lot of camping.
6219,bring it closer.
6220,my family is closer.
6221,do you need help here?
6222,my family is coming.
6223,yes you have it right.
6224,please have faith.
6225,i tell you my family is not hungry.
6226,bring my computer here please.
6227,you like it yes?
6228,my nurse is coming outside.
6229,they are coming closer.
6230,tell my family i am not hungry.
6231,my computer is not okay.
6232,i need my glasses.
6233,they need it outside.
6234,yes i do feel tired.
6235,where are my glasses?
6236,tell my nurse you are hungry.
6237,they feel very good.
6238,yes my family is going up.
6239,goodbye goodbye.
6240,how are you going outside?
6241,no my nurse is not coming here.
6242,you bring it closer.
6243,how are they thirsty?
6244,i am coming outside.
6245,i hope it is going good.
6246,please not like that.
6247,you have family.
6248,where are my glasses?
6249,hello i am tired.
6250,are you very thirsty?
6251,no i do not feel very good.
6252,please tell my nurse where you are.
6253,i feel like you.
6254,how do you do?
6255,how do they have my computer?
6256,no it is not right.
6257,you hope they are coming.
6258,how tired are you?
6259,tell my family how you do it.
6260,are you good?
6261,they hope you have my faith.
6262,please bring my family here.
6263,no i am not very tired.
6264,hello i am like you.
6265,please tell my family i need my glasses.
6266,is my family going up?
6267,how are you coming here?
6268,is my nurse hungry?
6269,i hope you do not need nurse.
6270,i hope you have good glasses.
6271,what is comfortable?
6272,how are they coming up?
6273,ok am i going?
6274,they are going.
6275,no please i am tired.
6276,how do they do it here?
6277,you do not clean it up.
6278,that is not very good.
6279,you like music.
6280,where do you have music?
6281,my computer is good.
6282,what help you are.
6283,where you are.
6284,where is it not good?
6285,i bring it right up.
6286,they are not here.
6287,my family is going here.
6288,okay it is not that bad.
6289,no i feel very good.
6290,what is it where?
6291,they tell you where i am.
6292,is my computer very bad?
6293,they tell you my nurse is comfortable.
6294,clean up here please.
6295,how thirsty am i?
6296,how tired is my family?
6297,i hope it is okay.
6298,they hope i have faith.
6299,yes you have it.
6300,i hope my nurse is hungry.
6301,you hope they are closer.
6302,no closer please.
6303,i hope that is.
6304,where you like?
6305,i hope i need my nurse.
6306,they hope you are going.
6307,i am tired are you?
6308,are you coming?
6309,tell my nurse you are not thirsty.
6310,that is not okay.
6311,yes i hope you are.
6312,please tell my nurse i need my music.
6313,nurse is not bad have faith.
6314,that is not very bad.
6315,no i am not comfortable.
6316,that is good.
6317,clean up here.
6318,i am that good.
6319,music is not good.
6320,do i tell you?
