id,text
2232,she enjoys that kind of stuff.
2233,murder is a crime.
2234,do you watch cartoons a lot?
2235,they'll have a satellite campus in a month.
2236,and i think that's what i didn't like.
2237,i just don't know how to measure it.
2238,i think they need that.
2239,i don't know why it's so hard to find.
2240,i'm wearing shorts.
2241,you cover it.
2242,how many employees work in the store?
2243,i use them both here at work and at home.
2244,they want everybody educated.
2245,a job to make money.
2246,i'm sure it does.
2247,it's really important to me to get to read for fun.
2248,on the radiator behind the dresser.
2249,you need to rent the first one first.
2250,i mean to use any of the facilities.
2251,they would tend not to.
2252,in other countries.
2253,that's because i'm allergic to the grass.
2254,we started watching again.
2255,that he says was the point.
2256,then she recouped.
2257,his solution was to burn plastic.
2258,enjoy your day.
2259,i just got married.
2260,although they don't admit to it.
2261,you had pretty good luck with one coat type paint.
2262,like a light cough.
2263,closures and job losses.
2264,at this point the damage is done.
2265,if they started executing them on a regular basis.
2266,i told my husband.
2267,true to life.
2268,i'd like to see them go to.
2269,he'll take them out just to be with them.
2270,so we're going to wait.
2271,the reason behind the decision.
2272,garlic is the only thing you're supposed to put in there.
2273,however that decision was overturned on appeal.
2274,choosing the right luxury vehicle for you.
2275,you get programming.
2276,parents do not do that.
2277,it doesn't all have to be white.
2278,state land grant colleges.
2279,my daughter is twenty one now.
2280,he knew he was gonna be the whipping boy again.
2281,i am a golfer.
2282,some types of agreements to limit.
2283,it makes a big difference.
2284,it was just no effort at all.
2285,we go backpacking fifteen or twenty miles.
2286,what are you learning to be?
2287,the civilian casualties would be staggering.
2288,i'll probably have to sell the prize i get.
2289,god will take care of us when it's our time.
2290,i had had everyone in my department recycling.
2291,a good southern solution.
2292,i have a really easy recipe for that.
2293,fluorescent colors.
2294,after that it was the interior stairs and foyer.
2295,for the both of us.
2296,i lean to that coverage.
2297,clay pigeons things like that.
2298,what about the judge who's hearing the case?
2299,basically the size of kansas.
2300,children are so full of energy.
2301,i haven't been over.
2302,some people pray on that.
2303,instead of taking them up there.
2304,he's out for good.
2305,are you going to trade it in on this new one?
2306,you don't have quite as much money.
2307,amazon is expected to make a decision this year.
2308,collect your cans.
2309,she asked them there if there was some.
2310,a lot of people loved that show but i can't stand it.
2311,it's not good for a second watching particularly.
2312,how about when you were in colorado?
2313,you sound so young.
2314,you can get out there and toy with them.
2315,they're usually wrong too.
2316,are you a native to texas?
2317,this is a very appropriate topic.
2318,a nursing home or anything.
2319,she had that done a while ago.
2320,i'm not from minneapolis.
2321,i'm an american.
2322,if it's life and a day.
2323,i know there is.
2324,disclosure of your personal information.
2325,might as well buy me a new car for that.
2326,killer bee instinct.
2327,they finally determined what the problem was.
2328,take it to a logical extreme.
2329,did they do that before you went in or what?
2330,now i dance for joy.
2331,i never made one for myself though.
2332,one's in college already.
2333,that's a whole other topic to begin with.
2334,cook with my kids.
2335,the other people were kind of mixed.
2336,foundation planning.
2337,i liked it a little bit but i didn't.
2338,i'm kind of mixed on it.
2339,i think that is a very wrong way to handle.
2340,we don't have cable.
2341,which i'm sure is the proper term.
2342,march the fifteenth before it was prepared.
2343,i think you'll like it better.
2344,just about any kind of music.
2345,basically it's a market survey.
2346,one of the calls i'd gotten before.
2347,and it wasn't.
2348,forms for his photography business.
2349,you get all prepared but you're right.
2350,he went to move in with another girl.
2351,within the last couple of years.
2352,learn about version control.
2353,it's been a few years.
2354,in that time frame.
2355,i pay absolutely nothing.
2356,maybe give them a refresher driving course.
2357,they look like they're very sturdy.
2358,i avoided him.
2359,and they got him from the dollar store.
2360,those were big political events.
2361,because he was carrying a camera.
2362,that's a long time.
2363,we were from the north.
2364,robberies or things like that.
2365,i have always loved reading.
2366,because of the pleasure you get from it.
2367,linux version.
2368,patriots were so depressing this last year.
2369,then we get out of that phase.
2370,i didn't have a lot.
2371,a friend of mine saw it and she said it was okay.
2372,they've made such advances in computers.
2373,i've actually been in line the whole time.
2374,it's just too high.
2375,it's happened so many times.
2376,whether it's a murder case.
2377,your standards change.
2378,what city are you calling from?
2379,they can provide for society.
2380,i can not believe.
2381,she got bit on the cheek.
2382,that's not very likely.
2383,i sold some of them.
2384,if i had not been preparing for this.
2385,they shouldn't allow an appeal.
2386,they are wanting to do another.
2387,lots of affection.
2388,well that's understandable.
2389,good to remember.
2390,is that portland?
2391,it's really unfortunate.
2392,i like his movies.
2393,he can walk and he's six foot.
2394,i decided that there was no point in replying.
2395,the glands had been removed.
2396,it's a lot easier then.
2397,the girls joined.
2398,most of the parents.
2399,from speaking from my children.
2400,is that what comes in those little blocks?
2401,i once went out with a boy in my high school.
2402,welfare state benefits.
2403,alex is very calculating in making his decisions.
2404,you're alert for the kid who's very drowsy.
2405,the more local elections.
2406,a real good dog.
2407,my mother was real heavy into crafts.
2408,the food comes out fresh.
2409,our shepherd was almost thirteen years old.
2410,his voice rose.
2411,at first that always kind of bothered me.
2412,a high school course.
2413,at the end of seasons.
2414,but putting him in a home doesn't feel right.
2415,i didn't realize.
2416,i'm not much in favor of it.
2417,i want a german shepherd.
2418,we hope you enjoy our little project.
2419,use that whenever the opportune moment arises.
2420,in the winter we do more concert stuff.
2421,i don't know where to stand on it.
2422,what would you like to do with your life?
2423,i forget what you call it.
2424,it works out real nice.
2425,i don't know how cost efficient that would be.
2426,i just want to get down and kiss the ground.
2427,in light of widespread school closures.
2428,their seasons are switched.
2429,there was only like two or three.
2430,meeting conclusion.
2431,my father owns a restaurant.
2432,so i let my son do it.
2433,you talked about something.
2434,a great number of people work on sundays.
2435,i do it by myself in a group of maybe forty or so.
2436,say the rice dish.
2437,people were jumping to the wrong conclusion.
2438,i know the day care centers are not cheap either.
2439,it was just too perfect at all times.
2440,then we went up the mountain.
2441,it makes my life and my work a lot easier.
2442,a place called quality auto parts.
2443,we're real close.
2444,it's usually okay with me.
2445,sign papers that say this is yours.
2446,i forgot we had to hit one.
2447,this is unifying voice we need.
2448,that was outside.
2449,my husband and i are vegetarians.
2450,the few and far between.
2451,her body was found by her boyfriend.
2452,do you envision him as a starter or as a backup?
2453,she is to this day.
2454,i don't know quite how to do it.
2455,i can't quite remember the name of the book.
2456,that's all i have is boys.
2457,i kind of like to do a little bit of sewing.
2458,this brings you no end of joy.
2459,when you have children.
2460,i couldn't care about any of it.
2461,they put them upside down.
2462,they classify most of them as professionals.
2463,maybe you gain a little bit of local fame.
2464,absent a dust cloud there will be no explosion.
2465,social arbitrage.
2466,i was much younger.
2467,i also made a little thing for a baby gift.
2468,they couldn't do a whole lot.
2469,are you having any trouble with bugs in your garden?
2470,others are not rising to the occasion.
2471,a few little grammatical problems.
2472,do you get money for it?
2473,some wine tastings up in the valley.
2474,all kinds of physical problems.
2475,life of a person.
2476,i would hope we could do that.
2477,those were the general issues.
2478,the people who have the most.
2479,i believe in capital punishment.
2480,then it goes through the moon.
2481,there is some danger to that.
2482,a good house for a very nice family.
2483,i'm dying to see that.
2484,their house is going to be really big.
2485,changes to employment insurance.
2486,she loved the styling of it.
2487,whenever they gave them out.
2488,you probably get this.
2489,we're going to be able to go up there.
2490,i certainly can't argue with that.
2491,it tastes differently.
2492,that can really slow you down.
2493,those get thrown away.
2494,i wouldn't want to eat octopus.
2495,i have to cut myself down to the weekend.
2496,if you do it right i think it comes out even.
2497,they have no children in school.
2498,the other thing i can think of.
2499,they still look pretty good.
2500,i just realized it's not going to happen.
2501,twice for the same crime.
2502,not that i like reading.
2503,it gives you a taste of what it's like.
2504,i was pretty much giving up my life.
2505,we need to give closure to the families.
2506,i think that that's been proven in fact.
2507,she did pretty well.
2508,the news division of the houston chronicle.
2509,i'm in the speech processing business.
2510,you're developing your imagination.
2511,it's a very expensive automobile.
2512,i think there's something about being able to turn on joy.
2513,raise my children.
2514,if i were to buy another car.
2515,preparing is a real problem.
2516,also they get better quality care.
2517,you can kind of relate to it you know.
2518,time and mistakes and they're both inevitable.
2519,those are basic things.
2520,life is so much more enjoyable.
2521,i always watch them no matter who's on.
2522,do you ever watch cheers?
2523,gives him a little bit of that individual time.
2524,they're saying no right now.
2525,because i didn't decide to major in that until a few years later.
2526,so what is it now?
2527,their way of life changed.
2528,when you found out who it was.
2529,the fast moving water carried the deer away.
2530,about a tablespoon of sugar.
2531,is there a lot of sand?
2532,yes and i think we do get pretty good coverage.
2533,the last time he came was in march.
2534,it's our first home.
2535,you are frequently exploited.
2536,they call it a low impact aerobics.
2537,they encouraged people to use credit cards.
2538,they're eight and ten.
2539,even at home here now.
2540,you know it's bound to spread.
2541,there's just not any push to recycle.
2542,check out the full spoilers here.
2543,government contracts.
2544,don't particularly care for that at all.
2545,he had occasionally sent her mother money.
2546,that's something that's important for sure.
2547,i don't even remember this being on there.
2548,it protects you from acid and corrosion.
2549,average intelligence or something.
2550,there was no report of any casualty or injury.
2551,i really like those.
2552,be careful about that back then.
2553,there is a long way between now and that point.
2554,my mom's helping me out.
2555,i'm still replacing that in the back.
2556,health plan for him.
2557,it was an older home.
2558,the pros and cons of both.
2559,i've never had a call.
2560,i used a three wood rather than a driver.
2561,so it seems to be.
2562,don't get much room in the attic.
2563,enjoy the bat.
2564,i'm twenty three.
2565,it was never very intuitive to me.
2566,even if i have my dog with me.
2567,since brian was born.
2568,it helps if you leave the pit in it.
2569,whatever it was.
2570,this is a little container.
2571,i wish if they were going to do it.
2572,i take no pleasure in seeing anyone get injured.
2573,do you eat what you fish?
2574,i'm not the one who writes the orders.
2575,why not get the whole thing?
2576,you order a meal.
2577,you'd be a hundred and seventy centimeters.
2578,what's wrong with her voice?
2579,even if she does get on flat ground.
2580,your privacy being invaded at any time.
2581,you don't think it's abnormal.
2582,hispanic players.
2583,which was about five years ago.
2584,you are frequently exploited.
2585,they call it a low impact aerobics.
2586,they encouraged people to use credit cards.
2587,they're eight and ten.
2588,even at home here now.
2589,you know it's bound to spread.
2590,there's just not any push to recycle.
2591,check out the full spoilers here.
2592,government contracts.
2593,don't particularly care for that at all.
2594,he had occasionally sent her mother money.
2595,that's something that's important for sure.
2596,i don't even remember this being on there.
2597,it protects you from acid and corrosion.
2598,average intelligence or something.
2599,there was no report of any casualty or injury.
2600,i really like those.
2601,be careful about that back then.
2602,there is a long way between now and that point.
2603,my mom's helping me out.
2604,i'm still replacing that in the back.
2605,health plan for him.
2606,it was an older home.
2607,the pros and cons of both.
2608,i've never had a call.
2609,i used a three wood rather than a driver.
2610,so it seems to be.
2611,don't get much room in the attic.
2612,enjoy the bat.
2613,i'm twenty three.
2614,it was never very intuitive to me.
2615,even if i have my dog with me.
2616,since brian was born.
2617,it helps if you leave the pit in it.
2618,whatever it was.
2619,this is a little container.
2620,i wish if they were going to do it.
2621,i take no pleasure in seeing anyone get injured.
2622,do you eat what you fish?
2623,i'm not the one who writes the orders.
2624,just lucky to have a job.
2625,why not get the whole thing?
2626,you order a meal.
2627,you'd be a hundred and seventy centimeters.
2628,what's wrong with her voice?
2629,even if she does get on flat ground.
2630,your privacy being invaded at any time.
2631,you don't think it's abnormal.
2632,hispanic players.
2633,which was about five years ago.
2634,frustrating at times.
2635,i figured the choice is mine.
2636,his main point is wrong so we're done right?
2637,one of those generation novels.
2638,generations from now.
2639,except i stenciled my wall.
2640,the state has yet to appeal that decision.
2641,i took my kids out and taught them how to go back packing.
2642,they could take off at any moment.
2643,lot of money spent on this.
2644,and that's happened to me more than once or twice.
2645,we will miss every once in a while.
2646,the whole middle east is in turmoil.
2647,books about freud and psychoanalysis.
2648,they got to come up with ideas.
2649,have you been able to do that all along?
2650,correspondence school.
2651,it's so darned easy to turn the thing on.
2652,seventy nine degrees.
2653,he's in his sixties.
2654,but at one point their going to outgrow you.
2655,it's kind of pleasant.
2656,i still live in san jose.
2657,i do find it particularly annoying.
2658,i kind of miss out on most of the current events.
2659,many other responsibilities.
2660,it is usually not hard to know who you are.
2661,their leaves are still green.
2662,if you don't pay it off within that month.
2663,she became less able to take care of herself.
2664,you do the best you can to make it perfect.
2665,including rural districts.
2666,a really important thing to me is when they would come.
2667,one of my friends here.
2668,we used to try to get together.
2669,avoid contact with eyes.
2670,i'm sure it creates a large amount.
2671,the children were left unattended in a room.
2672,the religious organizations.
2673,we're also going through adoption now.
2674,there was no immediate word on any casualties.
2675,we've enjoyed it.
2676,they were told that.
2677,got to see pikes peak.
2678,we still have tomatoes.
2679,it doesn't sound necessary in texas.
2680,you just fry under the sun.
2681,it was north of us.
2682,how do you like it?
2683,we really debated at the beginning.
2684,you do not have my success.
2685,where am i going?
2686,they are bad.
2687,you have.
2688,they do not have my computer.
2689,is it yes?
2690,you do not need my nurse.
2691,is my nurse going?
2692,how bad is it?
2693,tell my nurse i do not feel thirsty.
2694,
2695,some odd choices.
2696,get them out there.
2697,well that's true.
2698,i really enjoy that.
2699,what would you buy?
2700,it was a two story building.
2701,and most people like that are old.
2702,i have a jig saw and a scroll saw.
2703,the stores that sell.
2704,he didn't eat flies.
2705,really kind of gone the rounds.
2706,you want it to stay as good as it possibly can be.
2707,they blew all that.
2708,my new shoes will last me longer than that.
2709,and the skunk was a good story.
2710,
2711,that's the new one.
2712,i went to work as an editor and writer.
2713,they say you can't have pleasure without pain.
2714,looking at visions of the future.
2715,i hope you enjoy my blog.
2716,have you done this before?
2717,do you know where you're going?
2718,well that's the way mine is.
2719,they say no new taxes.
2720,i don't use the free weights.
2721,they're real active in volunteer work.
2722,you know we have to think about that.
2723,that was in the water.
2724,it's far beyond me.
2725,i like to watch comedy.
2726,those are running.
2727,we're getting ready to go.
2728,if i miss something big deal.
2729,i've heard the name and that's about all it goes.
2730,i hope you'll find him.
2731,the carpet cleaning companies.
2732,i don't have any children.
2733,you bag your own groceries.
2734,she has everything planned so closely.
2735,they mentioned that one only briefly.
2736,go in the direction of a market driven economy.
2737,we're going to try and have her stay home.
2738,sleeping much more or less than usual.
2739,that was a lot of fun.
2740,in massachusetts.
2741,i guess that's because we had so much rain.
2742,fifteen minutes before.
2743,you know in the interest of full disclosure.
2744,the city manager.
2745,i'm a real movie buff.
2746,it would just depend.
2747,we camped at the de gray state park in arkansas.
2748,places like ross dress for less.
2749,so i have no idea what they look like.
2750,that's my husband mark.
2751,you could record it.
2752,we rented a car and drove pretty much everywhere.
2753,liberal arts programs are a good idea.
2754,you can do so much with them.
2755,he's a proponent of that.
2756,this one that you raised.
2757,enjoy the rest of your day.
2758,the ants would start crawling up your legs.
2759,you are kind of buff.
2760,good decision so far.
2761,i bet that would be.
2762,this is one of those things.
2763,what is the point of this?
2764,last time i saw the paper earlier this week.
2765,i would prefer to have in home care.
2766,we know the consequences of that decision.
2767,at the higher echelons.
2768,there's always going to be a dispute.
2769,for having him out there.
2770,the monitoring is not that bad.
2771,we have about ten acres.
2772,i mainly leave that up to them.
2773,it was my pleasure thank you for reaching out.
2774,anything spiritual.
2775,i never had either.
2776,they don't compress at all.
2777,i used drugs last week.
2778,i'm not sure how much that holds true anymore.
2779,i've got two kids to put clothes onto.
2780,i don't really like the pirates.
2781,how does this grab you?
2782,i don't even know.
2783,ever seen one of these bad boys?
2784,in the rivers and stuff.
2785,that was kind of fun.
2786,i have seen a big change.
2787,the social structure of the soviet union.
2788,they're doing good tonight.
2789,does it cost the same for just two nights?
2790,if they're going to offer these services.
2791,i read a book while i'm doing it.
2792,it would have to do with poverty.
2793,that's why i enjoy going to restaurants.
2794,security measures.
2795,you're close to the subject.
2796,that should just simply be taken out of the homes.
2797,how many cats do you have?
2798,i would feel that i had the right to.
2799,i'm a radio person i guess is what i mean.
2800,that's my boy you made my day.
2801,they are causing problems.
2802,this is like judo on steroids.
2803,the other two are short hairs.
2804,an invitation.
2805,we've got two teams of equal strength.
2806,problems that men have in the realm of cancer.
2807,zipper closure.
2808,yes i consider myself what they call a full timer.
2809,frequently purchase and read.
2810,no rain in the last month.
2811,that's a real waste too.
2812,rehabilitate you.
2813,to go to them first.
2814,i'm not sure if that was in arizona.
2815,we both came out of our shells.
2816,it's a very short drive to areas near here.
2817,needs to get a lot better at the point of attack.
2818,she tried to feel confident about her decision.
2819,it's pretty funny.
2820,this used car has it.
2821,it depends on whether one is physical or mental.
2822,all of us could use one electric car right now.
2823,were you trying to follow any type of rule?
2824,and i have a lot of choices right now.
2825,at night you can go walking in the shallows.
2826,she stopped doing it.
2827,that's another problem with the united states.
2828,you know it wasn't just a super bad storm.
2829,when i went to work for them.
2830,luckily someone came by and gave me a ride.
2831,but if you really want to relax have a massage.
2832,i enjoy having a nice looking yard.
2833,we did more and more of that.
2834,criminal history.
2835,how do you feel about that decision?
2836,that's a wonderful way to get off jury duty.
2837,i think i was paid.
2838,it is good for both of them.
2839,that's getting back to a little bit chillier.
2840,the social changes.
2841,it's almost radical to some people.
2842,i have a garden.
2843,the minute i said the word.
2844,we will worry about who he is later.
2845,i haven't been able to catch any of that.
2846,what are some of the benefits of visualization?
2847,kind of goes along with what you were saying.
2848,it's over on the other end.
2849,i didn't know that.
2850,and it sounds really neat.
2851,then you really get socked to it.
2852,i haven't bought it now for about eight years.
2853,that was a great little car.
2854,i listen to a song.
2855,they can get away with one guy like that.
2856,do you like the classics?
2857,we have hard decisions to make she said.
2858,they are to be there ahead of time.
2859,as long as you want to.
2860,if you're aware of this.
2861,that's the way they suck you in.
2862,a lot of days i'll get two and three calls.
2863,we just made a decision and moved on.
2864,it's a casual working space.
2865,when i was still smoking.
2866,what's your name?
2867,a person's heart can be changed.
2868,except like i said.
2869,what did i make that night?
2870,five hundred miles.
2871,soccer is destroying the usa.
2872,i love chinese food.
2873,most rap i don't like.
2874,i guess it depends on who you talk to.
2875,now that i've gotten past that.
2876,they just take to it like candy.
2877,in inches or centimeters.
2878,i like telling jokes.
2879,it's funny how many names have been used.
2880,do you think my jokes are funny?
2881,find someone and pay them to do it.
2882,the homeowner can't be touched.
2883,i like a good joke.
2884,if you impose.
2885,i was just joking around.
2886,were you all transferred?
2887,you weren't just in their class.
2888,that's the same thing here.
2889,it's amazing.
2890,in some of the more crowded states.
2891,military service is not that much.
2892,the second thing is.
2893,she said unable to keep the pain from her voice.
2894,especially since you have a german sheppard.
2895,it looked archaic.
2896,we've exhausted all of our ideas.
2897,that just about what you said.
2898,it's just going to follow.
2899,beef and broccoli strips.
2900,morally i don't like the idea.
2901,if they're going to do that to her.
2902,it is frightening.
2903,that sounds real good.
2904,my wife said to water the roses every other day.
2905,that's why i like some diversity in my breakfast food.
2906,someone said that was a lot of fun to go do.
2907,that's where i need to go.
2908,it's easy to say.
2909,you hear the click of the recording coming on.
2910,that will be something.
2911,but we don't like to do that at all.
2912,when you're first married or starting out.
2913,i felt so sorry for him after that.
2914,it came out in the theater.
2915,just being excellent.
2916,you know that's hurting us.
2917,pour it into a glass serve and enjoy.
2918,doing things they like to do too.
2919,there was no structure.
2920,it was unusual to say the least.
2921,i'll stick with it while it's good.
2922,warped real easy.
2923,it's nice talking with you.
2924,the choice is up to each and every one of us.
2925,russell ultimately married his boyfriend.
2926,they report facts.
2927,she spends lots of money on them.
2928,they were mainly my mother's.
2929,just in house programs to do what they needed.
2930,have you ever camped on sand?
2931,she was on a carnival.
2932,what do you think are some current trends?
2933,practice makes perfect.
2934,they take it out of your salary before taxes.
2935,it helps you hang onto your roots.
