id,text
0,bring it closer.
1,my family is closer.
2,what do they like?
3,how is that good?
4,need help here?
5,yes you have it right.
6,i tell you my family is not hungry.
7,bring my computer here please.
8,they hope that.
9,you like it.
10,tell my family they are not hungry.
11,computer is not okay.
12,do it.
13,they need my glasses.
14,i am closer.
15,they need it outside.
16,yes i do.
17,tell my nurse you are hungry.
18,they feel very good.
19,my family is going up.
20,goodbye.
21,are they thirsty?
22,i hope it is going.
23,please not like that.
24,i hope it is good.
25,you have family.
26,are you very thirsty?
27,my family is going.
28,do they have my computer?
29,not right.
30,are you it?
31,no i am not very tired.
32,hello.
33,i have it right here.
34,please tell my family i need my glasses.
35,is my family going up?
36,i hope you do not need nurse.
37,is my nurse hungry?
38,they are not coming here.
39,what is comfortable?
40,how are they coming up?
41,am i going?
42,they are going.
43,no please.
44,how do they do it here?
45,you do not clean it up.
46,that is not very good.
47,you are coming here.
48,is my nurse okay?
49,you like music.
50,do i have music?
51,my computer is good.
52,what you are.
53,where you are.
54,is it not good?
55,please tell my nurse i am going up.
56,do they?
57,i bring it right up.
58,they are not.
59,my family is going here.
60,not that bad.
61,i feel very good.
62,what is it where?
63,they tell you.
64,they tell you my nurse is comfortable.
65,clean up please.
66,how thirsty am i?
67,how tired is my family?
68,i hope it is okay.
69,yes you are coming here.
70,they hope i have faith.
71,yes you have it.
72,i hope my nurse is hungry.
73,you hope they are closer.
74,closer please.
75,i hope that is.
76,i am not like that.
77,they feel very comfortable.
78,where you like?
79,i hope i need my nurse.
80,they hope you are going.
81,i am you.
82,are you coming?
83,tell my nurse you are not thirsty.
84,that it is not.
85,i hope you are.
86,please tell my nurse i need my music.
87,nurse is bad.
88,that is not very bad.
89,no i am not comfortable.
90,that is good.
91,clean up here.
92,i am that good.
93,music is not good.
94,do i tell you?
95,my family is right here.
96,yes my nurse is going here.
97,where is my success?
98,tell my family i am thirsty.
99,they like it outside.
100,clean up.
101,i have it like that.
102,i feel hope.
103,yes i feel very thirsty.
104,i have it up.
105,i need success.
106,i hope they help you.
107,i hope i need my music.
108,what is good?
109,do not do that.
110,is my music very bad?
111,faith is okay.
112,bad music.
113,i need my nurse right here.
114,my nurse is not hungry.
115,hope you like it.
116,they need you.
117,tell my nurse hello.
118,they are not hungry.
119,it is very bad.
120,i am not okay.
121,i hope they have faith.
122,do you feel that?
123,you are good.
124,tell my family they are not thirsty.
125,i am not hungry.
126,is it okay?
127,they tell you i am hungry.
128,tell my family goodbye.
129,here that is.
130,i like my faith.
131,tell my nurse i feel comfortable.
132,i hope you do that.
133,need it?
134,i hope they have.
135,tell my nurse i am not thirsty.
136,i do not clean it up.
137,it is up.
138,i hope you are right.
139,do you have it right?
140,they clean it.
141,they clean my glasses.
142,i tell you i do not feel comfortable.
143,please do it.
144,tell my family i do not feel comfortable.
145,they do have.
146,they hope my family is closer.
147,no they do not clean it up.
148,faith is not good.
149,hope you are not hungry.
150,hope you are comfortable.
151,is my nurse thirsty?
152,they have no success.
153,i like my computer.
154,i hope i do not need it.
155,they do it.
156,they have no need.
157,i hope you are going.
158,have it.
159,you are going outside.
160,do you what?
161,i am like you.
162,my music is not okay.
163,they need success.
164,where are you up?
165,yes you need it.
166,you what?
167,do they have it?
168,tell my family they do not feel hungry.
169,goodbye please.
170,no music here.
171,i hope they are going.
172,do you have my music?
173,yes it is goodbye.
174,are my glasses bad?
175,i hope they are thirsty.
176,that is very comfortable.
177,you hope my family is here.
178,how good are you?
179,i do not feel hungry.
180,i like help.
181,my faith is right here.
182,am i coming up?
183,you do it.
184,coming up.
185,computer is no good.
186,yes i feel good.
187,where you need it.
188,i am coming.
189,clean that up.
190,you feel bad.
191,what do i have?
192,i like music.
193,you feel good.
194,not very bad.
195,they tell you i am comfortable.
196,no they are not going.
197,yes they have.
198,you clean my computer.
199,do you like that?
200,you are right here.
201,tell my family they are not comfortable.
202,where is that help?
203,my nurse is very good.
204,i need music.
205,what do you tell my nurse?
206,hope you feel.
207,goodbye what?
208,what is okay?
209,do i?
210,yes i am tired.
211,it is that bad.
212,you are closer.
213,are my glasses very good?
214,tell my family i am not comfortable.
215,is my family good?
216,please have faith.
217,my family is not going outside.
218,no i do not feel very comfortable.
219,you hope it is goodbye.
220,you need it here.
221,i like how comfortable my family is.
222,very good here.
223,tell my nurse i do not feel hungry.
224,no i do not feel comfortable.
225,tell my family they are thirsty.
226,my nurse is not good.
227,it is that good.
228,i like my nurse.
229,do you have it coming?
230,my nurse is not very tired.
231,i need my nurse.
232,please do.
233,i need my computer right here.
234,i like how they tell it.
235,no my nurse is not coming here.
236,what is that like?
237,they do not like my family.
238,my faith is good.
239,going good.
240,how they do.
241,they are not clean.
242,i am not good.
243,my success is closer.
244,you do that.
245,how do you do what?
246,have not.
247,that is not comfortable.
248,you are very tired.
249,yes like that.
250,where is my family going?
251,tell my family i am comfortable.
252,my music is my hope.
253,where are they?
254,they do not.
255,you are.
256,they do not have nurse.
257,they do here.
258,you are going.
259,i hope you do okay.
260,it is coming here.
261,yes i am going here.
262,they hope you have faith.
263,how bad is it going?
264,you are tired.
265,hope they feel right.
266,hope is coming.
267,how do you do it right here?
268,have faith.
269,i hope you have hope.
270,what is where?
271,how thirsty is my family?
272,do you have it here?
273,yes i am coming here.
274,very not good.
275,please tell my family i need my computer.
276,i have no music.
277,i clean up.
278,they hope i have my glasses.
279,you need my faith.
280,i hope they feel good.
281,i am very good.
282,very good music.
283,i clean it.
284,yes my nurse is coming here.
285,what do they tell my family?
286,bring up.
287,do you need help?
288,which is most unfortunate because we all lose out.
289,i had a nineteen seventy eight version before this one.
290,you get back into a political thing.
291,in san antonio it was like every day.
292,do you stay home with yours?
293,i kind of look at it this way.
294,the grassroots were whacked for voicing out.
295,but they never say who.
296,so it should be an easy decision right?
297,the decision will move back down.
298,if i don't have a real with a button on it.
299,the whole electronic classroom idea.
300,which is outside of dallas.
301,it already costs society much more because of it.
302,we do an awful lot of camping.
303,heat oil in a medium pan over medium high heat.
304,that whole space issue.
305,at this point it's up in the air he said.
306,the exams themselves are not expensive.
307,light reading.
308,they do low impact stuff now.
309,i just got back from dayton.
310,he's far too much of a gentleman.
311,i guess the sanitation department.
312,they say that it is.
313,i'm in marketing sales.
314,i decided to do it i haven't talked before.
315,her voice quaver.
316,i think some people have just asked.
317,that they ought to.
318,they have really simplified things.
319,make him serve five years.
320,what have you done?
321,i think that's really interesting.
322,just for the record.
323,it's on wheels and it's big.
324,i do quite a bit of business in washington.
325,i think that's a possibility.
326,i couldn't remember what it was.
327,i don't know who the characters are.
328,worked most of my life.
329,i have this really good recipe for this.
330,that gives us special time together too.
331,what do you think about that?
332,not like the eagle.
333,it all starts to become similar.
334,speaking of noise.
335,and we play out here in the summertime.
336,i guess it makes a difference.
337,the car issue just came out.
338,so strap in and enjoy the ride.
339,after having a one that was historical looking.
340,your body's not going to look as bad.
341,just kind of roughed it.
342,then they'll pay you a certain amount of money.
343,seems like you're so busy anyway.
344,who sponsors you?
345,we had two baseball bleachers full of people.
346,i like listening to that.
347,i've heard about him.
348,multiple versions.
349,i can never quite stay current with that.
350,you really have to watch those interest rates.
351,it will be like family around her.
352,i totaled them all up.
353,what sports that you are active in?
354,that's a kind of low risk sort of project.
355,have you been buying any clothes lately?
356,how do you feel about the vietnam war?
357,he could buy us material things.
358,when i come back to my seat.
359,does the company you worked for give bonuses?
360,there's quite a waiting list to get into that.
361,what do you write for them?
362,why they don't go with fourteen one.
363,have you ever played baseball?
364,everything's really expensive here.
365,that is one of my solutions.
366,put them on death row and execute them.
367,he's a black man.
368,they're getting votes.
369,i don't think i'll do it again.
370,get things back the way they were.
371,they had five or six servants.
372,what was the verdict?
373,and you really begin to develop an interest in it.
374,just a little over a year ago.
375,very well persuaded.
376,and our city will pick up our recyclables.
377,is it a boy or a girl?
378,i used to jog.
379,that's not helpful.
380,it gets rid of some of the confusion.
381,really annoy a lot of people.
382,places usually that i wouldn't be going.
383,my feet bother me.
384,it's just somewhere to drive another car to.
385,she's gone three mornings.
386,in a little different grade.
387,our division does not have a dress code policy.
388,it would have been fantastic.
389,you never get a chance to read.
390,it was not necessarily local.
391,it was nice talking to you dudley.
392,i am a converted catholic.
393,it was interesting.
394,i don't have as much time.
395,those small little trucks and cars like that.
396,it just seems like there is.
397,how long ago did you graduate?
398,final version.
399,i mean i do go to church and things.
400,they're really kind of fascinating.
401,that's really neat.
402,trump has said there was no collusion.
403,you've read that one before.
404,she has two little boys.
405,dump all the trash in the same bin.
406,i think it's in oregon.
407,i think i'm getting too old for all that.
408,the next time i'm going to try to.
409,i think it is getting worse.
410,do you see that hospital over there?
411,you've had more freezing this winter.
412,i lived in indiana for a while.
413,they probably live in a city also.
414,at this point the game was well and truly up.
415,residential situations.
416,i don't care for rock.
417,where we make the safety bags.
418,the baltic states.
419,a dressing of oil and vinegar.
420,i think technology is better.
421,her daughter actually was.
422,you keep up on it all the time.
423,the little boy dies.
424,there was one noise like that.
425,and then he learned the truth.
426,it wasn't all that much.
427,ten gallon buckets of water.
428,i personally feel it.
429,pepsi cans and whatever.
430,and i had gotten home shortly before that.
431,glad i never had to pay for one.
432,they're both very good.
433,ground invasion.
434,some of the time.
435,he doesn't bite anybody.
436,we'd get one more check and that would be it.
437,the teachers expect it.
438,it takes a lifetime.
439,i guess they can be.
440,but he says the exact number is hard to pinpoint.
441,they had a lot of them.
442,and then he came out with the invisible touch.
443,that time is minuscule.
444,did i miss any important points?
445,now in criminal i guess you always have a jury.
446,i'm of italian descent.
447,doing the sentencing.
448,i couldn't believe it.
449,they're just gorgeous.
450,things be to clean.
451,now where do they live?
452,sometimes it's rewarding.
453,contact points.
454,for all the older people.
455,needs and wants aren't necessarily the same thing.
456,i didn't feel like she was mature enough socially.
457,because we've been recycling for quite some time.
458,somewhere they can sit down and write down what.
459,i guess i like a variety of things.
460,which i thought was interesting.
461,i certainly am too.
462,very incidental.
463,and i enjoyed my guns.
464,females in the class.
465,i really dislike those.
466,we can help you make the right choice.
467,a centimeter is about the width of your thumbnail.
468,i knew it ever since you were a little boy.
469,saves you a little bit money.
470,it's awfully easy.
471,i did the dance step.
472,were his civil rights violated?
473,music seemed to really help.
474,my mom and dad got it set up.
475,a lot of their things.
476,you have to support the people that are there.
477,well i know about it.
478,i just happen to be off today.
479,i don't know that we really have a budget.
480,it's the other way around.
481,that's a big problem.
482,so what was the point to this exercise?
483,just more facts would be nice.
484,has affected a lot of social change.
485,but the treasury insisted that was not the case.
486,quarantine measures were not seen as necessary.
487,so that really effects how they report the news.
488,i'm going to have to.
489,noticed that when i was a kid.
490,he's down to like once a week.
491,that's exactly true.
492,for super bowls.
493,weekend duty here.
494,and it's a real turn off to see.
495,six thousand is just getting broken in for them.
496,i think it's a great idea.
497,stuff led to an explosion.
498,if they missed it.
499,been cutting the teacher's salaries.
500,i don't have to much on credit cards.
501,miles per hour to kilometers per hour.
502,he's supposed to be.
503,you don't really don't understand.
504,the graying of america.
505,and successive answers.
506,the end of the civil war.
507,he almost wishes that.
508,up until this point it really hasn't been.
509,seven years in the pros.
510,just something fun to do.
511,i might find a job that has flexible hours.
512,the challenge of the work.
513,i mean it's not going to be overnight.
514,if you ever go in a restaurant.
515,they still found him guilty.
516,i could not believe it.
517,this summer we went to orlando for a week.
518,she can't run in the morning.
519,i've just been called.
520,he was put in the garage.
521,i purchased some magazines.
522,the match was dead and buried at this point.
523,i haven't quite figured that out.
524,about twenty three years.
525,she thought it was riveting.
526,the materials were sold at a high cost.
527,how our politicians voted each week in the paper.
528,he is the president and he should be trustworthy.
529,not a huge part.
530,the void.
531,another thing.
532,changing people's expectations.
533,i set fire to the place.
534,they give a lot more leave.
535,there's some trees like the oaks.
536,as far as that goes i'm not sure.
537,i do not read everything in the paper.
538,it seems to work pretty well so far.
539,two columns on the front.
540,budgeting and some extra things.
541,look at each other.
542,the children love them.
543,you're the farthest person i've ever talked to.
544,in the federal budget.
545,the coleslaw and potato salad.
546,i hope you see a good movie soon.
547,coming here.
548,i hope you have.
549,what do you feel like?
550,they need it coming up.
551,i am not very thirsty.
552,yes they are coming.
553,you do not like my computer.
554,tell my nurse i am not hungry.
555,they do not have family.
556,you have faith.
557,they have not.
558,i hope they are not here.
559,faith is very good.
560,i hope they are hungry.
561,you are not clean.
562,how do you like music?
563,i have no need.
564,they hope i am going.
565,i feel comfortable.
566,how right.
567,they are right here.
568,they are clean.
569,i hope you like my computer.
570,is my computer very bad?
571,you hope my family is not here.
572,how good is it?
573,i do not have music.
574,very right.
575,where is help?
576,i hope they need music.
577,i hope you do not need music.
578,good faith.
579,my nurse is coming outside.
580,family is not good.
581,they do not need music.
582,i tell you i feel comfortable.
583,what is it you do here?
584,they need that.
585,do you like you?
586,tell my family i do not feel hungry.
587,they hope i have my glasses.
588,you need my faith.
589,i hope they feel good.
590,i am very good.
591,very good music.
592,i clean it.
593,yes my nurse is coming here.
594,what do they tell my family?
595,bring up.
596,do you need help?
597,coming here.
598,i hope you have.
599,what do you feel like?
600,they need it coming up.
601,i am not very thirsty.
602,yes they are coming.
603,you do not like my computer.
604,tell my nurse i am not hungry.
605,they do not have family.
606,if somebody doesn't do something.
607,i had a friend that broke up with me two years ago.
608,didn't have a place to put them.
609,just a little something that's feminine.
610,because they bring guns to school.
611,we do a lot of things on the weekends together.
612,before he was really active.
613,he helps me out a lot and i get paid monthly.
614,i'm not that up on the policy of ways.
615,that is what i am afraid of.
616,they try to stay in office.
617,have something to do with it.
618,i didn't have that much to do.
619,it think it's jamaica.
620,do you exercise?
621,that's a possibility.
622,show some respect.
623,the jury is expected to announce its decision.
624,they've done it before.
625,something with them.
626,two hour classes.
627,it seems like we pay the state.
628,a lot of things.
629,guys and gals whatever they are.
630,i do agree with you.
631,i can't remember who the artist was on that.
632,i don't have luck with that tomato plant.
633,pour in the red wine and bring to a boil.
634,he would get the glory.
635,they were doing some work on the old house.
636,it's going to continue.
637,aluminum foil has a shiny side and a dull side.
638,well maybe i'll get you next time.
639,they don't have oil or anything.
640,the commercial districts.
641,right in our own back door.
642,four year old subaru and a two year old honda.
643,we could not have one as large as we have.
644,that's all they got right now.
645,they had some real fancy names for them.
646,not this past fall but the previous fall.
647,they've not had to do that all year.
648,do you want to start?
649,i've had so many people.
650,well that's good.
651,is peace corps still active down in there?
652,what kind of stuff would they enjoy?
653,we never had any in the house.
654,you can always blame it on having children.
655,i've been here three years.
656,it's a real good book.
657,my wife got in trouble one time with hers.
658,it gets a little bit of everything.
659,other three who went.
660,i like to watch almost all football.
661,that will be fun if you have.
662,did you enjoy this video?
663,i guess that would be good.
664,what do you call those things?
665,i know they will.
666,how people react to things and stuff.
667,his voice was nearly drowned out by the crowd.
668,we weren't all out to be teachers.
669,lumping us all together as asian american.
670,are you in san antonio?
671,we have macaroni and cheese.
672,having twenty million people watch you do that.
673,when our daughter was looking at colleges.
674,i really would be at a loss.
675,it seems absurd that people will pay.
676,or a row of seats actually.
677,that's pretty average to me.
678,it had real good tips.
679,we hold a visionary approach.
680,i don't envy these young parents.
681,he makes it a little bit easier for her.
682,my first comments on the budget.
683,i remember seeing that.
684,i'm kind of the opposite.
685,this session is about to run out.
686,but it's well worth it and everything.
687,a little bit with refugees.
688,they had to abide by the rules.
689,there's not that much time left on the loan.
690,we found a real good interest rate.
691,levy's a surrogate parent.
692,i've only been here a couple of years.
693,there were five of us and i don't recall.
694,i really wanted to go out there and enjoy it.
695,who can scream louder?
696,quite a lot of variety.
697,anywhere on the east coast.
698,cover his ears.
699,you probably have all kinds of trees.
700,which i thought was a lot.
701,he was talking to himself as usual.
702,i took a leave.
703,but when i do it usually brings me joy.
704,when they graduate.
705,red white and blue.
706,the leaves were just horrible looking.
707,precisely my point.
708,sometimes decisions are made before a public meeting.
709,they're trying to get the teams to compete more often.
710,which is the strangest thing i had ever heard.
711,and that kind of thing.
712,i have one daughter still at home.
713,studying electronic technology.
714,it was a point of honor with us not to whine.
715,it was kind of getting to me.
716,it's making profits.
717,that was two days a week.
718,smoking and all that stuff.
719,i don't know how people do it with one.
720,i thought utah was cold.
721,i'm on the phone.
722,we don't actually have a budget.
723,you have to be so precise.
724,it was pretty clear here.
725,they have to adhere to that industry standard.
726,our military people need to know about.
727,when i first saw the visuals i was hooked.
728,these were soviet made.
729,for a rifle there's no waiting.
730,or maybe your daughter.
731,mostly with adolescents.
732,the nice thing i'm looking forward to.
733,i love cheese cake.
734,i'm a quality manager.
735,if it goes down.
736,i watch a show that i like.
737,there was no name to it.
738,i don't have to live through many.
739,our financial situations are dire.
740,i do graphics for their television stations.
741,it's not a hatchback.
742,i don't want to carry money around.
743,i think he kind of misses it a little bit.
744,i don't see much tv mostly when i'm in school.
745,i used to have a chevy.
746,i don't know how my father did it.
747,that is another way of thinking.
748,it would work out.
749,it's pretty different from yours.
750,i'll think of them in a minute.
751,this is the kind of thing you look at.
752,this is probably typical though.
753,but also while i was growing up.
754,do you like the sports programming?
755,if you haven't done it in a while.
756,it's nice that there's a choice.
757,well i think that this kind of misses the point.
758,it's affecting the families you know.
759,some of the larger small schools.
760,we destroyed them right there.
761,which is kind of high for lunch i guess.
762,i talk to my husband.
763,i'd like to go camping cross country.
764,so i kind of grabbed on to that team.
765,there's some nice stuff over there to see.
766,it's not every week.
767,it always sounded.
768,so it all comes filtering down to us all.
769,eligible for a fine.
770,been here all my life.
771,that is kind of wild.
772,it's easy to tweak your version.
773,then it was fine.
774,local boy raises money for headstone of friend.
775,what kind of pet do you have?
776,through to the system.
777,we are not real consistent with this.
778,i'd left him a check for tax.
779,that worked for a while.
780,in many ways each genre is a sport unto itself.
781,to know what's going on.
782,is so careful about recycling.
783,had an upstairs apartment.
784,a lot of trips involved going to visit.
785,one of those loans.
786,where is it going to be?
787,on those issues you have to say yes or no.
788,dents in the hole.
789,we've got some beets.
790,they are totally debt free.
791,we have that here.
792,so do you go to college right now?
793,we rarely go in there.
794,i know i want a big family area.
795,there are three types of measures you can take.
796,i tend to agree with you.
797,lot of concrete and glass.
798,in a way that happened this past season.
799,i think they only have four boys.
800,i guess i need to put it on paper and turn it in.
801,they're cooperative rather than competitive.
802,don't you have to do it as part of its decision?
803,takes an awful lot of time.
804,that's what you find.
805,it's not unusual.
806,the funniness of the gag.
807,i love the water aerobics.
808,but it's so long.
809,i really did enjoy the law.
810,i've just never been called up.
811,remember those three points above?
812,in the business community.
813,it's a telecommunications type of company.
814,i tend to listen to the classical music.
815,where they teach them academic things.
816,it's just so versatile.
817,that would be tough.
818,thank you for your generosity and loyalty.
819,able to give a full sample.
820,there's a big variation among the country.
821,avoid routine.
822,a lot of things were no longer put to use.
823,you might ask what is the point of this.
824,how do you view this whole subject?
825,pursue anything more than your nursing degree.
826,a decision is expected within weeks.
827,you get the death penalty.
828,where do you have to do a whole bunch of work?
829,that really gave us a lot more space.
830,i just graduated in may.
831,i've used a substantial amount of shareware.
832,and the royals can thank them for that.
833,i should be able to do things like this.
