id,text
703,i just don't like that.
704,usual kids to talk about.
705,i mean close to raising my english degree.
706,everything still insists.
707,he made a real big take himself.
708,they're actually great for them.
709,it was for a murder trial.
710,are you a professional musician?
711,it's far beyond me.
712,we get an awful lot from the space program.
713,two sets of grandparents.
714,i call and find out.
715,you want really to bother what.
716,i've heard about him.
717,we've had more freezing this winter.
718,if we can't get a handle on that.
719,they would be your choice.
720,they were okay.
721,to find a band.
722,on a working time.
723,after we had them for several years.
724,if they work at it a little bit.
725,we don't have enough.
726,what are you making?
727,absolutely anything.
728,i had a carpet service call up this time.
729,although he probably plays in a lot of them.
730,just about any kind of music.
731,we like mexican food.
732,i know the day care centers are not cheap either.
733,i found it a lot of time.
734,you've got to find an even line.
735,i think he really makes it.
736,where you got the boy?
737,it all starts to become similar.
738,i could go along with that.
739,it's like one second of recording.
740,that's a big thing with me.
741,i'm the only one.
742,i've been calling through on that.
743,if there starts to be a lot of violence.
744,walking seems to be the best.
745,i don't think too many of them are anymore.
746,how do you feel about your game?
747,when i lived out in the country.
748,i'm originally from maine.
749,to grow up and to desire what they want to do.
750,we just get takes of it on.
751,i had friends.
752,i've worked in hotels.
753,they can pretty much get everybody there.
754,you can say see i'm sorry.
755,the engine blew up in it.
756,the hard choice is so much.
757,i don't have a lot of time.
758,i know there will.
759,sometimes they're not very open.
760,we're toward the program.
761,i make a lot of my christmas presents.
762,we were talking about that just the other day.
763,in the houston area.
764,i'm not kidding on it.
765,i like to have somebody come with me.
766,was also kind of tough.
767,not say that's something i want to do.
768,most of the stores will except those.
769,that is pretty unusual.
770,that's what he grew up listening to.
771,she'll be two in july.
772,i just but didn't win any money.
773,the news or something.
774,i do have my radio going most of the day though.
775,a girl and a boy.
776,he has used a lot.
777,it's a little bit financial type thing.
778,then economic incentive for people to vote.
779,i'm giving from that.
780,help you you are saying in about four hours.
781,what's going to happen?
782,i only weigh sixteen today.
783,horrible stuff like that.
784,an upper or a seventy or something.
785,if they don't have any leveling relative.
786,i watched the news on tv.
787,a record of the strip songs of the eighties.
788,i do not have much to compare it to.
789,i don't read as much as i would like to deal.
790,this was fresher than.
791,i want them to come back this next year.
792,does that when i was a kid i.
793,things that are under state orchestration.
794,i was an administrator.
795,i don't have a lot of time to do it.
796,when i'm up here.
797,i enjoy them coming.
798,but it has a pretty low crime rate.
799,big closet space.
800,they're willing to go some place else.
801,i wait over for.
802,we do a lot of things on the weekends together.
803,i've heard different.
804,we'd have to build this reasons.
805,this light reading.
806,well we just started.
807,we started taking her.
808,my mother and i were.
809,we are so busy.
810,i'd like to go bartending.
811,sometimes you have to ask them for that.
812,then do it all over again.
813,what do you think are some current rents?
814,about a thousand made tracks.
815,do you watch star trek?
816,now we don't have to put it down.
817,i don't see much tv mostly when i'm in school.
818,they could probably come in and say.
819,i don't get too many of those.
820,did they do that before he went in or what?
821,i'm getting rid of this car.
822,i have three cats and a dog.
823,they don't need that seven day waiting period.
824,of course it's real convenient.
825,my husband and i both went.
826,you learn more about the textures and stuff.
827,this a little well to go on a start.
828,then we put our receipts in there.
829,where is it going to be?
830,fifty nine kilometers per killing.
831,that's seen it really.
832,it couldn't be decided.
833,simple services to come.
834,which i thought was a real interesting succession.
835,well that's about it really.
836,if i don't have a real with a button on it.
837,you get a lot of sunfish.
838,i enjoy going to the books and too much areas.
839,i guess i'm partial to big deer country.
840,they are both remarried.
841,the high school i went to.
842,you have to think.
843,you could do it.
844,he was treated like all the rest of students.
845,i don't think so anymore.
846,that's just not enough for a total.
847,one thing like to another.
848,two different parts of the country.
849,i really have any job minutes to speak off.
850,it really helps those people.
851,what a cramp in your.
852,it's a pretty good size church.
853,something for you in the motor home.
854,if you've only got a token force there.
855,this time of the year.
856,i'd just as soon a lot very people did.
857,they think it's kind of cool.
858,some just too much.
859,i didn't know how my father did it.
860,living on a farm for sixty years.
861,i like that somebody has a job all.
862,really kind of done the rounds.
863,i never even knew that.
864,cleaning and grass.
865,the financial district.
866,what's the difference there?
867,i like that kind of stuff.
868,we might as well.
869,savings and loans.
870,they protested over a while.
871,all states white grape.
872,the problem elements.
873,on the outskirts of houston.
874,i forget what she got it.
875,your decision reimbursement.
876,getting back seats for the police state.
877,if you have any doubts whatsoever.
878,sentry movies.
879,i can't remember her.
