id,text
732,i know the day care centers are not cheap either.
733,i found it a lot of times.
734,you've got to find an even line.
735,i think he poorly makes it.
736,where you got the bike?
737,it all starts to become similar.
738,i could go along with that.
739,it's like one second of recording.
740,that's a big thing with me.
741,i'm the only one.
742,i've been calling through on that.
743,if there starts to be a lot of violence.
744,walking seems to be the best.
745,i don't think too many of them are anymore.
746,how do you feel about your game?
747,when i lived out in the country.
748,i'm originally from maine.
749,to grow up and to see what they want to do.
750,we just keep track of it on paper.
751,i had friends.
752,i've worked in hotels.
753,they can pretty much get everybody there.
754,you can say say i'm sorry.
755,the engine plays up in it.
756,the armed forces did so much.
757,i don't have a lot of time.
758,i know this well.
759,sometimes they're not very open.
760,we heard the.
761,i make a lot of my christmas presents.
762,we were talking about that just the other day.
763,in the houston area.
764,i'm not counting on it.
765,i like to have somebody come with me.
766,was also kind of.
767,not sure that's something i want to do.
768,most of the stores will accept those.
769,that is pretty unusual.
770,that's what he grew up listening to.
771,she'll be two in july.
772,i just get it in any money.
773,the news or something.
774,i do have my radio going most of the day though.
775,a girl and a boy.
776,he has used a lot.
777,it's a little bit financial type thing.
778,an economic incentive for people to vote.
779,i'm different from that.
780,come to a nearer thing in about four hours.
781,it's going to happen.
782,i only weigh sixteen.
783,horrible stuff like that.
784,an opera for the seventies or something.
785,if they don't have any living relatives.
786,i watch the news on tv.
787,a record of the rap songs of the eighties.
788,i do not have much to compare it to.
789,i don't read as much as i would like to either.
790,this was pressure.
791,i want them to come back as next year.
792,just that when i was a kid.
793,things that are under state.
794,i was an.
795,i don't have a lot of time to do it.
796,when i'm up here.
797,i enjoy that.
798,but it has a pretty low crime rate.
799,big clauses.
800,they're welcome to go some place else.
801,i would.
802,we do a lot of things on the weekends together.
803,i've heard different.
804,we'd have to build less prisons.
805,that night.
806,well we just started.
807,we started thinking.
808,my mother and i.
809,we are so busy.
810,i'd like to go bird hunting.
811,sometimes you have to ask them for that.
812,then do it all over again.
813,what do you think are some current trends?
814,about a thousand made tracks.
815,do you watch star trek?
816,now you don't have to put it down.
817,i don't see much tv mostly when i'm in school.
818,they could probably come in and say.
819,i don't get too many of those.
820,did they do that before he went in or what?
821,i'm getting rid of this car.
822,i have three cats and a dog.
823,they don't need that seven day waiting period.
824,of course it's real convenient.
825,my husband and i both.
826,you learn more about the textures and stuff.
827,just a little well to go down a chute.
828,then we put a receipt in there.
829,where is it going to be?
830,fifty nine kilometers more.
831,they've seen it.
832,it couldn't be decided.
833,chemical services too.
834,which i thought was a real interesting.
835,well that's about it really.
836,if i don't have a real with a big end on it.
837,you get a lot of sunfish.
838,i enjoy going to the beach and to beach areas.
839,i guess i'm partial to big tree country.
840,they are both.
841,the high school i went to.
842,you have to think.
843,you could do it.
844,he was treated like all the rest of students.
845,i don't think so.
846,that is not enough for a total.
847,one thing like to another.
848,two different parts of the country.
849,i didn't have any job candidates to speak of.
850,it really helps those people.
851,but a camp in your.
852,it's a pretty good size.
853,camping for you in a motor home.
854,if you only got a token first there.
855,this time of the year.
856,i'd just as soon a lot for people.
857,they think it's kind of cool.
858,crime is too much.
859,i don't know how my mother did it.
860,live on a farm for sixty years.
861,i like it almost as a job.
862,really kind of gone the rounds.
863,i never even knew that.
864,gardening and.
865,the commercial.
866,what's the difference?
867,i like that kind of stuff.
868,we might as well.
869,traveling on.
870,they plastered over.
871,all dressed right.
872,the prom.
873,on the outskirts of houston.
874,i forget who he got it.
875,your decision.
876,getting back states for the price.
877,if you have any at whatsoever.
878,city.
879,i can't remember.
