id,text
721,to find a man.
722,on a working farm.
723,after we had them for several years.
724,if they work at it a little bit.
725,we don't have enough.
726,what are you making?
727,absolutely nothing.
728,i had a carpet service call up there.
729,either he's probably buried in a lot of them.
730,just about any kind of music.
731,we like mexican food.
732,i know the day care classes are not cheap either.
733,i find it a lot of times.
734,you've got to find an even line.
735,i think he barely makes it.
736,where you got the boy?
737,it all starts to become similar.
738,i could go along with that.
739,it's like one second of recording.
740,that's a big thing with me.
741,i'm the only one.
742,i've been rolling through on that.
743,if there starts to be a lot of violence.
744,walking seems to be the best.
745,i don't think too many of them are anymore.
746,how do you feel about your game?
747,when i lived out in the country.
748,i'm originally from min.
749,to grow up and to decide what they want to do.
750,we just keep track of it on paper.
751,i had friends.
752,i've worked in hotels.
753,she can pretty much get everybody there.
754,you can scarce say i'm sorry.
755,the engine plays up in it.
756,the car was just so much.
757,i don't have a lot of time.
758,i know this will.
759,sometimes there's not way.
760,we're towards the program.
761,i make a lot of my christmas presents.
762,we were talking about that just the other day.
763,in the houston area.
764,i'm not counting on it.
765,i like to have somebody come with me.
766,was also kind of tough.
767,not sure that's something i want to do.
768,most of the stores will accept those.
769,that is pretty unusual.
770,that's what he grew up planning to.
771,he'll be four in july.
772,i just get didn't been any money.
773,the news or something.
774,i do have my radio going most of the day though.
775,a girl and a boy.
776,he has used a lot.
777,it's a little bit financial type thing.
778,an economic incentive for people to vote.
779,i'm going from that.
780,have you heard singing in about four hours.
781,what's going to happen?
782,i only weigh sixteen to.
783,horrible stuff like that.
784,an opera for the company or something.
785,if they don't have any living relatives.
786,i watch the news on tv.
787,a record of the type songs of the eighties.
788,i do not have much to compare it to.
789,i don't read as much as i would like to either.
790,this was professional.
791,i want them to come back up next year.
792,noticed that when i was a kid.
793,things that are under state.
794,i was an imposter.
795,i don't have a lot of time to do it.
796,when i'm up here.
797,i enjoy them coming.
798,but it has a pretty low crime rate.
799,big closet space.
800,they're welcome to go some place else.
801,i would suffer.
802,we do a lot of things on the weekends together.
803,i've heard different.
804,we have to build this prison.
805,just a light reading.
806,well we just started.
807,we started taking her.
808,my mother and i were.
809,we are so busy.
810,i'd like to go.
811,sometimes you have to ask them for that.
812,then do it all over again.
813,what do you think are some current events?
814,about a thousand bad.
815,do you watch star trek?
816,no you don't have to get it down.
817,i don't see much tv mostly when i'm in school.
818,they could probably come in and stay.
819,i don't get too many of those.
820,did they do that before he went in a fight?
821,i'm getting rid of this car.
822,i have three cats and a dog.
823,they don't need that seven day writing period.
824,of course it's real convenient.
825,my husband and i both went.
826,you learn much about the textures and stuff.
827,just a little girl to go on a shoot.
828,then we put our receipts in there.
829,where is it going to be?
830,fifty nine kilometers per gallon.
831,there's seen it earlier.
832,it shouldn't be destroyed.
833,chemical services to come.
834,which i thought was a real interesting question.
835,well that's about it really.
836,if i don't have a deal with a book on it.
837,you get a lot of sunfish.
838,i enjoy going to the beach and to work areas.
839,i guess i'm partial to big tree country.
840,they are both remarried.
841,the class school i went to.
842,you have to think.
843,you could do it.
844,he was treated like all the rest of students.
845,i don't think so many.
846,that's just not enough for a total.
847,one thing like to another.
848,two different points of the country.
849,i really don't have any job benefits to speak of.
850,it really helps those people.
851,but a cramp in your.
852,it's a pretty good size search.
853,camping for you in a motor home.
854,if you've only got a second for there.
855,this time of the year.
856,i'd just as soon a lot very people did.
857,they think it's kind of cool.
858,some it's too much.
859,i don't know how my brother does it.
860,live on a farm for sixty years.
861,i look at something as a job also.
862,really kind of gone the rounds.
863,i never even knew that.
864,clothing and gas.
865,the commercial.
866,what's the difference there?
867,i like that kind of stuff.
868,we might as well.
869,saving and loan.
870,they plastered over drywall.
871,i'll dress right.
872,the mom.
873,on the outskirts of houston.
874,i got to see get it.
875,your person.
876,getting magistrates for the peace street.
877,if you have any doubt whatsoever.
878,actually movies.
879,i can't remember her.
