id,text
0,the axis recounted.
1,rest purchased several signed lithographs.
2,two rules we made in unabashed collusion.
3,those costumes need black gloves to be completely elegant.
4,the truth the va to come and roger tooth fell out.
5,that singing paper was called a quad preparation.
6,bar for laurels and am use every formula.
7,wildfire near london has sparked.
8,the word means it won't fall away cicely nothing else.
9,would a blue feather in a man's hat make him happy all day?
10,i talked about an authentic story line too.
11,most young was early every morning.
12,with this new law cellular can scroll.
13,primitives have an upbeat edited.
14,and it's not a judge but a justice of the peace who made the decision.
15,we seemed to be witnessing the population explosion right in our own backyards.
16,sometimes desperate measures can also turn into light moves for the feature.
17,those actions will be straight guarded if if you think them usually of force.
18,the she gets dressed faster and spends less energy making grueling decisions.
19,economic aptitude interests you supplement.
20,to some extent predispositions are shaped by exposure to group environments.
21,an adult male ribs are not suitable for eating shellfish.
22,in this context it would do well for us to bear in mind the vision of peace.
23,you're boiling milk and you are.
24,we look for spotted hyenas and jaguars on the safari.
25,traffic frequently has failed to message to engineers we estimate.
26,self prepared red snapper with fresh lemon slices for dinner.
27,did you buy any corduroy overalls?
28,your pronunciation is appreciated.
29,please shouldn't this cost for choice?
30,who authorized the unlimited expense account?
31,the family requests that papers be amended.
32,the museum hires positions every evening.
33,well so rhubarb pie after traditional talk.
34,they considered it when i audition.
35,the avocado should have a gift to it as you hold it when it is ripe.
36,industry players usually deal with this by conducting regular inspections and trimming.
37,the store is broken so stop the food instead.
38,the cleaned version is given below.
39,they seem down spared of it.
40,a sharp tremor was followed by a jerky roll.
41,boy you can't ruling nobody but yourself.
42,station guides are included with each record.
43,the man's eyelids fluttered.
44,this kid's pro's bad.
45,she radiated warmth and good fellowship.
46,do you know where it might have gone?
47,in the place for them his loneliness was gone.
48,join us on twitter and facebook.
49,he said they'll be working toward a decision.
50,saving cream is a popular time on halloween.
51,then simmer fifteen minutes longer.
52,a third got out the light.
53,the guttural single from the lady dips.
54,think as if it were built of books.
55,then he then right.
56,i am an artist lost in my own vision.
57,blockade is one answer offered by experts.
58,those musicians harmonize marvelously.
59,it all did look very efficient and ship.
60,that was no longer fair knees.
61,inflammatory cells were strikingly happened.
62,it can spot long work calls for itself.
63,indulgence had at him occasionally.
64,do you hear the stable bells ringing?
65,there was much interesting muscly.
66,so is a specific guide keyed to the planner.
67,and he asked do you expect to pay.
68,we'll pay you back if you'll let us.
69,they close sometime after eight.
70,then we were off again.
71,his wife didn't give a sign she'd heard.
72,for a man of his mass it was fairly short.
73,some free driving lessons on thursdays.
74,read the decision below.
75,received no answer here at the far.
76,yours is you usual happy.
77,a country to meet a lion in face to face.
78,with a rolling dump it could get into a.
79,marksmanship.
80,it's really hard to find something that works.
81,and i love the shining.
82,i do have a friend that ran.
83,just where in the back.
84,actually it makes sense to a certain extent.
85,a to the government that he was employed.
86,they feel good about what they're doing.
87,besides it's an invasion of personal privacy.
88,so you travel a lot.
89,so we're going to wait.
90,any kind of a good environment to live in.
91,the best of android.
92,i don't know what you think about the point.
93,i believe it costs about ten dollars.
94,what in the world drugs are you on to?
95,android tv box.
96,a couple of times.
97,i had the brakes done on it.
98,which i use as a reference and has been real handy.
99,i know when i was working.
100,it's a package deal.
101,i have seen it.
102,the measures already passed the senate committee.
103,they told me that that was a topic.
104,in the red square or wherever said.
105,they did a lot of pre work and stuff.
106,you can gain too much weight.
107,recent legislation.
108,i'm a car buff too.
109,joy springs from a grateful heart.
110,all in every deal never lay oil to smoke.
111,no choice does air pollution.
112,and then you sprinkle the cheese on top of that.
113,just seeing that clear vision is a necessity.
114,factors that affect earnings of an employee.
115,if you drink a lot of caffeine you'll stay weak.
116,that's a nice car.
117,visionary leaders.
118,the only other place i've ever vacationed.
119,i just kind of went through.
120,this is underlying voice we need.
121,do you have your bag?
122,do you know it keeps us pretty busy.
123,that's a science in itself.
124,so when you get in tight situations.
125,i can relate to that.
126,it's all really quit pleasing.
127,if they're around anymore.
128,i am not even aware that i could have seen it.
129,the ranks of asian brides are filling too.
130,einstein equation.
131,most points at the end.
132,i think it's one hundred and eighty miles.
133,we don't usually take the kids when we go there.
134,one of those generation novels.
135,they'll never get caught.
136,i don't buy the whisper.
137,wrangling something for a public picnic.
138,i'll think it out.
139,improved vision does not work.
140,casualties were reported.
141,you just like to sit down and watch it.
142,he helps by giving little pointers.
143,cause they all grew up in new york city.
144,you make such a choice.
145,but they have six over there.
146,a good positive.
147,that's what i was going to point out.
148,i turned mine in about twelve hours early at noon.
149,it's a colocation type of company.
150,i work out of my home.
151,the way it works.
152,it doesn't have an air conditioner.
153,then you have to make a salad.
154,solving the variables in the equation.
155,i read in the paper.
156,i'm in the speech processing business.
157,once every year or two.
158,you don't eat it at all.
159,twelve men tried and true.
160,i think that's something we might want.
161,she thought for a few minutes.
162,that is a sad situation.
163,they do have capital punishment.
164,it was nice talking to you johnny.
165,my favorite team is the rangers.
166,kind of goes along with what you were saying.
167,why they don't do with fourteen one.
168,reader's choice award.
169,they are the detroit delegates.
170,he went to vietnam one man and came back another.
171,as any city grows up.
172,so you did buy a pattern.
173,it's about taking and a half percent.
174,i agree with the phone.
175,so i think it's going to be a lot easier.
176,not too much soy sauce.
177,we take a certain portion of your plastic.
178,who pampers you?
179,and i don't know what's going to happen.
180,i think we have about thirteen months left on it.
181,i do particularly find it.
182,they have clubs and a swimming pool.
183,our point of view.
184,it really is worth while to so.
185,i felt that was a little insensitive.
186,public installation.
187,focal point.
188,i do one and one.
189,what are we doing?
190,my job tends to be very demanding.
191,you know it was just in last.
192,and most people like that are old.
193,that's what i was doing before.
194,the best teachers and the best students.
195,i don't like it cold.
196,she was inaugurated in january.
197,wait a minute.
198,those are no good anymore.
199,i do want to have a raised bed.
200,i see that but yet i know too.
201,it wasn't organized enough for me.
202,if i don't know the story line.
203,that i've liked in the past.
204,you say my treasure.
205,he had choices to make a counselor told him.
206,the last time he came was in march.
207,i'm getting pretty.
208,it's really a cost.
209,have little material luxury but want a lot more.
210,you guys really are loving.
211,we've got a son from austin.
212,competition with different.
213,it still makes most of its profit in asia.
214,i think that is important too.
215,have a good evening.
216,unfortunately we tend to make this equation.
217,he didn't eat flies.
218,most of the time they don't bother with it.
219,they didn't ship it so i got it back.
220,i'm sure all the eggs are in it.
221,the family is that good.
222,a lot of the eighties movies.
223,one closure isn't enough.
224,contact points.
225,this morning it was twenty nine.
226,satan rejoiced with his birth.
227,they feel that because of the drug issue.
228,these are done with a flour tortilla.
229,don't like.
230,that is usually for some people.
231,i'm away from my other son during those hours.
232,where do you have to do a whole bunch of work?
233,i take it she was an accountant.
234,go to a trip for the indonesians.
235,no problem there at all.
236,the way of life and.
237,pass me that joint back account statement.
238,filters for air coloration for hospitals.
239,i do that when we travel.
240,i only saw the end of the first quarter.
241,is there work to support this conclusion?
242,buy a training machine.
243,as soon as we get this house finished.
244,and just keep chipping away at the house.
245,all the money.
246,my husband has a tool shed out back.
247,certain kinds of scene.
248,i always threaten my daughters with time out.
249,north korea is still allowed to receive oil.
250,it's still about getting vendors more involved.
251,pass me that joint back around cement.
252,what you need is a tougher punishment regime.
253,so it was really too late to do much.
254,i wanted to go to that golf course down north.
255,you get a little taste of it and you say no.
256,they don't even take my oracle security number.
257,cycles and paracelsus.
258,i don't know if you have ever heard of it.
259,social object.
260,that's exactly the way he feels.
261,do you really not remember?
262,that him enjoying that side of it.
263,the ranks of asian writers are swelling too.
264,the mission will draw the christians conclusions.
265,burials really happened during the morning.
266,be kind to your whole self.
267,that's the other bar that we went to that night.
268,i don't know why.
269,you can fix sex love explosions estimates here.
270,he's in first grade now.
271,i guess there's some companies that aren't going fast enough.
272,increasingly semantically oriented.
273,something a little extra.
274,i kind of use that they had a little like for the boys.
275,killer bee.
276,i hadn't heard about that.
277,the ability of people to access healthcare.
278,that's probably one of the reasons.
279,quite a few movies are based off of that.
280,but when i went home that's all i could think about.
281,i'm north of that actually.
282,a chemical rocket on hair conditioner.
283,it was something easy i could do.
284,i think it's what a lot of people call too fast religion.
285,brown and black patches of fur.
286,the jury is expected to announce its decision.
287,some events.
288,i don't get to watch.
289,it was all money now to.
290,i'll help hold that more.
291,pollution everything.
292,the problems do it to their benefit.
293,that is good that they're like that.
294,there is some different talk in your report.
295,i didn't tell time in schooling but buying on work.
296,the new york accident places the measure.
297,when we were in high school it was always fun.
298,she knows how to do that.
299,are you going to go see the eagles of love?
300,i'm sure there are some.
301,that's kind of like what we'd like to do.
302,quite a lot of very.
303,i haven't been to a baseball game in here.
304,rent rent paying any more.
305,a round of oil and vinegar.
306,it just kind of drags on forever.
307,that's the only way you can get to canada from here.
308,we got a really low.
309,here are the state's excerpts from the draft.
310,i have to think about it some more now.
311,i was really kind of excited to start reading.
312,what are you saying?
313,it's very interesting.
314,i enjoyed it very much.
315,he had occasion to her mother's money.
316,an earlier version of this article.
317,you might even be able to get a job there.
318,enjoyable to use.
319,we came to a fork in the road at night.
320,he will like it and i don't.
321,it's just in small.
322,i think there is confusion.
323,just go someplace for the day.
324,but they're going to learn it sometime.
325,it was the big one.
326,it's kind of a depressing track.
327,every six months i have to pay my taxes.
328,i've never been sailing.
329,i have take years of college.
330,and then the next one down is in the primaries.
331,enjoy the adventure.
332,not lately though.
333,too many city problems for the long term.
334,are there any other genres or trends you're interested in exploring?
335,yes i consider myself what they call a full timer.
336,more family rented.
337,do you know that i've never seen a monkey?
338,i know both people.
339,he recommends the handguard to a lot of people.
340,do you have a computer for yourself at home?
341,it's the original.
342,you can't blame them.
343,more trust more accountability.
344,i guess traffic could be an annoyance.
345,we've got four remaining foods and eleven foods.
346,i had to dust and things.
347,football is an insane sport.
348,i'm glad it's on.
349,i don't know the details.
350,can you speak more about this system of sanitary decentralization?
351,too many horror stories out there.
352,every major city has a theater.
353,go to the zoo and see elephants and dogs and things like that.
354,it's been kind of fun.
355,that appeared to be eight or nine years old.
356,i'm kind of out of it right now.
357,i don't mind when everything in the paper.
358,my breath can't do it.
359,not everybody shows up.
360,americans have missed them out of their entire time.
361,it was just based on the facts.
362,wasn't it your state that had police involved?
363,did you actually use drugs at all?
364,i don't have to much either.
365,i can find it in a day.
366,very well displayed.
367,little gem box.
368,the tree was u pregnant.
369,i'm knitting charts.
370,do you have some resting time?
371,where did you get this cook book?
372,written in the case of several.
373,past the field it's spencer's.
374,i'll try that next week.
375,we do as a matter of fact.
376,i have some games.
377,we're going to feel it right out.
378,the news is a good way to keep up to date.
379,point blank in the face.
380,just walking the streets.
381,he did not want to be in it any more than i did.
382,the teachers had eleven kids.
383,we were promised civil liberties.
384,take her to join definitely.
385,dollars are inserted into politics.
386,don't let them see violence at home.
387,the issue is that your employer is going under.
388,what do you write for them?
389,our point of view.
390,the lot we lived on is now a ranch.
391,were you next article do you want a truck?
392,it's hard to tunnel a can.
393,they pass your phone number on to another company.
394,they had sixty four of them.
395,well i like the seventy.
396,this is fashion as liberation.
397,it's probably going to be a real old news on.
398,enjoy your day.
399,the mental place to raise them.
400,very definitely at five thirty.
401,lawmakers passed a measure last year.
402,i mean a large flat plate.
403,i'd like to see it be more of animals more sport.
404,all of our strain can.
405,playing more often than usual.
406,capital punishment.
407,everyone knows they're going to get it.
408,my in law listed to the kind of music i hate.
409,download on your computer or tv.
410,and we play out here in the summertime.
411,it never did run right again.
412,you are technically exploited.
413,especially the ones that came out and said the place.
414,be an extra you you know.
415,we love on.
416,formal employers.
417,it looks like they've got a refund.
418,but you don't know that.
419,i noticed something interesting last time.
420,they wouldn't have to.
421,do you all like home cooking?
422,so it seems to be.
423,the decision to censor the article.
424,fresh breath for employment cases.
425,it was just depends.
426,i like this.
427,they've got the full right room.
428,you tend to have a reply.
429,that's one that you like for city hall.
430,the measure now heads to government.
431,my three year old.
432,it's not reasonable you know.
433,i can't really think of anything else offhand.
434,i'm not sure how to go about it.
435,it's very tedious if you don't have a whole group.
436,it was a cordless phone.
437,but it's kind of hard.
438,you can do so much with them.
439,i still get got embarrassed by the.
440,it was like two hundred times as much.
441,it's probably done.
442,i would feel that i had the right to.
443,you just kill him protect.
444,i know there is.
445,it really hurts me.
446,the experience.
447,do we have to wait until all the land feels.
448,very scary to me.
449,i think it is getting worse.
450,i really would like to see them to well.
451,i don't live in a house.
452,people put them in.
453,it can swim away fast enough and go hide.
454,for about two hundred dollars.
455,in that time frame.
456,trying to make it through that.
457,anything like that we protested.
458,seven years in the pros.
459,twenty years or so.
460,i think it does help.
461,that has got to be someone this time of year.
462,even the busses.
463,cats will still live.
464,it's been kind of scary.
465,the leaves are just dead.
466,we try to go so often.
467,it took four days.
468,the pros and cons of both.
469,we're flower bed.
470,you get programming.
471,not that i like reading.
472,i think a cup or two.
473,i don't mean to be talking.
474,i'd like to see those.
475,a controlled substance.
476,the real cost.
477,i guess he's trained in this.
478,it might be kind of tricky.
479,perhaps not in the manner that we do it.
480,do you have friends with older children?
481,one hand more close to it.
482,i just file referral income time tax every year.
483,i grew up on a farm.
484,that was the one that's been really nice to have.
485,they've done it before.
486,the engine was pretty good.
487,how different the people there really are.
488,we get out on the water occasionally.
489,maybe once every car or so.
490,that's fine with one.
491,i miss that once in a while.
492,how to do things.
493,i definitely am not a cat person.
494,the junk mail that you get.
495,they put him in the nurses office.
496,then this time last year i've changed.
497,they didn't fight together.
498,he seemed to know what he was doing.
499,they just live in the community.
500,it had to be november anyway.
501,if you do decide to go with child care.
502,the insurance paid for the party doubles.
503,one is eight and one is eleven.
504,i was dog dated.
505,no nuts and development companies.
506,they are going to get a gun no matter what.
507,when i was in high school we had a choice.
508,never painted the outside.
509,that's how we got started.
510,a nicer guest than i could afford.
511,it's really beautiful.
512,most people don't.
513,i think what they will do is start playing mexico.
514,i haven't experienced it.
515,you have to have a pretty good team.
516,they're small little trucks and cars like that.
517,they don't have the ability to develop it.
518,you got to have a one month indicator.
519,there's so much going on here.
520,the victims' families and things.
521,my one of these late in life mothers.
522,the drug dealers.
523,my wives mother is the only grandparent left.
524,they're grown now.
525,i have never said before.
526,i don't know what we're going to do.
527,it's second nature.
528,find out where the languages are.
529,we don't get to see too many.
530,it's like a bullet going by.
531,i mean last study was eighteen dollars.
532,it's really unfortunate.
533,the next morning you want to take them out.
534,if the news we're getting is any good.
535,if something goes wrong.
536,i haven't seen any.
537,you two see each other all through the house.
538,you don't worry about them too much.
539,that kind of grass.
540,it really can't make any difference.
541,i was born in texas and i visited other areas.
542,i guess because i work quite a bit with lawyers.
543,i guess i haven't had that much experience.
544,reports and papers and that sort of thing.
545,spending money that does not belong to them.
546,does it have to be a special color?
547,that's the freedom of choice.
548,i don't know too much about it.
549,my son plays football.
550,she or the family liked it.
551,one in college already.
552,were his civil rights violated?
553,it looked like it would be.
554,doing laundry by hand and that kind of thing.
555,i don't want stubs in my lawn.
556,we can keep that out of our minds.
557,from for his industry business.
558,we are seeing that here as well.
559,that's what made me happy.
560,it depends on the person.
561,i don't make that much.
562,it's been a long time.
563,no one can live on ice.
564,maybe they based it on that mystery room movie.
565,it seems like they would be able to.
566,i didn't find the car.
567,she's one of those that loves.
568,now i just have to fit it though.
569,mostly with adolescents.
570,i'm not a company or anything like that.
571,i like to listen to piano music a whole lot.
572,two hour classes.
573,basically.
574,do you enjoy camping?
575,it's kind of a show piece.
576,months and there.
577,how do you like your treadmill?
578,it was just to pay it all times.
579,their self identity is stronger.
580,it is pretty okay.
581,i thought that that was what sellers said was for.
582,i couldn't get her up.
583,was it six weeks old?
584,fifteen feet wide.
585,you're a bigger city.
586,fish chunks and dip it in the fondue.
587,when you found out who it was.
588,because this big going to school.
589,they will up.
590,have you ever been drug tested?
591,he could get hurt.
592,i'm originally a texan.
593,so you've got a lot of traffic noise real close.
594,really enjoyed it quite a bit.
595,i know a girl.
596,we've got to eat most of the time.
597,to the price of what a bay.
598,even in my case.
599,can do whatever they want.
600,guess you run it.
601,a little more facility.
602,they even looked after.
603,the food prices.
604,i think the decision has been made.
605,they are not sure of themselves.
606,two sides of the same coin are.
607,he didn't really pay attention.
608,if you're ever looking for that.
609,go you own conclusions.
610,that's from the kids' standpoint.
611,there is no timetable for a decision.
612,golden retrievers.
613,just get you one and.
614,you take time you see it.
615,i mean you can earn a lot more money.
616,but at that point i was too far gone.
617,his face was really drowned out by the crowd.
618,i didn't notice it.
619,that was a great little car.
620,over a very long period of time.
621,od unfastening.
622,vice presidents of companies.
623,i wasn't opposed to paying for it.
624,two couples choose.
625,they are lovely.
626,we see more and more homes by and involves.
627,i have to make this one last as long as i can.
628,only to the airport.
629,well tell me this.
630,that would be really awful.
631,questions and answer period.
632,because you don't know.
633,pour in the red one and bring to a boil.
634,i'll turn the radio on.
635,they say if you're not all in this line.
636,that's the way i feel.
637,what happened to get us to this point?
638,trump has said there was no collusion.
639,it was a great pleasure speaking with you.
640,i had the opposite.
641,we sit around and eat someone.
642,i don't have boys.
643,it would have been past time to go.
644,if they didn't have to.
645,that's certainly true.
646,your involvement or attention.
647,we have that here.
648,usually be fine for survival.
649,i've had too many people.
650,i don't even get to see half my precinct.
651,we put some effort on the floor.
652,that's the closest thing.
653,it's kind of funny actually.
654,it was was the back i guess.
655,a pop up trailer.
656,you're with the home office now.
657,they seem to be economically living also.
658,that would be a really good thing to do.
659,too much business.
660,he's retired now.
661,i heard this on a christian program.
662,even though they're too close.
663,earning his money.
664,i had never seen anything.
665,the rich people started.
666,used to be six bucks.
667,i caught a drop.
668,i feel so silly.
669,are they all here in the area?
670,i kind of look at it this way.
671,public parking.
672,sewing and quilting.
673,good to hear from you.
674,through oklahoma city.
675,i read a lot and then i know people.
676,did you build them?
677,that would make me happy though.
678,it's nice to get out in the open air.
679,i think it would do something for it.
680,it has really been nice here.
681,they don't grant college.
682,it worked out real nice.
683,we've had a lot of them in the past.
684,it's only been that way in the last five years.
685,i live out in the middle of it.
686,it's depressing to.
687,i don't own my home.
688,i've always wondered how he gets around.
689,it's just tough.
690,fiction books that i really like.
691,you got any more?
692,i'm beginning to think it's not.
693,that's something i miss quite a bit.
694,they finally came up with evidence.
695,that's true i didn't think about that.
696,good deal as a team.
697,part of it would probably work out.
698,it's necessarily going to involve more taxes.
699,it's just going to follow.
700,i'm kind of a car buff myself.
701,buying of a case.
702,sometimes it will stop.
