id,text
0,the caucus accounted.
1,this spring several signed lithographs.
2,those rules we made in another collusion.
3,roy's costume needed black gloves to be completely helen.
4,the truth will rot to some one word truth fall out.
5,that singing leper was just the kid people listen.
6,before thirty and am visually formally.
7,wildfire near sundance has park.
8,they wouldn't make it one meal away easily nothing is.
9,would a blue feather in a man's hat make him pretty or d.
10,he talked about on the landing crew line you.
11,both young guys early every morning.
12,with this new coalition can scroll.
13,many jobs have an upbeat attitude.
14,and it's not a judge but a justice of the peace who made the decision.
15,we seem to be running the population explosion right in our own backyards.
16,combines different measures and also to intuit moves for the future.
17,the decisions will be straightforward if you think them through carefully.
18,the she gets dressed faster and spends less energy making clothing decisions.
19,academic aptitude interests your diploma.
20,to some extent principles are shaped by exposures to group environments.
21,an adult male means they are not suitable for eating shellfish.
22,in this country it would do well for us to bear in mind the vision of peace.
23,you're boiling milk at you.
24,which look for spotted hyenas and strangles on the surface.
25,traffic signal has failed to met up to engineer wise estimates.
26,self prepared red snapper with fresh lemon sauce for dinner.
27,did you buy any country overalls?
28,their pronunciation is appreciated.
29,please shorten this skirt for joyce.
30,who authorized the unlimited expense account?
31,the family decision that ours be amended.
32,the museum hires patients every evening.
33,i'll serve rhubarb pie after national talk.
34,they enjoy it when i audition.
35,the avocado should have a tip to it as you hold when it is trip.
36,any spiders usually deal with this by constructing regular inspections and screaming.
37,the store is bringing to shop the wood instead.
38,the canadian version is seven bowl.
39,they seem darned fond of it.
40,a sharp tremor was followed by a turkey roll.
41,boy you and fooling nobody but yourself.
42,section guides are included with each record.
43,the main island flattered.
44,this kid's father's bad.
45,she radiated warmth and good fellowship.
46,do you know where it might have gone?
47,in the pay for them his ordinance was gone.
48,join us on twitter and facebook.
49,he said they'll be working toward a decision.
50,saving cream is a popular time on halloween.
51,then some fifteen minutes longer.
52,a third thought doused the light.
53,the guttural gag from the lady stopped.
54,looks as if it for built of books.
55,then he then what?
56,i am an artist just in my own vision.
57,blockchain is one answer offered by experts.
58,the musicians harmonize movingly.
59,it all did look very official and city.
60,that we no longer feel any.
61,inflammatory cells were strikingly extant.
62,it can operate long ways calls for itself.
63,intelligence ripped at him occasionally.
64,do you hear the sleigh bells ringing?
65,there was much impressing much acclaim.
66,or is a specific guide keyed to the standard.
67,suddenly he asked do you object to paying.
68,we'll pay you back if you'll let us.
69,they close sometime after eight.
70,then we are off again.
71,he's wife doesn't give a sign she'd heard.
72,for a man of his mass he was curly short.
73,come see driving lessons on thursdays.
74,read the decision below.
75,receiving no answer they set the fire.
76,where is you usual apt personally?
77,my country to meet a lion in face to face.
78,with a rolling dump it could get into a.
79,marksmanship example.
80,it's really hard to find something that works.
81,and i loved the thing.
82,i do have a friend that ran.
83,just right in the back.
84,actually it makes sense to a certain extent.
85,assure the government that he was employed.
86,they feel good about what they're doing.
87,besides it's an invasion of personal privacy.
88,so you travel a lot.
89,so we're going to wait.
90,any kind of a good environment to live in.
91,the best of android.
92,i don't know what you think about the point.
93,i believe it costs about ten dollars.
94,what in the world drugs are you on to?
95,android tv box.
96,a couple of times.
97,i had the brakes done on it.
98,what i use as a reference and has been really handy.
99,i know when i was working.
100,it's a package deal.
101,i have seen it.
102,the measures already passed a senate committee.
103,they told me that this was a topic.
104,in the red door or wherever said.
105,they did a lot of play work and stuff.
106,you can gain too much weight.
107,recent legislation.
108,i'm a car buff too.
109,joy springs from a grateful heart.
110,do n over grill never allow oil to smoke.
111,no noise does air pollution.
112,and then you sprinkle the cheese on top of that.
113,just seeing that clear vision is a necessity.
114,factors that affect earnings of an employee.
115,if you drink a lot of caffeine you'll stay awake.
116,that's a nice car.
117,visionary leaders.
118,the only other place i've ever vacationed.
119,i just kind of went there.
120,this is unifying voice we need.
121,do you have your bag?
122,so you know it keeps us pretty busy.
123,that's a science in itself.
124,so when you get in tight situations.
125,i can relate to that.
126,it's all ready cooked playing.
127,if they're around anymore.
128,i am not even aware that i could have seen it.
129,the ranks of asian riders are filling too.
130,einstein's equation.
131,most points at the end wins.
132,i think it's one hundred and eighty miles.
133,we don't usually take the kids when we go there.
134,one of those generation novels.
135,they'll never get caught.
136,i don't buy the newspaper.
137,making something for a potluck picnic.
138,i'll take it out.
139,improved vision does not work.
140,casualties were reported.
141,you just like to sit down and watch it.
142,he helped by giving little pointers.
143,but they all grew up in new york city.
144,you make such a choice.
145,but they have six over there.
146,a good positive direction.
147,that's what i was going to point out.
148,i turned mine in about twelve hours early at noon.
149,it's a telecommunications type of company.
150,i work out of my home.
151,the way it works.
152,it doesn't have an air conditioner.
153,then you have to make a salad.
154,solving the bubbles in the equation.
155,i read in the paper.
156,i'm in the speech processing business.
157,once every year or two.
158,you don't eat it at all.
159,twelve men tried and true.
160,i think that's something we might want.
161,she thought for a very minute.
162,that is a sad situation.
163,they do have capital punishment.
164,it was nice talking to you dudley.
165,my favorite team is the rangers.
166,kind of goes along with what you were saying.
167,why they don't go with part one.
168,reader's choice award.
169,they are the detroit delegates.
170,he went to beat him one man and came back another.
171,as any city grows up.
172,so you did buy a pattern.
173,it's about six and a half percent.
174,i agree with the fine.
175,so i think it's going to be a lot easier.
176,not too much soy sauce.
177,we take a certain portion of your plastic.
178,who sponsors you?
179,and i don't know what's going to happen.
180,i think we have about thirty months left on it.
181,i do particularly find it annoying.
182,they have clubs and a swimming pool.
183,our point of view.
184,it really is worth while to know.
185,i felt that was a little insensitive.
186,public installation.
187,focal point.
188,i did one and one disappointed.
189,what are we doing?
190,my job tends to be very demanding.
191,you know it was just in jest.
192,and most people like that are old.
193,that's what i was doing before.
194,the best teachers and the best students.
195,i don't like it cold.
196,she was inaugurated in january.
197,wait a minute.
198,those are no good anymore.
199,i do want to have a raise bad.
200,i see that but yet i know too.
201,it wasn't organized enough for me.
202,if i don't know the story line.
203,that i've lacked in the past.
204,your same my pleasure.
205,he had choices to make the colonel told him.
206,the last time he came was in march.
207,i'm getting pretty.
208,it's really a cost.
209,have little material luxury but want a lot more.
210,you guys really are notified.
211,we've got a stone from austin.
212,compensation with japan.
213,it still makes most of its profit in asia.
214,i think that is important too.
215,have a good evening.
216,honestly we tend to make these occasions.
217,he didn't eat flies.
218,most of the time they don't bother with it.
219,they didn't strip it so i got it back.
220,i'm sure all the eggs are in it.
221,the family issues that get discussed.
222,a lot of the entries moved southward.
223,when disclosure isn't enough.
224,contact points.
225,this month it was twenty nine.
226,satan rejoiced with his birth.
227,they fell out because of the drug issue.
228,these are done with a flour tortilla.
229,don't collect unimportant.
230,that is usual for some people.
231,i'm free from my other son during those hours.
232,where do you have to do a whole bunch of work?
233,i take it she was an account.
234,go to a trip for the intonations.
235,no problem there at all.
236,their way of life changed.
237,past me that won't make account statement.
238,filters for air filtration for hospitals.
239,i do that when we travel.
240,i only saw the end of the first quarter.
241,is there work to support this conclusion?
242,by a staring motion.
243,as soon as we get the house business.
244,and just keep chipping away at the ice.
245,all the money.
246,my husband has a tool shed out back.
247,certain kind of scene.
248,i always threaten my daughters with time out.
249,north korea is still allowed to receive oil.
250,let's see about getting paid more involved.
251,pass me that joint back and treatment.
252,what you need is a tougher punishment regime.
253,so it was really too late to do much.
254,i wanted to go to that golf course down south.
255,you get a little taste of it and you say no.
256,they don't even take my struggle reality mumble.
257,disco and philadelphia.
258,i don't know if you have ever heard of it.
259,social barbarous.
260,that's exactly the way he feels.
261,do you really not remember?
262,it him enjoying that side of it.
263,the ranks of asian writers are swelling too.
264,the machine will store the corresponding conclusions.
265,burials usually happen during the morning.
266,my kind to your whole self.
267,that's the other bar that we went to that night.
268,i don't know why.
269,you can fake sex love explosion predilections or.
270,he's in first grade now.
271,i guess there's some companies that aren't growing fast enough.
272,occasionally democratically oriented.
273,something a little extra.
274,i kind of wish that they had a little like for the boys.
275,killer bee instinct.
276,i hadn't heard about that.
277,the ability of people to access healthcare.
278,that's probably one of the reasons.
279,quite a few movies are based off of that.
280,but when i went home that's all i could think about.
281,i'm north of that actually.
282,a couple parts on here consider.
283,it was something easy i could do.
284,i think why a lot of people go to rest really.
285,brown and black patches of war.
286,the jury is expected to announce its decision.
287,simmering points.
288,i don't get to watch.
289,or all money.
290,help help probably that more.
291,billion everything.
292,they're probably doing it to their benefit.
293,oh that is good that you like that.
294,there is some definite work in her report.
295,i remember little times in schooling being prided on work.
296,the new york taxi didn't print the mail.
297,when we were in high school it was always fun.
298,she knows how to do that.
299,are you going to go see the executors of love?
300,i'm sure there are some.
301,that's kind of like what we'd like to do.
302,get a lot of parity.
303,i haven't been to a baseball game in years.
304,it's one parent anymore.
305,a dressing of oil and vinegar.
306,it just kind of dragged on forever.
307,that's the only way you can get to canada from here.
308,she got a cr low.
309,here are the six experts from the left.
310,i have to think about it some more now.
311,i was really kind of excited to start reading.
312,what are you saying?
313,very interesting.
314,i enjoyed it very much.
315,he had occasionally sent her money money.
316,an earlier version of this article.
317,you might even be able to get a job there.
318,enjoyable to use.
319,we came to a fork in the road at night.
320,he really likes it and i don't.
321,it's nice and small.
322,i think there is confusion.
323,just go someplace for the day.
324,but they're going to learn it sometime.
325,it was the big one.
326,it's kind of a depressing topic.
327,every six months i have to pay my taxes.
328,i've never been sailing.
329,i have six years of college.
330,and then the next one down is in the marion's.
331,enjoy the adventure.
332,not lately though.
333,too many serious problems for the long term.
334,are there any other genres or sounds you're interested in exploiting?
335,yes i can myself what they call a full tummy.
336,more family oriented.
337,do you know that i've never seen a monkey?
338,i know both people.
339,he recommends the hondas to a lot of people.
340,do you have a computer for yourself at home?
341,it's the original.
342,you can't blame them.
343,more trust more accountability.
344,i guess traffic could be an annoyance.
345,we've got four manning food and lebanese food.
346,i hate to dust and clean.
347,football is an exacting sport.
348,i'm glad it's done.
349,i don't know the little.
350,can you speak more about this system of treasury centralization?
351,too many her stories out there.
352,every major city has a theater.
353,go to the zoo and see elephants and tigers and things like that.
354,it'd be kind of fun.
355,that appeared to be eight or nine years old.
356,i'm kind of out of it right now.
357,i do not read everything in the paper.
358,my brother can do it.
359,not everybody shows up.
360,americans have pushed them out of their native land.
361,it was just based on the facts.
362,wasn't it your state that had police involved?
363,did you actually use drugs at all?
364,i don't have too much there.
365,i can fit it in a day.
366,very well protected.
367,tell them.
368,the trees were so pungent.
369,i'm reading charts.
370,do you have some practice time?
371,where did you get this book?
372,vision in the case of evil.
373,without the visuals it's minutes.
374,i'll try that next week.
375,we do as a matter of fact.
376,i have some games.
377,we're going to feel it watch out.
378,the news is a good way to keep up to date.
379,point blank in the face.
380,just walking the streets.
381,he did not want to be in it any more than i did.
382,the teacher had eleven kids.
383,we were promised several failures.
384,click here to join instantly.
385,notice or census in politics.
386,don't let them see violence at home.
387,the issue is that your employer is going counter.
388,what do you write for them?
389,our point of view.
390,the lot we lived in is now a branch.
391,for you next vehicle do you want a truck?
392,it's all traditional second.
393,they pass your phone number on to another company.
394,they had sixty four of them.
395,well i like the sensei.
396,this is vision as liberation.
397,it's probably going to be a real old used one.
398,enjoy your day.
399,the mental process to raise them.
400,very definitely at five flat.
401,lawmakers passed a busy last year.
402,i mean a large flat plate.
403,i'd like to see it be more of an an amateur sport.
404,all of our tin cans.
405,reading more often than usual.
406,capital punishment.
407,everyone knows they're going to get it.
408,my in laws listen to the kind of music i hate.
409,download on your minutes or television.
410,and we play out here in the summertime.
411,it never does run right again.
412,you are actually exploited.
413,especially the ones that came out and said their piece.
414,be an extra you you know.
415,we never won once.
416,formal pillars.
417,it looks like they've got a weapon.
418,but you don't know that.
419,i noticed something interesting last time.
420,they wouldn't have to.
421,do you go like home cooking?
422,so it seems to be.
423,the decision to enter the article.
424,fish wells for employment classes.
425,it would just depend.
426,i like this setting.
427,they've got the full right room.
428,you had to have a supply.
429,that's nice that you like frost all.
430,the measure now heads to government.
431,my three year old.
432,just not feasible you know.
433,i can't really think of anything else often.
434,i'm not sure how to go about it.
435,it's very tedious if you don't have a whole group.
436,it was a cordless phone.
437,but it's kind of hard.
438,you can do so much with them.
439,my skill set got diminished by the steroid.
440,it was like four hundred times as much.
441,it's possibly done.
442,i would feel that i had the right to.
443,you just call him metrics.
444,i know there is.
445,it really hurts me.
446,the experience.
447,you have to wait until all the lines fill.
448,very tragic to me.
449,i think it is getting worse.
450,i really would like to see them do well.
451,i don't live in a house.
452,people put them in.
453,it can swim away fast enough and go hide.
454,for about two hundred dollars.
455,in that time frame.
456,trying to make it through that.
457,anything like that we protested.
458,seven years in the pros.
459,twenty years or so.
460,i think it does help.
461,that has got to be blooming this time of year.
462,even those processes.
463,get your sick leave.
464,it's been kind of scary.
465,the leaves are just dead.
466,we try to go so often.
467,it took four days.
468,the pros and cons of both.
469,we thought.
470,you get programming.
471,not that i like reading.
472,i think a cup or two.
473,i don't mean to be talking.
474,i'd like to see those.
475,a controlled substance.
476,real close.
477,i guess he's trained in this.
478,it might be kind of tricky.
479,perhaps not in the manner that we do it.
480,do you have friends with older children?
481,one had more pull to it.
482,i just file federal ink time every year.
483,i grew up on a farm.
484,that was the one that's been really nice to have.
485,they've done it before.
486,the engine was pretty good.
487,how different the people there really are.
488,we get out on the water occasionally.
489,maybe once every quarter or so.
490,since brian was born.
491,i make that once in a while.
492,how to do things.
493,i typically am not a cat person.
494,the junk mail that you get.
495,they put him in the nurse's office.
496,since this time last year i've changed.
497,they didn't fight together.
498,he seemed to know what he was doing.
499,they just lived in the community.
500,it had to be remembered anyway.
501,if you do decide to go with child care.
502,does insurance pay for the party subject?
503,one is eight and one is eleven.
504,i was drug tested.
505,new neighbors and development communities.
506,they are going to get a gun no matter what.
507,when i was in high school we had a choice.
508,never painted the outside.
509,that's how we got started.
510,a nicer guest than i could afford.
511,it's really beautiful.
512,most people aren't.
513,i think what they will do is start paying mexico.
514,i haven't experienced it.
515,you have to have a pretty good frame.
516,those small little trucks and cars like that.
517,they don't have the ability to develop it.
518,you got to have a won't dent indicator.
519,there's so much going on here.
520,the victim's family and things.
521,being one of these late in life mothers.
522,the drug dealers.
523,my wives mother is the only grand friend if.
524,they're grown now.
525,i have never killed before.
526,i don't know what we're going to do.
527,it's second nature.
528,find out where the angles are.
529,we don't get to see too many.
530,it's like a bullet going by.
531,i mean lunch today was eighteen dollars.
532,it's really unfortunate.
533,the next morning you want to take them out.
534,if the news we're getting is any good.
535,if something goes wrong.
536,i haven't seen any.
537,you two teach each other all through the house.
538,you don't worry about them too much.
539,that kind of gas mileage.
540,it really doesn't make any difference.
541,i was born in texas and i visit other areas.
542,i guess because i work quite a bit with lawyers.
543,i guess i haven't had that much experience.
544,reports and papers and that sort of thing.
545,training money that does not belong to them.
546,does it have to be a special color?
547,that's the freedom of choice.
548,i don't know too much about it.
549,my son plays football.
550,see how the family liked it.
551,one's in college away.
552,were his civil rights violated?
553,it looks like it would be.
554,doing laundry by hand and that kind of thing.
555,i don't want shoppers in my line.
556,we can keep that out of our minds.
557,from for his photography business.
558,we are seeing that here as well.
559,that's what made me happy.
560,it depends on the person.
561,i don't make that much.
562,it's been a long time.
563,no one can drive on ice.
564,maybe they based it on that measure from movie.
565,it seems like they would be able to.
566,just didn't fit the car.
567,she's one of those that loves.
568,now i just have to face it though.
569,mostly with adolescents.
570,i'm not a company or anything like that.
571,i like to listen to piano music a whole lot.
572,two hour classes.
573,definitely.
574,do you enjoy camping?
575,it's kind of a show piece.
576,ambiance down there.
577,how do you like your head meal?
578,it was just too perfect at all times.
579,their self identity is stronger.
580,it is pretty okay.
581,i thought that that was what carol said was for.
582,i couldn't get her up.
583,was it six weeks old?
584,fifteen feet wide.
585,we're a bigger city.
586,fish chunks and dip it in the fondue.
587,when you found out who it was.
588,because they been going to school.
589,they will up.
590,have you ever been drug tested?
591,he could get hot.
592,i'm certainly a texan.
593,so you've got a lot of traffic noise real close.
594,really enjoying it quite a bit.
595,i know a girl.
596,you've got to eat most of the time.
597,to the price of what i buy.
598,even in my case.
599,can do whatever they want.
600,because you own it.
601,a little more flexibility.
602,they even looked halfway decent.
603,i food prices.
604,i think the decision has been made.
605,they are not sure of themselves.
606,two sides of the same coin.
607,he didn't really pay attention.
608,if you have looking for that.
609,do you own conclusions?
610,that's from the child's standpoint.
611,there is no timetable for a decision.
612,children whatever.
613,it's got to run down.
614,the stick them you see it.
615,i mean you can earn a lot more money.
616,but at that point i was too far gone.
617,his voice was nearly drowned out by the crowd.
618,i didn't know it.
619,that was a great little car.
620,over a very long period of time.
621,started investigation.
622,vice presidents of companies.
623,i wasn't up to paying for it.
624,to bolster toys.
625,they are lovely.
626,we see more and more women being involved.
627,i have to make this one last as long as i can.
628,on to the report.
629,well tell me this.
630,that would be really awful.
631,classes and answer period.
632,because you don't know.
633,pour in the red wine and bring to a boil.
634,i'll turn the radio on.
635,they say if you're not taller than this line.
636,that's the way i feel.
637,what happened to get us to this point?
638,trump has said there was no collusion.
639,it was a great pleasure speaking with there.
640,i had the opposite.
641,we sit around and eat popcorn.
642,i don't have boys.
643,that would have been best time to go.
644,if they didn't have to.
645,that's certainly true.
646,your element or attention.
647,we have that here.
648,usually bears fight for survival.
649,i've had too many people.
650,i don't even get to see half my mistake.
651,we put some paper on the floor.
652,that's the closest thing.
653,a kind of funny actually.
654,it was for the book i guess.
655,a pop up trailer.
656,you're with the home office now.
657,there seems to be economically given also.
658,that would be a really good thing to do.
659,too much business.
660,he's retired now.
661,i heard this on a christian program.
662,even though they're so close.
663,in his money.
664,i had never seen anything.
665,these rich people started.
666,used to be six bucks.
667,i caught a cop.
668,i feel so silly.
669,are they all here in the area?
670,i kind of look at it this way.
671,public marketing.
672,sewing and quilting.
673,good to hear from you.
674,through oklahoma city.
675,i read a lot and and i know people.
676,did you pull them?
677,that would make me happy though.
678,it's nice to get out in the open here.
679,i think it would do something for it.
680,it has really been nice here.
681,state land grant colleges.
682,it works out real nice.
683,i've had a lot of them in the past.
684,it's only been that way in the last five years.
685,i live right in the middle of it.
686,it's depressing to.
687,i don't own my home.
688,i've always wondered how he gets around.
689,it's just stuff.
690,fiction books that i really like.
691,you got any more?
692,i'm beginning to think it's not.
693,that's something i miss quite a bit.
694,they finally came up with different.
695,that's true i didn't think about that.
696,good together as a team.
697,part of it would probably work out.
698,it's necessarily going to involve more taxes.
