id,text
0,this.
1,expressions of a kind.
2,the rules were amended in animosity.
3,try custom needed boxes to be completely.
4,the truth via vote to him and water to fill out.
5,that hanging member was caused by tired.
6,more for the last animal lover.
7,wonderful to sensitive.
8,they weren't means it won't boil away casually nothing has.
9,would a blue feather in a man's hat make him happy all day?
10,he talks about an authentic tulane.
11,most young rally every morning.
12,with this new fuel criterion.
13,sometimes i have an update.
14,and it's not a change but a test of the priest who made the decision.
15,we seem to be running the permutation explosion right in our own backwards.
16,sometimes desperate measures can also turn into results moves for the future.
17,the result will be straightforward if it is the thing to do legally.
18,they get dressed faster and penniless energy making closing decisions.
19,again happy country too.
20,so complexity principles are shaped by exposure to group environments.
21,an adult male peoples are not suitable for eating shellfish.
22,in this context it would be well for us to pay in mind the vision of peace.
23,you're boiling milk and you are.
24,which last for spotted hyenas and gravel on the safari.
25,traffic signal is sold to principals to enter wisely.
26,well prepared and camp was fresh lemon slices for dinner.
27,did you buy and close?
28,their pronunciation is appreciated.
29,please shorten this card for dos.
30,for others the introduction is.
31,the family places that there be.
32,the museum has positions every evening.
33,well service after actual talk.
34,they enjoyed it and i.
35,the african side has a gift for it is to hold one that is ripe.
36,any scholars usually deal with this by conducting regular inspections and trimming.
37,the straw is broken to stop the wind.
38,the clinton's version is drivel.
39,they seem confident of it.
40,it stops tremors with followed by a quick roll.
41,by you and totally nobody but yourself.
42,don't kinds are included with each record.
43,the man's salad platter.
44,this kid.
45,she radiated warmth and good fellowship.
46,do you know how it might have gone?
47,in the place for them is loneliness was gone.
48,join us on twitter and facebook.
49,he said that by working started a decision.
50,shaving cream is a popular item on halloween.
51,that seems fifteen minutes longer.
52,a third shot cast the light.
53,the little legs from the little steps.
54,looks as if it were built of books.
55,then he sent what?
56,i am an artist lost in my own vision.
57,bitcoin is one answer offered by experts.
58,the musicians harmonize marvelously.
59,it all did look very efficient and shipshape.
60,that we no longer feel any.
61,any family sales were striking.
62,it can support the weight all for itself.
63,intelligence had hit him occasionally.
64,do you hear the syllables ringing?
65,there was much comparison.
66,there is a specific kind carried to the calendar.
67,twenty he asked do you object to.
68,we'll pay you back of all let us.
69,they close sometime after eight.
70,then we are off again.
71,his wife didn't get a sound she heard.
72,while a man of his most he was usually short.
73,some great driving lessons on thursdays.
74,where the decision by.
75,receiving no answer they set the fire.
76,where do you usually put?
77,a comedy to make a line in.
78,with a rolling stop it could get into care.
79,marksmanship.
80,it's really hard to find something that works.
81,and i loved the one.
82,i do have a friend that ran.
83,just way in the back.
84,actually it makes sense to a certain extent.
85,a to the government that he was employed.
86,they feel good about what they're doing.
87,besides it's an invasion of personal privacy.
88,so you travel a lot.
89,so we're going to wait.
90,it's kind of a good environment to live in.
91,the best of android.
92,i don't know what you think about the point.
93,i believe it costs about ten dollars.
94,what in the world books are you on to?
95,enjoyed every box.
96,a couple of times.
97,i had the brakes done on it.
98,what i use as a reference and has been really handy.
99,i know when i was working.
100,it's a package deal.
101,i have seen it.
102,the measure already passed the senate committee.
103,they told me that this was a topic.
104,in the big store or wherever.
105,i did a lot of paper work and stuff.
106,you can can too much right.
107,recent destination.
108,i'm a car buff for.
109,two springs from a grateful heart.
110,do an over kill never will fail to spark.
111,no cars getting area pollution.
112,and then you sprinkle the clay on top of that.
113,just seeing that clear vision is a distinctly.
114,factors that affect earnings of an employee.
115,if you drink a lot of caffeine will stay awake.
116,that's a nice car.
117,visionary leaders.
118,the only other place i've ever vacationed.
119,i just kind of went there.
120,this is enticing voice we need.
121,do you have your bag?
122,so you know it keeps us pretty busy.
123,that's a science in itself.
124,so when you get in tight situations.
125,i can relate to that.
126,it's all really quite pleasing.
127,if they're around anymore.
128,i am not even aware that i could have seen it.
129,the ranks of asian writers are filling too.
130,and turns occasion.
131,most points at the end.
132,i think it's one hundred and eighty miles.
133,we don't usually take the kids when we go there.
134,one of those terminations.
135,i'll never get caught.
136,i don't buy the newspaper.
137,bring something for a potluck picnic.
138,i'll take it out.
139,improved vision does not work.
140,casualties were reported.
141,you just like to sit down and watch it.
142,he helps by giving little pointer.
143,but they all grew up in a work city.
144,you make such a choice.
145,but they have six over there.
146,a good positive reaction.
147,that's what i was going to point out.
148,he turns one in about stella's usually at noon.
149,it's a delegation type of company.
150,i work out of my home.
151,the way it works.
152,it doesn't have an air conditioner.
153,then you have to make a salad.
154,solving the valuables in the equation.
155,i read it in the paper.
156,i'm in the space processing business.
157,once every year or two.
158,you don't eat it at all.
159,tell them hard and true.
160,i think that's something we might want.
161,she thought for a few minutes.
162,that is a sad situation.
163,they do have capital punishment.
164,it was nice talking to you.
165,my favorite team is the rangers.
166,kind of goes along with what you were saying.
167,what they don't do with foreign ones.
168,video choice award.
169,they are the detroit delegates.
170,he went to beating one man and came back another.
171,as any city grows up.
172,so you did buy a pattern.
173,it's about sixteen and a half percent.
174,i agree with the phone.
175,so i think it's going to be a lot easier.
176,not too much soy sauce.
177,we take a certain portion of your.
178,who sponsors you?
179,and i don't know what's going to happen.
180,i think we have about thirteen months left on it.
181,i do particularly find it.
182,they have clubs and a swimming pool.
183,our point of view.
184,it really is worth while to do.
185,i felt that was a little insensitive.
186,public installations.
187,focal point.
188,i do one and one.
189,what are we doing?
190,my job tends to be very demanding.
191,you know it was just in jest.
192,and most people like that are old.
193,that's what i was doing before.
194,the best teachers and the best students.
195,i don't like it cold.
196,she was inaugurated in january.
197,wait a minute.
198,those are no good anymore.
199,i do want to have a raised bed.
200,i see that but yet i know too.
201,it wasn't organized enough for me.
202,if i don't know the story line.
203,i love facts in the past.
204,you say my pleasure.
205,i had a choice to make a general told him.
206,the last time he came was in march.
207,i'm getting pretty.
208,it's really a cost.
209,have little baby luxury but want a lot more.
210,you guys really are.
211,we've got a son from boston.
212,competition with certain.
213,it still makes most of its profits in asia.
214,i think that is important too.
215,have a good evening.
216,unfortunately tend to make these occasions.
217,i didn't eat fries.
218,most of the time they don't bother with it.
219,they didn't strip it to get it back.
220,i'm sure all the actors are in it.
221,the family is they get.
222,a lot of the easy money.
223,when disclosure isn't enough.
224,contact points.
225,this morning it was twenty nine.
226,satan rejoiced with his birth.
227,they fell out because of the drug is.
228,they are done with a fairy story.
229,don't collect.
230,that is usually for some people.
231,i'm free from my other one during those hours.
232,where do you have to do a whole bunch of work?
233,i take it she was an accountant.
234,go to a shop where the indentations are.
235,no problem there at all.
236,their way of life and.
237,please move that joint back account.
238,also is for where elections for.
239,i do that when we travel.
240,i only saw the end of the first quarter.
241,is there work to support this conclusion?
242,by a training mission.
243,and soon as we get this house didn't.
244,and just keep keeping every at the highest.
245,all the money.
246,my husband has a tool shed out back.
247,once kind of seen.
248,i always threatened my daughter with time out.
249,north korea is still allowed to receive all.
250,that's how about getting centers more involved.
251,pass me that point back again.
252,what you need is a tough punishment regime.
253,so it was really too late to do much.
254,i wanted to go to that golf course down south.
255,you get a little taste of it and you say no.
256,they don't even take my social security number.
257,two cars and philadelphia.
258,i don't know if you have ever heard of it.
259,social objects.
260,that's exactly the way he feels.
261,do you really not remember?
262,that him enjoying that side of it.
263,the ranks of asian writers are swelling too.
264,the mission will draw the corresponding conclusions.
265,bears usually happen during the morning.
266,be kind to your whole self.
267,that's the other bar that we went to that night.
268,i don't know why.
269,you can pack six live explosions presidents are.
270,he's in first grade now.
271,i guess that some companies that aren't growing fast enough.
272,occasionally domestically.
273,something a little extra.
274,i kind of wish that they had a little luck for the boys.
275,killer bees.
276,i hadn't heard about that.
277,the ability of people to access healthcare.
278,that's probably one of the reasons.
279,quite a few movies are based off of that.
280,but when i went home that's all i could think about.
281,i'm north of that actually.
282,a combination on here.
283,it was something easy i could do.
284,i think that a lot of people go to rest friendly.
285,brown and black patches of your eye.
286,the jury is expected to announce its decision.
287,some points.
288,i don't get to watch.
289,it's all money now.
290,apparently that's more.
291,apartment everything.
292,they probably do it to their benefit.
293,that is good that they like that.
294,there is some different work in her report.
295,i must times in calling about bids on work.
296,the new york classicists passed the measure.
297,when we were in highschool it was always fun.
298,she knows how to do that.
299,are you going to go see the exit of love?
300,i'm sure there are some.
301,that's kind of like what we like to do.
302,get a lot of visitors.
303,i haven't been to a baseball game in years.
304,but and pants any more.
305,a dozen of all and medical.
306,it just kind of drags on forever.
307,that's the only way you can get to anything from here.
308,he got a career low.
309,here are the states except from the left.
310,i have to think about it some more now.
311,i was really kind of excited to start reading.
312,what are you saying?
313,really interesting.
314,i enjoyed it very much.
315,he had actually sent her money many.
316,and early version of this article.
317,we might even be able to get a job there.
318,enjoyable to use.
319,we came to a fork in the road at night.
320,he really liked it and i don't.
321,it's nice an small.
322,i think there is confusion.
323,just go someplace for the day.
324,but they're going to learn it sometime.
325,it was the big one.
326,it's kind of a depressing topic.
327,every time months i have to pay my taxes.
328,i've never been stealing.
329,i have six years of college.
330,and then the next one down is in the marines.
331,enjoy the adventure.
332,not leave you.
333,too many street problems for the long term.
334,are there any other countries or towns your interest in exploring?
335,this guy can't master what they call a full timer.
336,for family oriented.
337,do you know that i've never seen a monkey?
338,i know both people.
339,i recommend the hunter to a lot of people.
340,do you have a computer for yourself at home?
341,it's the original.
342,you can't blame them.
343,more choice more accountability.
344,i guess traffic could be an annoyance.
345,we've gone for winning food and living food.
346,i had to dust and things.
347,what follows is an indication.
348,i'm getting it done.
349,i don't know the details.
350,can you speak more about this system of treasury decentralization?
351,so many horror stories out there.
352,a band he has a letter.
353,go to the zoo and see elephants and tigers and things like that.
354,it's been kind of worn.
355,that's about to be eight or nine years old.
356,i'm kind of out of it right now.
357,i know right where everything in the paper.
358,my brother can do it.
359,not everybody shows up.
360,americans have seen them out of there.
361,it was just based on the facts.
362,wasn't it your saying that had.
363,did you actually do track at all?
364,i don't have to much either.
365,i can fit it in a day.
366,very well.
367,the same box.
368,this tree was so prominent.
369,i'm writing.
370,do you have some waiting time?
371,where did you get this cook book?
372,when in the cave of evil.
373,without the visuals it's.
374,i'll try that next week.
375,i do as a matter of fact.
376,i have some games.
377,we're going to feel it work out.
378,the news is a good way to keep up to date.
379,but things in the past.
380,just walking the streets.
381,he did not want to be in it any more than i did.
382,the teacher had eleven kids.
383,we were somewhat sterile servers.
384,click here to join.
385,not for changes in politics.
386,don't let them see violence at home.
387,the issue is that you employer is going.
388,what do you want for them?
389,our point of view.
390,that that we lived in is now a ranch.
391,do you ecstatically do you want a truck?
392,it's all original cooking.
393,they pass you phone numbers on to another company.
394,they had sixty four of them.
395,well i like the seventies.
396,this is vision as preparation.
397,it's probably going to be a real old used one.
398,enjoy your day.
399,the panel passed to raise them.
400,very different at five.
401,the monkey passed a movie last year.
402,i mean a large flat plate.
403,i'd like to see it be more of an attempt.
404,all of our tin cans.
405,playing more often than usual.
406,capital punishment.
407,everyone knows they're going to get it.
408,my in laws are those to the kind of music i hate.
409,download on your community or television.
410,and we play out here in the summertime.
411,it never did run right again.
412,you are physically exploited.
413,especially the ones that came out and said their piece.
414,be an excursion to you know.
415,when another one wants.
416,
417,it looks like they've got a weapon.
418,but you don't know that.
419,i noticed something interesting last time.
420,they won't have to.
421,do you get like home cooking?
422,so it seems to be.
423,the decision to censor the article.
424,just well for employee classes.
425,it would just depend.
426,i like this setting.
427,they've got the full right to.
428,you had to have a play.
429,that's nice that you like.
430,the managers and heads too.
431,my three year old.
432,just not visible you know.
433,i can't really think of anything else offhand.
434,i'm not sure how to go about it.
435,it's very tedious if you have a whole group.
436,it was a cordless phone.
437,but it's kind of hard.
438,you can do so much with them.
439,my skill set got embarrassed by the sword.
440,it was like four hundred times as much.
441,it's probably been.
442,i would feel that i had the right to.
443,you just tell him.
444,i know there is.
445,it really hurts me.
446,the experience.
447,do you have to wait until all the land fills?
448,really scary to me.
449,i think it is getting forced.
450,i really would like to see them do well.
451,i don't live in a house.
452,people put them then.
453,it can come away as enough and go hard.
454,for about two hundred dollars.
455,in that time frame.
456,trying to make it through that.
457,anything like that we protested.
458,seven years in the stores.
459,twenty years or so.
460,i think it does help.
461,that has got to be blooming this time of year.
462,even the busses.
463,can you take leave?
464,it's been kind of tricky.
465,the leaves are just dead.
466,we try to go so often.
467,it took four days.
468,the father and kind of both.
469,where?
470,you get programming.
471,not that i like reading.
472,i think a step or two.
473,i don't mean to be knocking.
474,i'd like to see those.
475,a controlled substance.
476,is real close.
477,i guess he's joined in this.
478,it might be kind of tricky.
479,perhaps not in the manner that we do it.
480,do you have friends with older children?
481,one had more pull to it.
482,i just feel federal income comes next year.
483,i grew up on a farm.
484,that was the one that's been really nice to have.
485,they've done it before.
486,the engine was pretty good.
487,how different the people there are are.
488,we get out on the water occasionally.
489,maybe once every quarter or so.
490,since mine was in.
491,i make that once in a while.
492,how to do things.
493,i happily am not a cat person.
494,the last meal that you get.
495,they put him in the nursery.
496,since this time last year we've.
497,they didn't fight together.
498,he seemed to know what he was doing.
499,they just live in the community.
500,it had to be remembered anyway.
501,if you do decide to go with child care.
502,the insurance pays for the body.
503,one is eight and one is eleven.
504,i was drug tested.
505,do neighborhoods and developing communities.
506,they are going to get a gun no matter what.
507,when i was in high school we had a choice.
508,be round the outside.
509,that's how we got started.
510,a nicer guest than i could afford.
511,it's really beautiful.
512,most people aren't.
513,i think what they will do is start raiding mexico.
514,i haven't experienced it.
515,you have to have a pretty good team.
516,so for little tikes and cars like that.
517,they don't have the ability to develop it.
518,you got to have a one cent indicator.
519,there's so much going on here.
520,the brigham family and things.
521,being one of the late in life mother.
522,the drug dealers.
523,my wife's mother is the only grandparent left.
524,they're running now.
525,i have never skied before.
526,i don't know what we're going to do.
527,it's second nature.
528,when asked where the languages are.
529,we don't get to see too many.
530,it's like a bullet going by.
531,i mean not today was eighteen dollars.
532,it's really unfortunate.
533,the next one you want to take them out.
534,if the news we're getting is any good.
535,if something goes wrong.
536,i haven't seen any.
537,how to see each other all through the house.
538,you don't write about them too much.
539,that kind of grass.
540,it really doesn't make any difference.
541,i was born in texas and i visit other areas.
542,i guess because i work quite a bit with others.
543,i guess i haven't had that much experience.
544,boats and paper and that sort of thing.
545,training money that does not belong to them.
546,does it have to be a special color?
547,that's the freedom of choice.
548,i don't know too much about it.
549,my son plays football.
550,see how the family likes it.
551,one in college girls.
552,here is several rights violated.
553,it looks like it would be.
554,doing underwear by hand and that kind of thing.
555,i don't want stars in my lawn.
556,we can keep that out of our minds.
557,forms for his productivity business.
558,we are seeing that here as well.
559,that's what made me happy.
560,that happened on the person.
561,i don't make that much.
562,it's been a long time.
563,no one can live on house.
564,maybe they based that on that mr. home movie.
565,that seems like they would be able to.
566,just didn't fit the car.
567,she's one of those that loves.
568,now i just have to feed it though.
569,mostly with excellent.
570,i'm not a company or anything like that.
571,i like to listen to piano music a whole lot.
572,two hour classes.
573,basically.
574,do you enjoy camping?
575,it's kind of a slow pc.
576,manhattan's down there.
577,how do you like your treadmill?
578,it was just two people at all times.
579,their several identity is stronger.
580,it is pretty okay.
581,i thought that that was what televised was for.
582,i couldn't get her to.
583,when it's six weeks old.
584,fifteen feet wide.
585,or a bigger city.
586,patients and keep it in the window.
587,when you found out who it was.
588,because this big going to school.
589,they hole up.
590,have you ever been drug tested?
591,he could get caught.
592,i'm actually a texan.
593,so you've got a lot of traffic noise real close.
594,really doing it quite a bit.
595,i know a girl.
596,you've got to eat most of the time.
597,so the rest of what i buy.
598,even in my case.
599,can do whatever they want.
600,because you ended it.
601,a little more flexibility.
602,they haven't looked after.
603,i put prices.
604,i think the decision has been made.
605,they are not sure of themselves.
606,two sides of the same coin.
607,he didn't really pay detention.
608,if you're ever looking for that.
609,do you own?
610,that's from the children's standpoint.
611,there is no timetable for a decision.
612,children receive.
613,does it get so run down?
614,the second time you see it.
615,i mean you can run a lot more money.
616,but at that point i was too far gone.
617,his race was nearly drowned out by the crowd.
618,i didn't notice it.
619,that was a great little car.
620,over a very long period of time.
621,here are a investigation.
622,my president of companies.
623,i wasn't opposed to paying for it.
624,to fearfully choose.
625,they are lovely.
626,we see more and more women being involved.
627,i have to make this one last as long as i can.
628,only to the airport.
629,well tell me this.
630,that would be really awful.
631,classes and answer.
632,because you don't know.
633,pour in the red wine and bring to a boil.
634,i'll turn the radio on.
635,they say if you're not close then this line.
636,that's the way i feel.
637,what happened to get us to this point?
638,top has said there was no collusion.
639,that was a great mother singing with the.
640,i had the opposite.
641,we sit around and eat.
642,i don't have boys.
643,that would have been best time to go.
644,if they didn't have to.
645,that's certainly true.
646,you developed your americanization.
647,we have that here.
648,usually better writing for several.
649,i've had so many people.
650,i don't even get to see have my project.
651,we put some pressure on the floor.
652,that's the closest thing.
653,it's kind of funny actually.
654,that was for the book i guess.
655,a pop up trailer.
656,you're with the home office now.
657,they seem to be economically living also.
658,that would be a really good thing to do.
659,too much business.
660,he's retired now.
661,i heard this on a christian program.
662,even though they're so close.
663,in his money.
664,i had never seen anything.
665,these rich people started.
666,used to be six packs.
667,i got a cup.
668,i feel so silly.
669,are they all here in the area?
670,i kind of look at it this way.
671,public bargaining.
672,sewing and quilting.
673,good to hear from you.
674,through oklahoma city.
675,i read a lot and and i know people.
676,did you tell them?
677,that would make me happy so.
678,it's nice to get out in the open here.
679,i think it would do something for it.
680,it has really been nice here.
681,it can grant qualities.
682,it worked out real nice.
683,we've had lots of them in the past.
684,it's only been that way in the last five years.
685,i left right in the middle of it.
686,it's distressing too.
687,i don't own my home.
688,i've always wondered how he gets around.
689,it's just tough.
690,fiction books that i really like.
691,you got any more?
692,i'm beginning to think it's not.
693,that's something i miss quite a bit.
694,they finally came up with evidence.
695,that's true i didn't think about that.
696,good together as a team.
697,part of it would probably work out.
698,it's necessarily going to involve more taxes.
699,it's just going to follow.
700,i'm kind of a car buff myself.
701,buying our our first.
702,sometimes it will stop.
703,i just don't like that.
704,usually changes to talk about.
705,i am close to receiving my english degree.
706,everything still interests.
707,he made a real big cake himself.
708,they actually wait for them.
709,it was for a murder trial.
710,are you a professional position?
711,it's far beyond me.
712,we've gotten an awful lot from the space program.
713,two sets of.
714,i call and find out.
715,you want salary too but what?
716,i've heard about him.
717,you've had more freezing this winter.
718,if we can get a handle on that.
719,they would vote for trees.
720,they were okay.
