id,text
0,the caucus.
1,he purchased several hand lithographs.
2,the rules we made in unabashed collusion.
3,the costume needed black gloves to be completely allen.
4,the truth of rot to come one whiter tooth fell out.
5,that singing uproar was caused by scared reapers.
6,before early am review every formula.
7,read this sentence a park.
8,the word means it won't pull away usually nothing else.
9,would a bowl fell in a man's hat make him happy all day?
10,he talked about an authentic strains you.
11,most young raise early every morning.
12,with this new oil laden control.
13,prescribe have an upbeat attitude.
14,and it's not a charge but a taste of the past who build the decision.
15,we seemed to be witnessing the population explosion right in our own backyards.
16,combat desperate measures and also to incite moves for their feature.
17,the sun will be straight road if if you then think them usually carefully proofs.
18,the she gets dressed faster and spends less energy making schooling decisions.
19,academic aptitude discredits your diploma.
20,to some extent principles are shaped by exposure to group environments.
21,an adult male bones they are not suitable for eating shellfish.
22,in this country it would do well for us to bear in mind the vision of feasts.
23,you're boiling milk at you.
24,we look for spotted hyenas and strangles on the safari.
25,traffic frequently has failed to must up to engineer worthy estimates.
26,well prepared red snapper with fresh lemon slices for dinner.
27,did you buy any corduroy overalls?
28,your position is appreciated.
29,please shorten this shirt for choice.
30,or rather the unlimited expense account.
31,the family relations that those be amended.
32,the museum hires positions every evening.
33,well so for my affirmation talk.
34,they enjoy it when i audition.
35,the vehicle should have a sip to it as you hold when it is ripe.
36,any spiders usually deal with this by conducting regular inspecting and.
37,the score is wrong so stop the wood instead.
38,the clean version is seventy blow.
39,they seemed brand proud of it.
40,a sharp tremor was followed by a jerk.
41,boy you ain't poisoning nobody but yourself.
42,nice guides are included with each record.
43,the man's ideas.
44,this is over.
45,she radiates warmth and good fellowship.
46,do you know where it might have gone?
47,in the pay for them his journalists were gone.
48,join us on twitter and facebook.
49,he said they'll be working toward a decision.
50,shaving cream is a popular item on halloween.
51,then somebody's fifteen minutes longer.
52,a third thought doused the light.
53,the guttural slang from the ghetto.
54,that is if it for built of.
55,then he then.
56,i am an artist lost in my own vision.
57,but kid is an anna over by experts.
58,the musicians harmonize movingly.
59,it all did look very efficient and sip.
60,that was no longer full.
61,inflammatory cells were strikingly absent.
62,it can expect long we oils for itself.
63,indulgence had hit him occasionally.
64,do you hear the little bells ringing?
65,there was much amazing mess.
66,below is a specific guide keyed to the scanner.
67,when he asked do you object to paying.
68,we'll pay you back if you'll let us.
69,they close sometime after.
70,then we are off again.
71,his wife doesn't give a sign she'd heard.
72,for a man of his mass he was usually short.
73,come see driving lessons on thursdays.
74,read the decision.
75,receiving no answer they set the fire.
76,where is your usual apart personally?
77,i started to made a line in face to face.
78,with a rolling dump it could get into care.
79,marksmanship.
80,it's really hard to find something that works.
81,and i love the shining.
82,i do have a friend that.
83,just why in the.
84,actually it makes sense to a certain extent.
85,or to the government that he was employed.
86,they feel good about what they're doing.
87,besides it's an invasion of personal privacy.
88,so you travel a lot.
89,so we're going to.
90,any kind of a good environment to live in.
91,the best of android.
92,i don't know what you think about the point.
93,i believe it costs about ten dollars.
94,what in the world does are you on to?
95,android tv box.
96,a couple of times.
97,i had the brakes done on it.
98,what i use as a reference and has been real handy.
99,i know when i was working.
100,it's a package deal.
101,i have seen it.
102,the measures already passed a senate committee.
103,they told me that this was a topic.
104,in the red square or wherever.
105,they did a lot of play work and stuff.
106,you can can so much.
107,recent.
108,i'm a car buff too.
109,joy springs from a grateful heart.
110,do in over dill never allow oil to smoke.
111,noise is air pollution.
112,and then you sprinkle the cheese on top of that.
113,just stressing that clear vision is a necessity.
114,factors that affect earnings of an employee.
115,if you drink a lot of caffeine will stay awake.
116,that's a nice car.
117,visionary leaders.
118,the only other place i've ever vacationed.
119,i just kind of went there.
120,this is unifying voice we need.
121,do you have your bag?
122,so you know it keeps us pretty busy.
123,that's a science in itself.
124,so when you get in tight situations.
125,i can relate to that.
126,it's all very quit.
127,if they're around anymore.
128,i am not even aware that i could have seen it.
129,the ranks of asian riders are filling too.
130,einstein's equation.
131,most points at the end wins.
132,i think that's one kind and easy miles.
133,we don't usually take the kids when we go there.
134,one of those generation novels.
135,they'll never get caught.
136,i don't buy the newspaper.
137,bringing something for a potluck picnic.
138,i'll take it.
139,improved vision does not work.
140,casualties were reported.
141,you just like to sit down and watch it.
142,he helps by giving little pointers.
143,but they all grew up in new york city.
144,you make such a choice.
145,but they have six over there.
146,a good positive.
147,that's what i was going to point out.
148,i turned mine in about twelve hours usually at noon.
149,it's a telecommunications type of company.
150,i work out of my home.
151,the way it works.
152,it doesn't have an air conditioner.
153,then you have to make a salad.
154,solving the variables in the equation.
155,i read in the paper.
156,i'm in the speech processing business.
157,once every year or two.
158,you don't need it at all.
159,sell them tried and true.
160,i think that's something we might want.
161,she thought for a few minutes.
162,that is a sad situation.
163,they do have capital punishment.
164,it was nice talking to you.
165,my favored team is the rangers.
166,kind of goes along with what you were saying.
167,i see they don't go with sporting one.
168,reader's choice award.
169,they are the detroit delegates.
170,he went to vietnam one man and came back another.
171,as any city grows up.
172,so you did buy a patton.
173,it's about six and a half percent.
174,i agree with the phone.
175,so i think it's going to be a lot easier.
176,not too much more.
177,we take a certain portion of your.
178,who slaps you?
179,and i don't know what's going to happen.
180,i think we have about sterling months left on it.
181,i do particularly find it annoying.
182,they have clubs and a swimming pool.
183,our point of view.
184,it really is worth while to so.
185,i felt that was a little insensitive.
186,public.
187,focal point.
188,i tried one and one disappointed.
189,what are we doing?
190,my job tends to be very demanding.
191,you know it was just in jest.
192,and most people like that are old.
193,that's what i was doing before.
194,the best teachers and the best students.
195,i don't like it.
196,she was interested in.
197,what a minute.
198,those are no good anymore.
199,i do want to have a raise.
200,i see that but yet i know too.
201,it wasn't organized enough for me.
202,if i don't know the story line.
203,that i've liked in the past.
204,we same my pleasure.
205,he had a choice to make the colonel told him.
206,the last time he came was in march.
207,i'm getting pretty.
208,it's really a cost.
209,have little material luxury but want a lot more.
210,you guys really are.
211,we've got a son from.
212,competition with.
213,it still makes most of its profit in asia.
214,i think that is important too.
215,have a good evening.
216,informally we tend to make these occasions.
217,i didn't eat.
218,most of the time they don't bother with it.
219,they didn't keep it so i got it back.
220,i'm sure all the eggs are in it.
221,the family is that great.
222,a lot of the eddies move southward.
223,when disclosure isn't enough.
224,contact points.
225,this morning it was twenty nine.
226,satan rejoiced with his birth.
227,they fell out because of the drug issue.
228,they are done with a flour tortilla.
229,don't collect.
230,that is usual for some people.
231,i'm ready from my other son during those hours.
232,where do you have to do a whole bunch of work?
233,i take it she was an accountant.
234,go to a trip for the intonations.
235,no problem there at all.
236,their way of life.
237,past me that point make account.
238,filters for air recession for hospitals.
239,i do that when we travel.
240,i only saw the end of the first quarter.
241,is there work to support this conclusion?
242,by a train.
243,as soon as we get the house printed.
244,and just keep chipping away at the ice.
245,all the money.
246,my husband has a tool shed out back.
247,certain kinds of.
248,i always slated my daughters with time out.
249,north korea is still allowed to receive oil.
250,that's easy about getting pets more involved.
251,pass me that joint bank account.
252,what you need is a tougher punishment regime.
253,so it was really too late to do much.
254,i wanted to go to that golf course down south.
255,you get a little taste of it and you say no.
256,they don't even take my serial record number.
257,because and.
258,i don't know if you have ever heard of it.
259,social.
260,that's exactly the way he feels.
261,do you really not remember?
262,it is missing that kind of it.
263,the ranks of asian brides are swelling too.
264,the mission will call the corresponding conclusions.
265,burials usually happen during the morning.
266,be kind to your whole self.
267,that's the other bar that we went to that night.
268,i don't know why.
269,you can fake sex love explosion prejudice or.
270,he's in first grade now.
271,i guess there's some companies that aren't growing fast enough.
272,instantly impractical pointed.
273,something a little extra.
274,i kind of wish that they had a little league for the boys.
275,killer bee.
276,i hadn't heard about that.
277,the ability of people to access healthcare.
278,that's probably one of the reasons.
279,quite a few movies are based off of that.
280,but when i went home that's all i could think about.
281,i'm north of it actually.
282,a commercial working on here.
283,it was something easy i could do.
284,i think not a lot of people go to rest.
285,brown and black parts of her.
286,the jury is expected to announce its decision.
287,some points.
288,i don't get to.
289,a whole money.
290,help helpful that.
291,almonds.
292,they're probably doing it to their benefit.
293,that is good that they're like that.
294,there is some definite work in her report.
295,i remember little times in schooling being piled on work.
296,the new york taxi didn't please the mayor.
297,when we were in a school it was light fun.
298,she knows how to do that.
299,are you going to go see the act of love?
300,i'm sure there are some.
301,that's kind of like what we'd like to do.
302,quite a lot of.
303,i haven't been to a baseball game in here.
304,beyond places.
305,a dressing of oil and vinegar.
306,it just kind of dragged on forever.
307,that's the only way you can get to canada from here.
308,she bought a cr lo.
309,here are the status excerpts from the draft.
310,i have to think about it some more.
311,i was really kind of excited to start reading.
312,what are you saying?
313,very interesting.
314,i enjoyed it very much.
315,he had occasionally sent her money money.
316,an earlier version of this article.
317,you might even be able to get a job there.
318,enjoyable to use.
319,we came to a fork in the road at night.
320,he really likes it and i don't.
321,it's nice scene.
322,i think there is confusion.
323,just go someplace for the day.
324,but they're going to learn it.
325,it was the big one.
326,it's kind of a depressing topic.
327,every six months i have to pay my taxes.
328,i've never been.
329,i have six years of college.
330,and then the next one down is in the bavarians.
331,enjoy the adventure.
332,not really.
333,too many serious problems for the long term.
334,are there any other genres or sounds you're interested in exploiting?
335,yes i can't myself what they call a full timer.
336,for family.
337,do you know that i've never seen a monkey?
338,i knew both people.
339,he recommends the hondas to a lot of people.
340,do you have a computer for yourself at home?
341,it's the original.
342,you can't blame them.
343,more choice more accountability.
344,i guess traffic could be an interest.
345,we've gone for manning food and lebanese food.
346,i hate to dust and clean.
347,football is an interesting sport.
348,i'm glad it's done.
349,i don't know the details.
350,can you make more about this system of treasury centralization?
351,too many horror stories out there.
352,every big city has a theater.
353,go to the zoo and see elephants and dogs and things like that.
354,it'll be kind of.
355,that appeared to be eight or nine years old.
356,i'm kind of out of it right now.
357,i do not read everything in the paper.
358,my brother can do it.
359,not everybody shows up.
360,americans have pushed them out of their enough time.
361,it was just based on the facts.
362,wasn't it your state that had pretty involvement?
363,did you actually you drink it?
364,i don't have too much there.
365,i can put it in a day.
366,very well.
367,tell them.
368,this tree was so.
369,i'm boring.
370,do you have some vacant time?
371,where did you get this book?
372,reading in the case of.
373,without the fuel it's.
374,i'll try that next week.
375,we do as a matter of fact.
376,i have some.
377,we're going to feel it watch out.
378,the news is a good way to keep up to date.
379,point blank in the face.
380,just walking the streets.
381,he did not want to be in it any more than i did.
382,the teacher had eleven kids.
383,we were promised civil liberties.
384,click here to join.
385,not a census in politics.
386,not let them see violence at home.
387,the issue is that your employer is going under.
388,what do you write for them?
389,our point of view.
390,the lot we lived on is now a.
391,for you next vehicle do you want a truck?
392,it's all traditional.
393,they passed your phone number on to another company.
394,they had taxed most of them.
395,well i like the seventies.
396,this is isn't as.
397,it probably going to be a real old used one.
398,enjoy your day.
399,the mental pace to raise them.
400,friday afternoons at five.
401,no making passed a measure last year.
402,i mean a large flat plate.
403,i'd like to see it be more of an amateur sport.
404,all of our tin cans.
405,praying more often than usual.
406,capital punishment.
407,everyone knows they're going to get it.
408,my in laws listen to the kind of music i hate.
409,download on your computer or tv.
410,and we play out here in the summertime.
411,it never did run right again.
412,you are actually.
413,especially the ones that came out and said their piece.
414,please add expected do you know.
415,we're another one.
416,normal.
417,it looks like they've got a.
418,but we don't know that.
419,i noticed something interesting last time.
420,they wouldn't have to.
421,do you go like home?
422,so it seems to be.
423,the decision to censor the article.
424,special rules for employment cases.
425,it would just depend.
426,i like this.
427,they've got the full right.
428,you had to have a play.
429,that's nice that you like frosty also.
430,the measure now heads to government.
431,my three year old.
432,just not people you know.
433,i can't really think of any else often.
434,i'm not sure how to go about it.
435,it's very tedious if you have a whole group.
436,it was a cordless phone.
437,but it's kind of hard.
438,you can do so much with them.
439,my skill set got diminished by the sword.
440,it was like four hundred times as much.
441,it's possibly.
442,i would feel that i had the right to.
443,you just tell him.
444,i know that.
445,it really hurts me.
446,the experience.
447,do we have to wait until all the land fills?
448,really scary to me.
449,i think it is getting.
450,i really would like to see them do well.
451,i don't live in a house.
452,people put them.
453,it can swim away fast enough and go hide.
454,for about two hundred dollars.
455,in that job.
456,trying to make it through that.
457,anything like that we.
458,seven years in the.
459,twenty years or so.
460,i think it does.
461,that has got to be boring this time of year.
462,even this.
463,get you sick.
464,it's been kind of scary.
465,the living are just dead.
466,we try to go so often.
467,it took four days.
468,the pros and cons of both.
469,we're set.
470,you get.
471,not that i like reading.
472,i think a trip for two.
473,i don't mean to be talking.
474,i'd like to see those.
475,a controlled temperament.
476,real close.
477,i guess he's trained in this.
478,it might be kind of tricky.
479,perhaps not in the manner that we do it.
480,do you have friends with older children?
481,one had more pull to it.
482,i just file federal income times tax every year.
483,i grew up on a farm.
484,that was the one that's been really nice to have.
485,they've done it before.
486,the engine was pretty good.
487,how different the people there are.
488,we get out on the water occasionally.
489,maybe once every car or so.
490,since mine was born.
491,i make that once in a while.
492,how to do things.
493,i happily am not a cat person.
494,the junk mail that you get.
495,they put him in the nazi office.
496,since this time last year i've changed.
497,they didn't fight together.
498,he seemed to know what he was doing.
499,they just live in the community.
500,it had to be dismember anyway.
501,if you do decide to go with child care.
502,the insurance paid for the party.
503,one is eight and one is eleven.
504,i was drug tested.
505,no naps and development community.
506,they are going to get a gun no matter what.
507,when i was in high school we had a choice.
508,never painted the outside.
509,that's how we got started.
510,a nicer desk than i could afford.
511,it's really beautiful.
512,most people aren't.
513,i think what they will do is start paying.
514,i haven't experienced it.
515,you have to have a pretty good frame.
516,those small little trucks and cars like that.
517,they don't have the ability to develop it.
518,you got to have a one month integrator.
519,there's so much going on here.
520,the victim's family and things.
521,playing one of these late in life.
522,the drug dealers.
523,my wife's mother is the only grandparent left.
524,they're gone.
525,i have never said before.
526,i don't know what we're going to do.
527,it's taken.
528,in it were the languages.
529,we don't get to see too many.
530,it's like a bullet going by.
531,i mean lunch today was eighteen dollars.
532,it's really unfortunate.
533,the next morning you want to take them out.
534,if the news we're getting is any good.
535,if something goes wrong.
536,i haven't seen any.
537,used to see each other all through the house.
538,you don't worry about them too much.
539,that kind of grass.
540,it really doesn't make any difference.
541,i was born in texas and i visit other areas.
542,i guess because i work quite a bit with lawyers.
543,i guess i haven't had that much experience.
544,reports and papers and that sort of thing.
545,spending money that does not belong to them.
546,does it have to be a special color?
547,that's the freedom of choice.
548,i don't know too much about it.
549,my son plays football.
550,she has the family like it.
551,one in college.
552,were his civil rights violated?
553,it looks like it would be.
554,doing laundry by hand and that kind of thing.
555,i don't want jobs in my line.
556,we can keep that out of our minds.
557,forum for his punditry.
558,we are seeing that here as well.
559,that's what made me.
560,it depends on the person.
561,i don't make that much.
562,it's been a long time.
563,no one can live on.
564,maybe they passed it on that mr. home movies.
565,that seems like they would be able to.
566,just didn't been there.
567,she's one of those that loves.
568,now i just have to face it though.
569,mostly with adolescents.
570,i'm not a carpenter or anything like that.
571,i like to listen to piano music a whole lot.
572,two hour classes.
573,basically.
574,do you enjoy camping?
575,it's kind of a show.
576,remote down there.
577,how do you like your side?
578,it was just too perfect at all times.
579,their self identity is stronger.
580,it is pretty.
581,i thought that it was what stanley said was for.
582,i couldn't get her.
583,with its six breaks.
584,fifteen feet wide.
585,you're a bigger city.
586,fish chunks and dip it in the fondue.
587,when you found out who it was.
588,because the big guns too.
589,they will.
590,have you ever been drug tested?
591,he could get hurt.
592,i'm currently a texan.
593,so you've got a lot of traffic noise real close.
594,really enjoyed it quite a bit.
595,i know a girl.
596,we've got to eat most of the time.
597,to the pace of what i pay.
598,even in my case.
599,can do whatever they want.
600,because you and it.
601,a little more.
602,they haven't like halfway.
603,i food.
604,i think the decision has been made.
605,they are not sure of themselves.
606,two sides of the same coin.
607,he didn't really pay.
608,if you have looking for.
609,do you own?
610,that's from the kids.
611,there is no timetable for a decision.
612,children.
613,just get to one.
614,the second time you see it.
615,i mean you can earn a net more money.
616,but at that point i was too far gone.
617,his voice was nearly drowned out by the crowd.
618,i didn't notice it.
619,that was a great little car.
620,over a very long period of time.
621,started investigating.
622,vice presidents of companies.
623,i wasn't opposed to paying for it.
624,to bolster.
625,they are.
626,we see more and more women being involved.
627,i have to make this one last as long as i can.
628,only to the airport.
629,why tell me this?
630,that would be really awful.
631,classes and answer.
632,because you don't know.
633,pour in the red wine and bring to a boil.
634,i'll turn the radio on.
635,they say if you're not tall in this line.
636,that's the way i feel.
637,what happened to get us to this point?
638,trump has said there was no collusion.
639,it was a great brother singing with the.
640,i had the opposite.
641,we sit around and eat.
642,i don't have boys.
643,that would have been my time to go.
644,if they didn't have to.
645,that's certainly true.
646,you're developing your imagination.
647,we have that here.
648,usually be fighting for survival.
649,i've had so many.
650,i don't even get to see have my project.
651,we put some paper on the floor.
652,that's the closest thing.
653,a kind of twenty actually.
654,it was just the book i guess.
655,a pop up.
656,you're with the home office.
657,they seem to be economically living also.
658,that would be a really good thing to do.
659,so much.
660,he's retired now.
661,i heard this on a christian program.
662,even though they're too close.
663,in his money.
664,i had never seen anything.
665,these rich people.
666,used to be six.
667,i caught a.
668,i feel so silly.
669,are they all here in the area?
670,i kind of look at it this way.
671,public.
672,sewing and quilting.
673,good to hear from you.
674,through oklahoma.
675,i read a lot and then i know people.
676,did you pull them?
677,that would make me happy.
678,it's nice to get out in the open air.
679,i think it would do something for it.
680,it has really been nice here.
681,state land grant colleges.
682,it worked out real nice.
683,i've had lots of them in the past.
684,it's only been that way in the last five years.
685,i live right in the middle of it.
686,it's depressing to.
687,i don't own my home.
688,i've always wondered how he gets around.
689,it's just tough.
690,fiction books that i really like.
691,you got any more?
692,i'm beginning to think it's not.
693,that's something i missed quite a bit.
694,they finally came up with.
695,that's true i didn't think about that.
696,good together as a team.
697,part of it would probably work out.
698,it's necessarily going to involve more taxes.
699,it's just going to.
700,i'm kind of a car buff myself.
701,buying an hour.
702,sometimes it will.
703,i just don't like that.
704,usual changes to talk about.
705,i am close to receiving my english degree.
706,everything still.
707,he made a real big take himself.
708,they actually waited for them.
709,it was for a murder.
710,are you a professional musician?
711,it's far beyond me.
712,we've gotten an awful lot from the space program.
713,to set of.
714,i call and find out.
715,you went readily to others what?
716,i've heard about him.
717,you've had more freezing this winter.
718,if we can't get a handle on that.
719,they would vote for.
720,they were okay.
721,to find a man.
722,on a working time.
723,have we had them for several years?
724,if they work at it a little bit.
725,we don't have enough.
726,what are you making?
727,absolutely.
728,i had a carpet service call up this time.
729,although he's probably better than a lot of them.
730,just about any kind of music.
731,we like mexican food.
