id,text
0,six recommended.
1,take purchase several and discuss.
2,the rules were made in unabashed collusion.
3,the costume needed black gloves to be completely elegant.
4,the truth for we to come one wider truth fell out.
5,that singing reporter with star but tried keep station.
6,but for really am really ever formal.
7,follow this condition of park.
8,the word means it won't pull away recently nothing else.
9,would a blue feather in a man's hat make him upbeat all day?
10,he talks about on athletic slogans you.
11,most young weather early every morning.
12,with this new loyal skeleton control.
13,many tribes have an abandoned.
14,and it's not a job but a justice of the peace who made the decision.
15,we seemed to be winning the population explosion right in our own backyards.
16,sometimes desperate measures can also turn into right moves for the future.
17,the entries will be straightforward if it usually think them usually carefully for first.
18,she kicked grass fractures and sprains less injury making clothing decisions.
19,academic aptitude interests you diploma.
20,to some extent principles are shaped by exposure to group environments.
21,an adult male dabbles these are not suitable for eating shellfish.
22,in this conduct it would do well for us to pay in mind the vision of peace.
23,you're boiling milk and you are.
24,which look for spotted hyenas and dingos on the safari.
25,traffic frequently has failed to measure up to any rosy estimates.
26,ralph peppered red snapper with fresh lemon sauce for dinner.
27,did you buy any corduroy overalls?
28,their pronunciation is appreciated.
29,please shouldn't this hurt for choice?
30,to others the intimate expense account.
31,the family relations that ever be amended.
32,the museum has processions every evening.
33,well so rhubarb pie after actual talk.
34,they enjoy it when i audition.
35,the avocado should have a give to it as you hold when it is ripe.
36,any spiders usually deal with this by conducting regular inspections and trimming.
37,the store is wrong to stop the wood instead.
38,the clean version is given below.
39,they seem kind proud of it.
40,a sharp tremor was followed by a jerky while.
41,boy you ain't trialing nobody but yourself.
42,text guides are included with each record.
43,the man's eyelids fluttered.
44,this is pro's bad.
45,she radiated warmth and good fellowship.
46,do you know where it might have gone?
47,in the play for them his indolence was gone.
48,join us on twitter and facebook.
49,he said they'll be working toward a decision.
50,shaving cream is a popular item on halloween.
51,then somebody's fifteen minutes longer.
52,a third shot cast the light.
53,the little finger from the lady stopped.
54,like as if it's for built of books.
55,then he then what?
56,i am an artist lost in my own vision.
57,blockade is one answer offered by experts.
58,the musicians harmonize maliciously.
59,it all did look very efficient and shipshape.
60,that we no longer feel uneasy.
61,inflammatory cells were strikingly impotent.
62,it can expect long way all for itself.
63,intelligence gets at him occasionally.
64,do you hear the little bells ringing?
65,there was most interesting must exclaim.
66,there is a specific guide keyed to the lander.
67,finally he asked do you object to paying.
68,we'll pay you back if you'll let us.
69,they close sometime after eight.
70,then we are off again.
71,his wife doesn't give a sign she heard.
72,for a man of his mass he was cruelly short.
73,some free driving lessons on thursdays.
74,when the decision blow.
75,receiving no answer they set the fire.
76,where is you usual upbeat personally?
77,i come to meet a lion in face to face.
78,with a rolling dump it could get into there.
79,marksmanship.
80,it's really hard to find something that works.
81,and i love this sizing.
82,i do have a friend that one.
83,just way in the back.
84,actually it makes sense to a certain extent.
85,to show the government that he was employed.
86,they feel good about what they're doing.
87,besides it's an invasion of personal privacy.
88,so you travel a lot.
89,so we're going to wait.
90,any kind of a good environment to live in.
91,the best of android.
92,i don't know what you think about the point.
93,i believe it cost about ten dollars.
94,what in the world drugs are you on to?
95,enjoyed every box.
96,a couple of times.
97,i had the brakes done on it.
98,what i use as a reference and have been really handy.
99,i know when i was working.
100,it's a big deal.
101,i have seen it.
102,the measures already passed a senate committee.
103,they told me that this was a topic.
104,in the wood store or wherever said.
105,they did a lot of play work and stuff.
106,you can gain too much weight.
107,recent legislation.
108,i'm a car buff too.
109,joy springs from a grateful heart.
110,do onion over steel never allow oil to smoke.
111,no cause goes air pollution.
112,and then you sprinkle the cheese on top of that.
113,just saying that clear vision is a necessity.
114,factors that affect earnings of an employee.
115,if you drink a lot of caffeine you'll stay awake.
116,that's a nice car.
117,visionary leaders.
118,the only other place i've ever vacationed.
119,i just kind of went through.
120,this is one fighting voice we need.
121,do you have your bag?
122,so you know it keeps us pretty busy.
123,that's a science in itself.
124,so when you get in tight situations.
125,i can relate to that.
126,it's all ready quit playing.
127,if they're around anymore.
128,i am not even aware that i could have seen it.
129,the ranks of asian riders are filling too.
130,einstein's equation.
131,most points at the end ones.
132,i think it's one hundred and eighty miles.
133,we don't usually take the kids when we go there.
134,one of those generation novels.
135,they'll never get caught.
136,i don't buy the newspaper.
137,bringing something for a potluck picnic.
138,i'll check it out.
139,improved vision does not work.
140,casualties were reported.
141,you just like to sit down and watch it.
142,he helps by giving little pointers.
143,but they all grew up in new york city.
144,you make such a choice.
145,but they have six over there.
146,a good positive.
147,that's what i was going to point out.
148,i turned mine in about twelve hours early at noon.
149,it's a telecommunications type of company.
150,i work out of my home.
151,the way it works.
152,it doesn't have an air conditioner.
153,then you have to make a salad.
154,loving the bible in the equation.
155,i read in the paper.
156,i'm in the speech processing business.
157,once every year or two.
158,you don't eat it at all.
159,twelve men tried and true.
160,i think that's something we might want.
161,she thought for a few minutes.
162,that is a sad situation.
163,they do have capital punishment.
164,it was nice talking to you dudley.
165,my favorite team is the rangers.
166,kind of goes along with what you were saying.
167,we did don't go with fourteen one.
168,video choice award.
169,they are the detroit delegates.
170,he went to breed 'em one man and come back another.
171,as any city grows up.
172,so you did buy a pattern.
173,it's about sixty and a half percent.
174,i agree with the phone.
175,so i think it's going to be a lot easier.
176,not too much soy sauce.
177,we take a certain portion of your.
178,who sponsors you?
179,and i don't know what's going to happen.
180,i think we have about thirteen months this on it.
181,i do particularly find it.
182,they have cars and a swimming pool.
183,our point of view.
184,it really is worth while to know.
185,i felt that was a little insensitive.
186,public installations.
187,focal point.
188,i done one and one.
189,what are we doing?
190,my job tends to be very demanding.
191,you know it was just in jest.
192,and most people like that are old.
193,that's what i was doing before.
194,the best teachers and the best students.
195,i don't like it cold.
196,she was inaugurated in january.
197,what a minute.
198,those are no good anymore.
199,i do want to have a raise man.
200,i see that but yet i know too.
201,it wasn't organized enough for me.
202,if i don't know the story line.
203,that i've taxed in the past.
204,we same my pleasure.
205,he had choices to make a counselor told him.
206,the last time he came was in march.
207,i'm getting pretty.
208,it's really a cost.
209,have little material luxury but want a lot more.
210,you guys really are certified.
211,we've got a son from austin.
212,competition with demand.
213,it still makes most of its profits in asia.
214,i think that is important too.
215,have a good evening.
216,unfortunately we tend to make these occasions.
217,i didn't eat flies.
218,most of the time they don't bother with it.
219,they didn't rip it so i got it back.
220,i'm sure all the facts are in it.
221,the family is that get.
222,a lot of the eddies moved southward.
223,when disclosure isn't enough.
224,contact points.
225,this morning it was twenty nine.
226,satan rejoiced with his birth.
227,they fell out because of the drug issue.
228,they are done with a flour tortilla.
229,don't sulk.
230,that is usual for some people.
231,i'm ready from my other one during those hours.
232,where do you have to do a whole bunch of work?
233,i take it she was an accountant.
234,go to a shape for the indentations.
235,no problem there at all.
236,their way of life changed.
237,pass me that joint back again clement.
238,filters for air filtration for hospitals.
239,i do that when we travel.
240,i only saw the end of the first quarter.
241,is there work to support this conclusion?
242,buy a sewing machine.
243,as soon as we get the house finished.
244,and just keep chipping away at the house.
245,all the money.
246,my husband has a tool shed out back.
247,certain kinds of scene.
248,i always threaten my daughters with time out.
249,north korea is still allowed to receive oil.
250,that's here about getting parents more involved.
251,pass me that joint back again damnit.
252,what you need is a tougher punishment regime.
253,so it was really too late to do much.
254,i wanted to go to that golf course down south.
255,you get a little taste of it and you say no.
256,they don't even take my clerical security number.
257,because and philadelphia.
258,i don't know if you have ever heard of it.
259,social arborist.
260,that's exactly the way he feels.
261,do you really not remember?
262,that i'm concerned that side of it.
263,the ranks of asian riders are swelling too.
264,the mission will draw the corresponding conclusions.
265,burials usually happen during the morning.
266,be kind to your whole self.
267,that's the other bar that we went to that night.
268,i don't know why.
269,you can pack six love explosion petabytes here.
270,he's in first grade now.
271,i guess there's some companies that aren't growing fast enough.
272,occasionally semantically greeted.
273,something a little actor.
274,i kind of wish that they had a little league for the boys.
275,killer bee instincts.
276,i hadn't heard about that.
277,the ability of people to access healthcare.
278,that's probably one of the reasons.
279,quite a few movies are based off of that.
280,but when i went home that's all i could think about.
281,i'm not of that actually.
282,a couple dragging on here under.
283,it was something easy i could do.
284,i think not a lot of people go to rest value.
285,brown and black pits of joy.
286,the jury is expected to announce its decision.
287,some points.
288,i don't get to watch.
289,it's all money now.
290,help help rotate that more.
291,apartment everything.
292,they're probably doing it to their benefit.
293,that is good that they're like that.
294,she has some different work in her report.
295,i remember better times in school buying pies on work.
296,the new york tackle defiant raised the measure.
297,when we were in high school it was always fun.
298,she knows how to do that.
299,are you going to go see the eagle of love?
300,i'm sure there are some.
301,that's kind of like what we'd like to do.
302,quite a lot of very.
303,i haven't been to a baseball game in years.
304,bring out plants any more.
305,a land of oil and vinegar.
306,it just kind of drags on forever.
307,that's the only way you can get to tennessee from here.
308,he got a real low.
309,here are the tasty excerpts from the draft.
310,i have to think about it some more now.
311,i was really kind of excited to start reading.
312,what are you saying?
313,are very interesting.
314,i enjoyed it very much.
315,he had occasionally sent her mother money.
316,an early version of this article.
317,you might even be able to get a job there.
318,enjoyable to use.
319,we came to work in the one at night.
320,he really liked it and i don't.
321,it's just so small.
322,i think here is confusion.
323,just go someplace for the day.
324,but they're going to learn it sometime.
325,it was the big one.
326,it's kind of a depressing topic.
327,every eight months i have to pay my taxes.
328,i've never been sailing.
329,i have six years of college.
330,and then the next one down is in the married.
331,enjoy the adventure.
332,not really do.
333,too many stress problems for the long term.
334,are there any other countries or sounds you're interested in explaining?
335,yes i class myself what they call a full timer.
336,more family oriented.
337,do you know that i've never seen a monkey?
338,i know both people.
339,i recommend the honda's to a lot of people.
340,do you have a computer for yourself at home?
341,it's the original.
342,you can't blame them.
343,more choice more accountability.
344,i guess traffic could be an annoyance.
345,we've gone for mining food and leavening food.
346,i hate to dust and clean.
347,football is an induction sport.
348,i'm glad it's done.
349,i don't know the details.
350,can you speak more about this system of treasury disintegration?
351,too many horror stories out there.
352,ever been seen as a leader?
353,go to the zoo and see elephants and dogs and things like that.
354,it's been kind of fun.
355,that appeared to be eight or nine years old.
356,i'm kind of out of it right now.
357,i do not read everything in the paper.
358,my brother can do it.
359,not everybody shows up.
360,americans have pushed them out of their native tongue.
361,it was just based on the facts.
362,wasn't it your state that had priests involved?
363,did you actual use trucks at all?
364,i don't have too much either.
365,i can paint it in a day.
366,very well prepared.
367,tell some books.
368,this care will you forget.
369,i'm reading church.
370,do you have some baking time?
371,where did you get this cook book?
372,reading in the case of evil.
373,without the fuel it's permanently.
374,i'll see that next week.
375,we do as a matter of fact.
376,i have some games.
377,we're going to feel it watch out.
378,the news is a good way to keep up to date.
379,point blank in the face.
380,just walking the streets.
381,he did not want to be in it any more than i did.
382,the teacher had eleven kids.
383,we were promised civil liberties.
384,click here to join endlessly.
385,notary or interest in politics.
386,don't let them see balloons at home.
387,the issue is that your employer is going counter.
388,what do you write for them?
389,our point of view.
390,the lot we lived on is now a ranch.
391,for you next vehicle do you want a truck?
392,it's all seasonal cooking.
393,they pass your phone number on to another company.
394,they had sixty four of them.
395,well i like the seventies.
396,this is fusion as liberation.
397,it's probably going to be a real old used one.
398,enjoy your day.
399,the panel asked to raise them.
400,friday afternoon at five thirty.
401,lawmakers passed a pretty last year.
402,i mean a large flat plate.
403,i'd like to see it be more of an amateur sport.
404,all of our teen kids.
405,being more often than usual.
406,capital punishment.
407,everyone knows they're going to get it.
408,my in all listens to the kind of music i hate.
409,download on your amenities or television.
410,and we play out here in the summertime.
411,it never did run right again.
412,there are regular exploited.
413,especially the ones that came out and said their piece.
414,be an expression to you now.
415,where another one went.
416,former employers.
417,it looks like they've got a reason.
418,but you don't know that.
419,i noticed something interesting last time.
420,they wouldn't have to.
421,do you just like home cooking?
422,so it seems to be.
423,the decision to censor the article.
424,best wealth for employed places.
425,it would just depend.
426,i like this setting.
427,they've got the full right room.
428,you had to have a play.
429,that's neat that you like cross stitching also.
430,the measure now heads to government.
431,my three year old.
432,just not feasible you know.
433,i can't really think of anything else often.
434,i'm not sure how to go about it.
435,it's very tedious if you have a whole group.
436,it was a quality phone.
437,but it's kind of hard.
438,you can do so much with them.
439,my skill set got diminished by the sword.
440,it was like four hundred times as much.
441,it's sensibly done.
442,i would feel that i had the right to.
443,you just tell him protect.
444,i know there is.
445,it really hurts me.
446,the experience.
447,do we have to wait until all the land fills?
448,really scary to me.
449,i think it is striking force.
450,i really would like to see them do well.
451,i don't live in a house.
452,people put them then.
453,it can come away fast enough and go hard.
454,for about two hundred dollars.
455,in that time frame.
456,trying to make it through that.
457,anything like that we protested.
458,seven years in the power.
459,twenty years or so.
460,i think it does help.
461,that has got to be swarming this time of year.
462,even the busses.
463,take your sick leave.
464,it's been kind of scary.
465,the leaves are just dead.
466,we try to go so often.
467,it took four days.
468,the pros and cons of both.
469,we're so bad.
470,you get programming.
471,not that i like reading.
472,i think a step or two.
473,i don't mean to be talking.
474,i'd like to see those.
475,a controlled substance.
476,real close.
477,i guess he's trained in this.
478,it might be kind of tricky.
479,perhaps not in the manner that we do it.
480,do you have friends with older children?
481,one had more flow to it.
482,i just file federal income times tax every year.
483,i grew up on a farm.
484,that was the one that's been really nice to have.
485,they've done it before.
486,the engine was pretty good.
487,how different the people there really are.
488,we get out on the water occasionally.
489,maybe once every car or so.
490,since mine was one.
491,i make that once in a while.
492,how to do things.
493,i typically am not a cat person.
494,the junk mail that you get.
495,they put him in the nurse's office.
496,since this time last year i've changed.
497,they didn't fight together.
498,he seemed to know what he was doing.
499,they just live in the community.
500,it had to be remembered anyway.
501,if you do decide to go with child care.
502,does insurance pay for the body?
503,one is eight and one is eleven.
504,i was drug tested.
505,no neighbors and development community.
506,they are going to get a gun no matter what.
507,when i was in high school we had a choice.
508,never painted the outside.
509,that's how we got started.
510,a nicer dress than i could afford.
511,it's really beautiful.
512,most people aren't.
513,i think what they will do is start paying mexico.
514,i haven't experienced it.
515,you have to have a pretty good team.
516,those small little carts and cars like that.
517,they don't have the ability to develop it.
518,you got to have a won't dent indicator.
519,there's so much going on here.
520,the victim's family and things.
521,being one of the least in love mothers.
522,the drug dealers.
523,my wife's mother is the only endpoint left.
524,they're going now.
525,i have never said before.
526,i don't know what we're going to do.
527,it's second nature.
528,in it were the languages are.
529,we don't get to see too many.
530,it's like a bullet going by.
531,i mean lunch today was eighteen dollars.
532,it's really unfortunate.
533,the next morning you want to take them out.
534,if the news we're getting is any good.
535,if something goes wrong.
536,i haven't seen any.
537,use to teach each other all through the house.
538,you don't worry about them too much.
539,that kind of gas mileage.
540,it really doesn't make any difference.
541,i was born in texas and i visit other areas.
542,i guess because i work quite a bit with lawyers.
543,i guess i haven't had that much experience.
544,reports and papers and that sort of thing.
545,painting money that does not belong to them.
546,does it have to be a special color?
547,that's the freedom of choice.
548,i don't know too much about it.
549,my son plays football.
550,see how the family likes it.
551,one's in college away.
552,were his civil rights violated?
553,it looks like it would be.
554,doing laundry by hand and that kind of thing.
555,i don't want stubs in my lawn.
556,we can keep that out of our minds.
557,forms for his photography business.
558,we are seeing that here as well.
559,that's what made me happy.
560,it depends on the person.
561,i don't make that much.
562,it's been a long time.
563,no one can drive on ice.
564,maybe they placed it on that measure from me.
565,it seems like they would be able to.
566,just didn't paint the car.
567,she's one of those that loves.
568,now i just have to face it though.
569,mostly with adolescents.
570,i'm not a carpenter or anything like that.
571,i like to listen to piano music a whole lot.
572,two hour classes.
573,basically.
574,do you enjoy camping?
575,it's kind of a show piece.
576,remote down there.
577,how do you like your tread mill?
578,it was just two people at all times.
579,their self identity is stronger.
580,it is pretty okay.
581,i thought that that was what wesley said was for.
582,i couldn't get her up.
583,was it six weeks old?
584,fifteen feet wide.
585,or a bigger city.
586,fish chunks and dip it in the fondue.
587,when you found out who it was.
588,because they bring guns to school.
589,they wall up.
590,have you ever been drug tested?
591,he could get caught.
592,i'm originally a texan.
593,so you've got a lot of traffic noise real close.
594,really enjoyed it quite a bit.
595,i know a girl.
596,we've got to eat most of the time.
597,to the point of what i buy.
598,even in my case.
599,can do whatever they want.
600,because you own it.
601,a little more especially.
602,they even like every distance.
603,i food prices.
604,i think the decision has been made.
605,they are not sure of themselves.
606,two sides of the same plane.
607,he didn't really pay attention.
608,if you ever looking for that.
609,draw your own conclusions.
610,that's from the child's standpoint.
611,there is no timetable for a decision.
612,children receiver.
613,nurses get too worn down.
614,the second time you see it.
615,i mean you can earn a lot more money.
616,but at that point i was too far gone.
617,his voice was usually drowned out by the crowd.
618,i didn't know it.
619,that was a great little car.
620,over a very long period of time.
621,or to investigation.
622,vice president of companies.
623,i wasn't able to pay for it.
624,to assault choose.
625,they are lovely.
626,we see more and more women being involved.
627,i have to make this one last as long as i can.
628,only to the airport.
629,well tell me this.
630,that would be really awful.
631,classes and answer pieces.
632,because you don't know.
633,pour in the red wine and bring to a boil.
634,i'll turn the radio on.
635,they say if you're not tall in this line.
636,that's the way i feel.
637,what happened to get us to this point?
638,trump has said there was no collusion.
639,it was a great pleasure speaking with you.
640,i had the opposite.
641,we sit around and eat popcorn.
642,i don't have boys.
643,that would have been best time to go.
644,if they didn't have to.
645,that's certainly true.
646,you developed your attention.
647,we have that here.
648,usually be fine for profitable.
649,i've had so many people.
650,i don't even get to see half my project.
651,we put some paper on the floor.
652,that's the closest thing.
653,it's kind of funny actually.
654,it was first the back i guess.
655,a pop up trailer.
656,you're with the home office now.
657,they seem to be economically given also.
658,that would be a really good thing to do.
659,too much business.
660,he's retired now.
661,i heard this on a christian program.
662,even though they're so close.
663,in his money.
664,i had never seen anything.
665,these rich people started.
666,used to be six bucks.
667,i got a cup.
668,i feel so silly.
669,are they all here in the area?
670,i kind of look at it this way.
671,public parking.
672,sewing and quilting.
673,good to hear from you.
674,through oklahoma city.
675,i read a lot and then i know people.
676,did you pull them?
677,that would make me happy though.
678,it's nice to get out in the open air.
679,i think it would do something for it.
680,it has really been nice here.
681,state land grant colleges.
682,it works out real nice.
683,we've had lots of them in the past.
684,it's only been that way in the last five years.
685,i left out in the middle of it.
686,it's depressing to.
687,i don't own my home.
688,i've always wondered how he gets around.
689,it's just tough.
690,fiction books that i really like.
691,you got any more?
692,i'm beginning to think it's not.
693,that's something i missed quite a bit.
694,they finally came up with evidence.
695,that's true i didn't think about that.
696,good together as a team.
697,part of it would probably work out.
698,it's necessarily going to involve more taxes.
699,it's just going to follow.
