id,text
691,Variety Years Originally Take Second.
692,Child Boys Classical Clothes Team.
693,Store somewhere unusual house this.
694,Course Girl Exactly Fan Watching.
695,Cool Middle Benefits Education Life.
696,Mother Tasting Second Easier From Program Number.
697,Coming Soon York Favourite Food!
698,You spend many necessarily move.
699,First month expected fine nursing.
700,Thank York Catch Along Set.
701,Mother team system amount taxes.
702,Story Noise Sounds Eat It Friends!
703,Line talked to Depends across weekend.
704,Large number of employees will miss this.
705,This program will help our growing team.
706,My baby grew a lot in the first six months.
707,This policy is important for social interest.
708,I knew what the deal was in the past.
709,Quality Education Will Certainly Help.
710,This does not appeal to me at all.
711,They gave variety of benefits to their employment.
712,We have a long evening ahead of us.
713,Different choices between past and future.
714,This will fall down soon.
715,American teams are clear this season.
716,Nothing will change my heart on this matter.
717,She was supposed to go with me.
718,He said he was bad today.
719,School gave a card and books to this small child.
720,Parents of small children care about this.
721,She was taking her time to do the work.
722,This policy mostly sounds right to me.
723,You should avoid this course.
724,Especially if you are coming this weekend.
725,We will listen to whatever jury says.
726,I will give you one for free.
727,How much is your card worth?
728,Please order our regular food for everyone.
729,It pertains to my daily life at the present time.
730,But you have friends that have children.
731,Stones with runes on them served as employees.
732,There was a story of a woman last year.
733,A medical problem?
734,What area of the country do you live in?
735,This happened about a week ago.
736,It seems like you work quicker.
737,In the district.
738,They started looking into programs.
739,Join us for and upcoming event!
740,Do you believe in the palace compares?
741,Do you find yourself funny?
742,To get into the systems very difficult.
743,Second generation.
744,Real rough time camping.
745,So I made my own version.
746,They said it was really riveting.
747,That would be good.
748,I'm not building any reserves.
749,Just put your paper in the same place every day.
750,Pull all this weight.
751,Bring the Pot to a boil.
752,It's my voice.
753,What does the American Report say?
754,Social States Give More Benefits to Employees.
755,I am taking my car to check this out in the evening.
756,This car is super expensive.
757,Her friend will thank her for the card.
758,Originally it was a year long nursing program.
759,What happened to the sound?
760,Tell me your education story.
761,There's good music and good food.
762,What is the cost of each piece you sell?
763,I I hope and listen to this wonderful music.
764,I have to go across the city to see her.
765,My teachers exactly knew my mind.
766,How long have you been married?
767,Your experience is is very good for this job.
768,His good luck will help him avoid problems.
769,I am free to make a decision about my college.
770,Avoid Capital Punishment.
771,Getting married is not a crime.
772,What happened after I left?
773,Let's make a program for kids.
774,Light clothes are bad.
775,How many miles were you driving today?
776,Government will run from the capital city.
777,They will take up recycling from now on.
778,My yard is very clean today.
779,I am not a fan of this kind of music.
780,Nothing is more important to him than power.
781,I like to work in this small room.
782,Their situation is not as bad.
783,This is Teachers' favourite topic.
784,She has experience in education.
785,This will not matter as much in the long run.
786,I tried a lot but this is still wrong.
787,I paid all my taxes the night before.
788,This is a growing company with many employees.
789,The Law Gives Everyone This One Right.
790,Listen to your parents right now.
791,What's the occasion today?
792,Your mother said this is enough.
793,How many books on law do you have?
794,Which book are you reading to children?
795,This seems like a large catch.
796,Do you have your credit card?
797,The couple got married last week.
798,I have lived in Illinois and Dallas.
799,Television Service is Awful Here.
800,The jury cannot change this fact.
801,I was in the nursing school originally.
802,Recycling Law Depends on Your City.
803,I'm watching my kid's education.
804,I bought these new clothes today.
805,This may seem important now.
806,Tax season is certainly interesting.
807,There's so much noise in the capital city.
808,Your Story is Not Clear Anymore.
809,This room is quite neat.
810,Children do not like punishment.
811,My wife thinks this is not worth the time.
812,They make less money in this season with snow.
813,Will you spend all that time reading your book?
814,I am here for my friend's company.
815,You should vote for the future.
816,The morning sun light is white.
817,My teachers are very helpful.
818,Is this noise from the tv?
819,Eat your food it's getting cold.
820,Who benefits from this policy?
821,My daughter likes to play outside in the yard.
822,He will understand when I talk to him.
823,How many casualties were there?
824,Luxury does not have to be expensive.
825,I like all this open space around the house.
826,Evening is the best time for wedding.
827,Nothing can stop me from doing this.
828,She will sit across the room.
829,Seventy Awful Years.
830,Appeal of Luxury Things is something else.
831,This is a special city in the special country.
832,Certain people enjoy this kind of music.
833,Camping is getting more expensive.
834,Who thought of this wonderful idea?
835,Some more time in the morning would be nice.
836,What was the exact line in the play?
837,We must always keep looking forward.
838,Check the oil in the car first.
839,The view from here is not worth it.
840,He is quite a social person.
841,They will be more like somewhere around here.
842,That woman will check this fact.
843,Do not sell your free time or your peace of mind.
844,It all worked out quite well for our family.
845,The Joy of an Early Morning Walk.
846,It is easy to go without food.
847,My vision does not amount to anything.
848,The baby will stick its is in the food.
849,How often do you go for a walk with him?
850,We should guard aground and big or up from school.
851,The guy will go north the hear.
852,They must think if they can live with this decision.
853,I am not sure if this will be interesting to the kids.
854,That was a close call.
855,First of all remember to be nice.
856,Can you book the book fair for a school minutes?
857,Yes I am talking to you.
858,This will make somebody care for the simulation.
859,We we talked about this the other day.
860,What was your experience working with him?
861,She was the division head in the college.
862,He wanted to walk for miles.
863,Please that's enough music for today.
864,We would need to work more on the social part.
865,This married couple will enjoy their visit.
866,I don't see what the problem is.
867,I guess something has to go.
868,Do you know that have never seen a puppy?
869,They've enjoyed the school.
870,Prince of Persia.
871,Seeing as you have got some older children.
872,I think it's cost a lot.
873,If you haven't cleaned down.
874,Keep to their own turf.
875,We also set aside money for entertainment.
876,I enjoy the news.
877,Everything I learned about ancient Rome.
878,As far as doing things for them.
879,Right now I'm busy chasing my kids.
880,Wasn't allowed to run a learn more.
881,The coastline was just incredible.
882,Why do you say that actually?
883,You were great!
884,Ten months later he said.
885,I'm glad to hear that.
886,I had to change the water in that.
887,I mean I've haven't had it that long.
888,When they fall over.
889,Check out our free versions.
890,I make my living by phone.
891,I'm in choice of raising them.
892,I think it would work out well.
893,They will not get everything done anyway.
894,People from my college were already there.
895,I will probably say no to this.
896,It is the policy in this country.
897,Having too much power can be difficult.
898,Usually clothes these days are quite expensive.
899,Is your family from Dollars?
900,There seems to be some confusion about this.
901,There are some awful places in that country.
902,My computer is not working anymore.
903,Employees should do some field work when they join.
904,Where it is that awful noise coming from?
905,My American friends are from Texas.
906,The Old Newspaper will have a rewrite on this.
907,How much do you have to pay for your credit card?
908,We cannot go there without you.
909,Not everyone can exercise in the morning.
910,The work reads easier with experience.
911,We will have to place a large order.
912,I have been working on this since early Monday.
913,The Air is Clear at Night.
914,I will probably own a car soon.
915,With their good luck they will avoid these problems.
916,How many minutes did it take to cook this food?
917,Let's Play This New Version of My Favorite Music!
918,Most of us think we know the story of Detroit Michigan.
919,That was one thing that's been really nice to have.
920,They shot him point blank in the face.
921,These are made with a flour Tamil.
922,Did you hear from another person?
923,It has been like fifteen years.
924,Here are my notes from the first draft of the paper.
925,Do you have any pets now?
926,My mom lives like I do.
927,That is a very good point.
928,Who is related to who?
929,How much time do you spend with your children?
930,She is more famous since she did that.
931,They will financially recover from the loan.
932,They don't make them anymore.
933,There were none left by the year two thousand.
934,Wayne State University is in Detroit Michigan.
935,It's an invasion of privacy.
936,There were no repairs of casualties.
937,The Blue Sky looks so pretty.
938,It is impression in more than just quantity.
939,That is strange to me.
940,I'm out more money than they are.
941,I am from Argentina.
942,It is like winning the literally.
943,I did it all of the time.
944,Pests can be a lot of devil.
945,Whatever you like.
946,The Moving is Slow Money.
947,We don't listen to any variety music at my house.
948,What do you think?
949,He was a good player.
950,You came out on top.
951,That really ticks me off.
952,There were thousands of cows on the farm.
953,Now some people expect very primary depends.
954,You have to do the random drug testing.
955,The recipe lessons require kneading the dough.
956,They would sell five million of things.
957,The Ranch Dressing was along well with that.
958,It used to cost six bucks.
959,In this sentences I don't know how to behave.
960,It would be fine just to one one.
961,The full decision statement is available here.
962,Exceptionally with water at any on them.
963,I'm interested in having it in my office.
964,I do not talk to many people in the military.
965,Who do they need to trade before the deadline?
966,You will gain competence with respect to the material.
967,It's not hard to find a job that's part time.
968,Do you still drive that old car?
969,They would have to be supported in some way.
970,I miss the intellectual simulation of taking classes in college.
971,As you get older you will understand.
972,You would know if you lost it or something.
973,Are you a computer hacker?
974,There is a very serious situation across the street.
975,I don't make that much money.
976,It's actually just twelve years old.
977,They were not really into sports.
978,Thank you and please enjoy your stay.
979,My favorite author just released a brand new book.
980,I didn't know there was such a thing.
981,That is my retirement plan.
982,I would like to see a little bit more of that.
983,She jumped at the sound of the thunder storm.
984,I have to balance work and life.
985,He took care of it.
986,I love to watch cartoons on Saturday morning.
987,She will be a sophomore in high school next year.
988,Some interviews will be a lot more casual.
989,You is just what for to be.
990,My real accent is this.
991,It's been set of story.
992,They would have never packed it in.
993,That is why their count is behind on work.
994,She can do it!
995,She's like seventy four years old now.
996,I couldn't understand.
997,I just want to enjoy myself a little bit.
998,It could be recorded.
999,It costs ten or twenty Galaxy S.
1000,Of course it's real convenient for you.
1001,It's something that tests me.
1002,In my Lawrence is about to expire.
1003,I sew clothes for them every once in a while.
1004,We were elicited in the long school.
1005,He won a free trip or something really this large.
1006,The weight loss fad into healing it.
1007,You have to look around at the school.
1008,I still like the new York stations.
1009,I started Violator Generic in college.
1010,My son really wanted a big bed.
1011,One of the biggest creatures of the animal king.
1012,Have you set what befalls the images may vary.
1013,I hope everything works out up there.
1014,Are you pleased with this decision?
1015,The chain is just over the hill here.
1016,It's totally ridiculous.
1017,In other words there is a choice to make.
1018,That does not seem quite fair.
1019,That is horrible.
1020,Fill the jar to the top with boiling water.
1021,It was a prime time football game.
1022,Not too long ago.
1023,She has had really good luck this year.
1024,I went back to school and got my masters degree.
1025,Then I heard a very loud explosion.
1026,My dad is a potato farmer.
1027,That's a good option to consider.
1028,Do you want to eat inside or outside?
1029,And so we usually sit outside.
1030,Professors from other universities will present their research.
1031,They are now starting to make them.
1032,I guess there are a few things around still.
1033,They are so small.
1034,It is a fairly large liberal arts college as well.
1035,Having a job will keep you out of trouble.
1036,I like it here.
1037,I think they already did that.
1038,Usually the conversation takes into a and automate.
1039,We need to buy more and more of them.
1040,A guy that I know just got a tie there.
1041,I hope you all enjoy this.
1042,Where I go to church now?
1043,It's hard for me to upgrade.
1044,You don't get nearly enough exercise.
1045,She'll be two years old and alive.
1046,I filed my taxes early this year.
1047,You still need your mother's permission.
1048,And a very good afternoon to you.
1049,American Car Companies.
1050,I've got a two year old and a four year old.
1051,We definitely need a case in the system.
