id,text
1334,I went back to store it at my sisters degree.
1335,I hope this works out up there.
1336,I see played the this decision.
1337,The Town is just over the hill here.
1338,It is totally ridiculous.
1339,In other words there is a price to pay.
1340,That does not seem quite fair.
1341,That is terrible.
1342,Fill the try to the top with blowing water.
1343,It was a big time softball game.
1344,Not too long ago.
1345,We have had pretty good luck this year.
1346,I went back to store I got my lessons degree.
1347,In the next five years.
1348,College Credit for Community Service is a good idea.
1349,Lexical and Religious Views on Need and Pleasure.
1350,The past few weeks are a case in point.
1351,The Commandment offers financial services.
1352,Mix some cream sauce with it and pour it over rice.
1353,People are jumping out of cure.
1354,A lot of chicken and rice.
1355,As soon as I had them.
1356,I was tired during that all month.
1357,We hope you enjoy your stay.
1358,We are not trying to respect them or anything.
1359,How can I avoid be infected by a virus?
1360,You don't have to be an option to play this game.
1361,I live in a farming community.
1362,Do you have any friends with older children?
1363,When things don't go right you have to adjust.
1364,What should I do?
1365,The first demonstration of a chart when displayed.
1366,Not in a civilized society.
1367,And they really seem wise.
1368,If you need some more stuff.
1369,Their not really even participating.
1370,What with all the other things going on today.
1371,We used to always enjoy watching that show.
1372,You go on outside and play.
1373,So do you like your new truck?
1374,You'd think that it was a private school.
1375,They've started a drug testing policy.
1376,I think there's about seventy five people here.
1377,Whatever they done you is a liar.
1378,They can't too as too of a game.
1379,It's a guy's place.
1380,Everybody is sitting here screaming.
1381,I just can't do those types of basses.
1382,If there comes or appeal the money they are to write.
1383,How long have you lived in this house?
1384,Occasionally it is a pretty event.
1385,It's a big dairy industry.
1386,Some new tasks are manager.
1387,That's where I am.
1388,It was about nine along at night.
1389,R is the bags at your move from.
1390,Which is probably about what their operandi is.
1391,My father is the man in the garter dragon.
1392,They can mean anything.
1393,The two scenes of what are happy?
1394,It's a personal decision.
1395,She doesn't work.
1396,Keep it clean please.
1397,I think it's just that you see your cousins regularly.
1398,About how many calls have you made on this system?
1399,I don't know what to think about that.
1400,It slowly grew well and agree the male or.
1401,I'd like to see talents of the knives.
1402,We are quite simply at a people point.
1403,What You Have and What You Don't Have.
1404,Just Funny Miles North of Here.
1405,Look at the sections.
1406,Who did they play?
1407,Listens all the way around.
1408,I drove a Donnelly by then.
1409,I would them to come back up this year.
1410,You don't understand this.
1411,It doesn't seem that low.
1412,This is an invasion of privacy issue.
1413,A really good thing to do.
1414,My son just adopted a cat.
1415,The only other place I've ever vacationed.
1416,But they have six over there.
1417,They had scouts and story time and everything.
1418,Because of a service that they could afford.
1419,Not just with the pressing to pencil.
1420,There's a tenacious.
1421,What if you were in your kid's shoes?
1422,I don't know if you've tried it.
1423,Parametric pressure cracks during a carnage.
1424,Cover him up and keep him warm.
1425,Their very affectionate with one another.
