id,text
691,Variety Years Originally Take Second.
692,Child Boys Classical Clothes Team.
693,Store somewhere unusual house this.
694,Course Girl Exactly Fan Watching.
695,Cool Middle Benefits Education Life.
696,Mother Tasting Second Easier From Program Number.
697,Coming Soon York Favourite Food!
698,You spend many necessarily move.
699,First month expected fine nursing.
700,Thank York Catch Along Set.
701,Mother team system amount taxes.
702,Story Noise Sounds Eat It Friends!
703,Line talked to Depends across weekend.
704,Large number of employees will miss this.
705,This program will help our growing team.
706,My baby grew a lot in the first six months.
707,This policy is important for social interest.
708,I knew what the deal was in the past.
709,Quality Education Will Certainly Help.
710,This does not appeal to me at all.
711,They gave variety of benefits to their employment.
712,We have a long evening ahead of us.
713,Different choices between past and future.
714,This will fall down soon.
715,American teams are clear this season.
716,Nothing will change my heart on this matter.
717,She was supposed to go with me.
718,He said he was bad today.
719,School gave a card and books to this small child.
720,Parents of small children care about this.
721,She was taking her time to do the work.
722,This policy mostly sounds right to me.
723,You should avoid this course.
724,Especially if you are coming this weekend.
725,We will listen to whatever jury says.
726,I will give you one for free.
727,How much is your card worth?
728,Please order our regular food for everyone.
729,It pertains to my daily life at the present time.
730,But you have friends that have children.
731,Stones with runes on them served as employees.
732,There was a story of a woman last year.
733,A medical problem?
734,What area of the country do you live in?
735,This happened about a week ago.
736,It seems like you work quicker.
737,In the district.
738,They started looking into programs.
739,Join us for and upcoming event!
740,Do you believe in the palace compares?
741,Do you find yourself funny?
742,To get into the systems very difficult.
743,Second generation.
744,Real rough time camping.
745,So I made my own version.
746,They said it was really riveting.
747,That would be good.
748,I'm not building any reserves.
749,Just put your paper in the same place every day.
750,Pull all this weight.
751,Bring the Pot to a boil.
752,It's my voice.
753,What does the American Report say?
754,Social States Give More Benefits to Employees.
755,I am taking my car to check this out in the evening.
756,This car is super expensive.
757,Her friend will thank her for the card.
758,Originally it was a year long nursing program.
759,What happened to the sound?
760,Tell me your education story.
761,There's good music and good food.
762,What is the cost of each piece you sell?
763,I I hope and listen to this wonderful music.
764,I have to go across the city to see her.
765,My teachers exactly knew my mind.
766,How long have you been married?
767,Your experience is is very good for this job.
768,His good luck will help him avoid problems.
769,I am free to make a decision about my college.
770,Avoid Capital Punishment.
771,Getting married is not a crime.
772,What happened after I left?
773,Let's make a program for kids.
774,Light clothes are bad.
775,How many miles were you driving today?
776,Government will run from the capital city.
777,They will take up recycling from now on.
778,My yard is very clean today.
779,I am not a fan of this kind of music.
780,Nothing is more important to him than power.
781,I like to work in this small room.
782,Their situation is not as bad.
783,This is Teachers' favourite topic.
784,She has experience in education.
785,This will not matter as much in the long run.
786,I tried a lot but this is still wrong.
787,I paid all my taxes the night before.
788,This is a growing company with many employees.
789,The Law Gives Everyone This One Right.
790,Listen to your parents right now.
791,What's the occasion today?
792,Your mother said this is enough.
793,How many books on law do you have?
794,Which book are you reading to children?
795,This seems like a large catch.
796,Do you have your credit card?
797,The couple got married last week.
798,I have lived in Illinois and Dallas.
799,Television Service is Awful Here.
800,The jury cannot change this fact.
801,I was in the nursing school originally.
802,Recycling Law Depends on Your City.
803,I'm watching my kid's education.
804,I bought these new clothes today.
805,This may seem important now.
806,Tax season is certainly interesting.
807,There's so much noise in the capital city.
808,Your Story is Not Clear Anymore.
809,This room is quite neat.
810,Children do not like punishment.
811,My wife thinks this is not worth the time.
812,They make less money in this season with snow.
813,Will you spend all that time reading your book?
814,I am here for my friend's company.
815,You should vote for the future.
816,The morning sun light is white.
817,My teachers are very helpful.
818,Is this noise from the tv?
819,Eat your food it's getting cold.
820,Who benefits from this policy?
821,My daughter likes to play outside in the yard.
822,He will understand when I talk to him.
823,How many casualties were there?
824,Luxury does not have to be expensive.
825,I like all this open space around the house.
826,Evening is the best time for wedding.
827,Nothing can stop me from doing this.
828,She will sit across the room.
829,Seventy Awful Years.
830,Appeal of Luxury Things is something else.
831,This is a special city in the special country.
832,Certain people enjoy this kind of music.
833,Camping is getting more expensive.
834,Who thought of this wonderful idea?
835,Some more time in the morning would be nice.
836,What was the exact line in the play?
837,We must always keep looking forward.
838,Check the oil in the car first.
839,The view from here is not worth it.
840,He is quite a social person.
841,They will be more like somewhere around here.
842,That woman will check this fact.
843,Do not sell your free time or your peace of mind.
844,It all worked out quite well for our family.
845,The Joy of an Early Morning Walk.
846,It is easy to go without food.
847,My vision does not amount to anything.
848,The baby will stick its is in the food.
849,How often do you go for a walk with him?
850,We should guard aground and big or up from school.
851,The guy will go north the hear.
852,They must think if they can live with this decision.
853,I am not sure if this will be interesting to the kids.
854,That was a close call.
855,First of all remember to be nice.
856,Can you book the book fair for a school minutes?
857,Yes I am talking to you.
858,This will make somebody care for the simulation.
859,We we talked about this the other day.
860,What was your experience working with him?
861,She was the division head in the college.
862,He wanted to walk for miles.
863,Please that's enough music for today.
864,We would need to work more on the social part.
865,This married couple will enjoy their visit.
866,I don't see what the problem is.
867,I guess something has to go.
868,Do you know that have never seen a puppy?
869,They've enjoyed the school.
870,Prince of Persia.
871,Seeing as you have got some older children.
872,I think it's cost a lot.
873,If you haven't cleaned down.
874,Keep to their own turf.
875,We also set aside money for entertainment.
876,I enjoy the news.
877,Everything I learned about ancient Rome.
878,As far as doing things for them.
879,Right now I'm busy chasing my kids.
880,Wasn't allowed to run a learn more.
881,The coastline was just incredible.
882,Why do you say that actually?
883,You were great!
884,Ten months later he said.
885,I'm glad to hear that.
886,I had to change the water in that.
887,I mean I've haven't had it that long.
888,When they fall over.
889,Check out our free versions.
890,I make my living by phone.
891,I'm in choice of raising them.
892,I think it would work out well.
893,They will not get everything done anyway.
894,People from my college were already there.
895,I will probably say no to this.
896,It is the policy in this country.
897,Having too much power can be difficult.
898,Usually clothes these days are quite expensive.
899,Is your family from Dollars?
900,There seems to be some confusion about this.
901,There are some awful places in that country.
902,My computer is not working anymore.
903,Employees should do some field work when they join.
904,Where it is that awful noise coming from?
905,My American friends are from Texas.
906,The Old Newspaper will have a rewrite on this.
907,How much do you have to pay for your credit card?
908,We cannot go there without you.
909,Not everyone can exercise in the morning.
910,The work reads easier with experience.
911,We will have to place a large order.
912,I have been working on this since early Monday.
913,The Air is Clear at Night.
914,I will probably own a car soon.
915,With their good luck they will avoid these problems.
916,How many minutes did it take to cook this food?
917,Let's Play This New Version of My Favorite Music!
918,Most of us think we know the story of Detroit Michigan.
919,That was one thing that's been really nice to have.
920,They shot him point blank in the face.
921,These are made with a flour Tamil.
922,Did you hear from another person?
923,It has been like fifteen years.
924,Here are my notes from the first draft of the paper.
925,Do you have any pets now?
926,My mom lives like I do.
927,That is a very good point.
928,Who is related to who?
929,How much time do you spend with your children?
930,She is more famous since she did that.
931,They will financially recover from the loan.
932,They don't make them anymore.
933,There were none left by the year two thousand.
934,Wayne State University is in Detroit Michigan.
935,It's an invasion of privacy.
936,There were no repairs of casualties.
937,The Blue Sky looks so pretty.
938,It is impression in more than just quantity.
939,That is strange to me.
940,I'm out more money than they are.
941,I am from Argentina.
942,It is like winning the literally.
943,I did it all of the time.
944,Pests can be a lot of devil.
945,Whatever you like.
946,The Moving is Slow Money.
947,We don't listen to any variety music at my house.
948,What do you think?
949,He was a good player.
950,You came out on top.
951,That really ticks me off.
952,There were thousands of cows on the farm.
953,Now some people expect very primary depends.
954,You have to do the random drug testing.
955,The recipe lessons require kneading the dough.
956,They would sell five million of things.
957,The Ranch Dressing was along well with that.
958,It used to cost six bucks.
959,In this sentences I don't know how to behave.
960,It would be fine just to one one.
961,The full decision statement is available here.
962,Exceptionally with water at any on them.
963,I'm interested in having it in my office.
964,I do not talk to many people in the military.
965,Who do they need to trade before the deadline?
966,You will gain competence with respect to the material.
967,It's not hard to find a job that's part time.
968,Do you still drive that old car?
969,They would have to be supported in some way.
970,I miss the intellectual simulation of taking classes in college.
971,As you get older you will understand.
972,You would know if you lost it or something.
973,Are you a computer hacker?
974,There is a very serious situation across the street.
975,I don't make that much money.
976,It's actually just twelve years old.
977,They were not really into sports.
978,Thank you and please enjoy your stay.
979,My favorite author just released a brand new book.
980,I didn't know there was such a thing.
981,That is my retirement plan.
982,I would like to see a little bit more of that.
983,She jumped at the sound of the thunder storm.
984,I have to balance work and life.
985,He took care of it.
986,I love to watch cartoons on Saturday morning.
987,She will be a sophomore in high school next year.
988,Some interviews will be a lot more casual.
989,You is just what for to be.
990,My real accent is this.
991,It's been set of story.
992,They would have never packed it in.
993,That is why their count is behind on work.
994,She can do it!
995,She's like seventy four years old now.
996,I couldn't understand.
997,I just want to enjoy myself a little bit.
998,It could be recorded.
999,It costs ten or twenty Galaxy S.
1000,Of course it's real convenient for you.
1001,It's something that tests me.
1002,In my Lawrence is about to expire.
1003,I sew clothes for them every once in a while.
1004,We were elicited in the long school.
1005,He won a free trip or something really this large.
1006,The weight loss fad into healing it.
1007,You have to look around at the school.
1008,I still like the new York stations.
1009,I started Violator Generic in college.
1010,My son really wanted a big bed.
1011,One of the biggest creatures of the animal king.
1012,Have you set what befalls the images may vary.
1013,I hope everything works out up there.
1014,Are you pleased with this decision?
1015,The chain is just over the hill here.
1016,It's totally ridiculous.
1017,In other words there is a choice to make.
1018,That does not seem quite fair.
1019,That is horrible.
1020,Fill the jar to the top with boiling water.
1021,It was a prime time football game.
1022,Not too long ago.
1023,She has had really good luck this year.
1024,I went back to school and got my masters degree.
1025,Then I heard a very loud explosion.
1026,My dad is a potato farmer.
1027,That's a good option to consider.
1028,Do you want to eat inside or outside?
1029,And so we usually sit outside.
1030,Professors from other universities will present their research.
1031,They are now starting to make them.
1032,I guess there are a few things around still.
1033,They are so small.
1034,It is a fairly large liberal arts college as well.
1035,Having a job will keep you out of trouble.
1036,I like it here.
1037,I think they already did that.
1038,Usually the conversation takes into a and automate.
1039,We need to buy more and more of them.
1040,A guy that I know just got a tie there.
1041,I hope you all enjoy this.
1042,Where I go to church now?
1043,It's hard for me to upgrade.
1044,You don't get nearly enough exercise.
1045,She'll be two years old and alive.
1046,I filed my taxes early this year.
1047,You still need your mother's permission.
1048,And a very good afternoon to you.
1049,American Car Companies.
1050,I've got a two year old and a four year old.
1051,We definitely need a case in the system.
1052,That's pretty much the South End of the state.
1053,I was kind of into it for a while there.
1054,Occasionally these things may not be true.
1055,I'll get around to it.
1056,It's a package deal.
1057,The result of the test was negative.
1058,I will be visiting New England.
1059,I guess because we don't go out that much.
1060,The day care accepted infants starting at six weeks old.
1061,An absolute certainty.
1062,I hope I'm on the right track.
1063,I think it is a wonderful interim place.
1064,We did go camping in Arkansas.
1065,That would of been something.
1066,I would contemplate going on a cruise now.
1067,You know what I would love?
1068,It was out of his hands at that point.
1069,For legal assistance and that's what I know.
1070,My wife and I both like it.
1071,How do you measure it?
1072,I don't really follow the app very closely.
1073,She was always a little bit leery of her.
1074,It's really hard to.
1075,It looks like it would be.
1076,That would be devastating I'm sure.
1077,If it's run by the individual state.
1078,And so you know and it's his choice to make.
1079,You just gave it away.
1080,The Acid Rain Situation or the Ozone Depletion?
1081,Employment Income.
1082,I have to be real careful.
1083,I hope you enjoyed this article.
1084,My husband travels.
1085,There not owning hopes.
1086,Where do you go camping at around here?
1087,I try to save that for the weekend.
1088,When does school start?
1089,We've got these once.
1090,That's just the way it was.
1091,Vegetables grow in the fields.
1092,It's kind of like drawing this line.
1093,I had gone to a very dimly lit area.
1094,Which one is the tourist area?
1095,I was raised in New York.
1096,When you leave a job.
1097,That's the only pollution that's been there.
1098,They didn't a smaller setting.
1099,They put it out in a video.
1100,Especially in the winter.
1101,You like books and things?
1102,Like building a house or anything?
1103,Take a lot of chances.
1104,I don't think I would have insurance.
1105,It's up by rude boy.
1106,I always wanted to go to school for nursing.
1107,I make a lot of my Christmas presents.
1108,I think a lot of choices.
1109,Because what in dollars?
1110,Get arrested or what not?
1111,That decision is expected early next week.
1112,My pretty is five ways younger than my sister is.
1113,It is fine.
1114,I was raised in this area.
1115,He scored better than we did on the final itself.
1116,Did you see it the other night?
1117,There I really mean that.
1118,He's been a listed for so many years.
1119,Well that book is about the same kind of thing.
1120,I can still read music.
1121,How are you liking it?
1122,I was accused of silly dogs.
1123,What was the actually starting point for the story?
1124,Did you find it hard to make decisions?
1125,How did you come to join that team?
1126,I went back home tonight.
1127,The store will re?
1128,I try not to use insecticides on my lawn.
1129,It does not snow as much as I remember while growing up.
1130,We drove through Oklahoma City.
1131,After decimation the students will go on to a variety of colleges.
1132,It's still a great same.
1133,The military has a strong presence in the Persian Gulf.
1134,That is tame compared to what I personally buy.
1135,On the other hand I am quite good.
1136,I love this country so much.
1137,You get the point.
1138,Were you calling me from Texas?
1139,I love ending performed by.
1140,We went to to see the different part three.
1141,It is strange enough.
1142,I think its relevance is pretty limited.
1143,Give a voice to the restless.
1144,There has been a change in the price of oil.
1145,I absolutely loved it.
1146,Either way they always pull it way.
1147,I guess what you have to do is just relax.
1148,I think that's a really interesting creation.
1149,I think Dyson homes can be good for some people.
1150,I was arrested for something really milder.
1151,He's going to be traveling to Europe with a group of friends.
1152,They live in a little white frame house.
1153,The event was really oriented toward little kids.
1154,They fell out because of his drug addition.
1155,Nobody remembers him as a loser.
1156,Teach children to love reading for pleasure.
1157,So what company do you work for?
1158,We had such a good time!
1159,It's kind of funny.
1160,Because a lot of our friends will be coming over later.
1161,That will be a big thrill for them.
1162,Do you have any kids or pets?
1163,Well that sounds pretty good.
1164,That's what I was about to say.
1165,But they're planning on doing it very soon.
1166,You live right across the street from my daughter.
1167,You know some of that.
1168,I don't understand any of that.
1169,It's actually turning out to be even worse than we thought.
1170,My daughter is in kindergarten.
1171,You don't have to worry that much.
1172,I am pretty aware of what goes on here.
1173,I really don't have any problem with it.
1174,I did not earn my degree until later on in my life.
1175,That was the point.
1176,He's just so tall.
1177,It is important for women who need to work.
1178,They are here for a purpose.
1179,We got together every summer for vacation.
1180,We could spend that money very quickly.
1181,I took care of the children.
1182,It's not like he had a choice.
1183,Lunch was like thirteen dollars or something.
1184,And I think he's as guilty as the devil.
1185,I couldn't believe how much it cost.
1186,We know what we can do.
1187,I like being involved in things like this.
1188,The brand new company is making a lot of money.
1189,I'm going to go to the grocery store.
1190,I was so thrilled that they visited me.
1191,So amazing all of his lines being spoken in that voice.
1192,It has been a really nice spring.
1193,The movie had a lot of nudity and curse words.
1194,Take a piece of paper to draw on.
1195,I think it's important to know about this.
1196,You will learn more about the characters in the book.
1197,People are having their civil rights taken away.
1198,What some of these people went through is terrible.
1199,I played a large role in that decision.
1200,We have had no snow this winter.
1201,Vote for your top choice.
1202,Some of them did say that.
1203,I can understand their viewpoint.
1204,Divide the money up between all of us.
1205,That would be devastating I'm sure.
1206,If it's run by the individual state.
1207,It's his choice to make.
1208,You just gave it away.
1209,Are you talking about the acid rain situation or the ozone depletion?
1210,Employment Income.
1211,I have to be real careful.
1212,I hope you enjoyed this article.
1213,My accent travels frequently.
1214,Their not buying homes.
1215,The girls at school are all really clothes from the sixties.
1216,You probably wouldn't recognize me.
1217,It was on the news every night.
1218,His story is not unusual.
1219,The Fish was cooked with some olives.
1220,I had found and entry point.
1221,They don't kill the animals.
1222,Selling bottles of water?
1223,Basis as usual for traders.
1224,They gave us a pistol deal.
1225,The reality is that's usually not the case.
1226,I wonder where they learned to do that.
1227,He kept his tone light and casual but from.
1228,Their moving to Florida.
1229,I really like that show.
1230,A family good amount.
1231,That pleased me.
1232,We are good people.
1233,I've heard him talk about that for hours.
1234,Of course.
1235,It wasn't even funny.
1236,If only I could remember the name.
1237,I don't think the teachers are the problem.
1238,Public Relations.
1239,It's real easy to swing in there for breakfast.
1240,Then you find it again and lose it again.
1241,We've got four kids.
1242,My little girl likes blue more than pink.
1243,In May it will be five years since I met him.
1244,She used to love to do stuff like that.
1245,My wife and daughter were kidnapped.
1246,Sentence regards with his birth.
1247,It was his decision and you have to respect it.
1248,No I didn't go to the store.
1249,We will head to Florida for vacation.
1250,Take a stacks of books or small quiet toys.
1251,I would reconcile where I was buying it from.
1252,It was written at a third wine level.
1253,There do a lot of good concerns here.
1254,If it does the job.
1255,Do you like to drivel?
1256,The State and the City are concentrating its terror.
1257,I did prisoners write this conclusion.
1258,You don't need a personal one.
1259,The measure passed the House by a London vote.
1260,The site has a little bullet to read.
1261,Why is this such an occasional thing to do?
1262,Repeat the phrase an all.
1263,We have a dog to so not have to in.
1264,Take a seat on the match.
1265,My husband is really into moist to.
1266,I don't know if it's that serious.
1267,I'm going to visit Verity and Louisiana.
1268,Cars have come down in price significantly.
1269,When we bought it last year.
1270,I kind of wish that they had a little lick for the walls.
1271,And not is the best way to learn through.
1272,It's nice to have a bad dog.
1273,That's one good thing about having a cat though.
1274,The last people sighted leaving the city.
1275,He went over all that with his dancers.
1276,Actually it makes sense to a certain extent.
1277,doesn't seem like it so far.
1278,When was it?
1279,That's a science in itself.
1280,But it didn't get the upper part of my body.
1281,When you decide to make a stop.
1282,We seem to agree on that.
1283,Get the recipe from them.
1284,About three years ago.
1285,What shall we do?
1286,The immune system can slow down at first.
1287,I have two other sisters.
1288,I think it could affect the outcome.
1289,Some of the students are feeling the class.
1290,Now I remember it.
1291,I'm sure you will find something.
1292,About the same I dress for school.
1293,I mean it's doing around.
1294,It was a real special day.
1295,I guess I never heard the history of that.
1296,I wouldn't want them to be on drugs.
1297,The table across the street just moved in.
1298,A natural gas explosion.
1299,Decisions that are being made by world leaders.
1300,She was eleven the next day.
1301,I wouldn't say it's as bad as New York.
1302,He could get hurt.
1303,Some of them are our problems.
1304,Who would they ask for levitation?
1305,We all like my oldest brother.
1306,Did you see any of those?
1307,Don't you hate that?
1308,It would be nice if they could get them together.
1309,But do you think Bill Gates should resign?
1310,Evidently he was elected president.
1311,We met half way between here and there.
1312,I'm getting a got feeling here.
1313,Does it justify the cost?
1314,While it's healing take it easy.
1315,So that's not verbally extorted.
1316,Didn't mean to cut you off there.
1317,These guys just want attention.
1318,To really challenge them.
1319,It's actually the first car we ever bought new.
1320,Company Things Countries is usually the way to go.
1321,When I had my magazines at home.
1322,That's really funny but also disturbing.
1323,Is it easing those in all their.
1324,If you leave the keys ignition.
1325,The tune is She's Over the Hill Here.
1326,It is literally ridiculous.
1327,In other words there is joy to work.
1328,That does not seem planned for.
1329,This is overkill.
1330,Fill the jar to the top with boiling water.
1331,It was a point tense football game.
1332,Not to cycle.
1333,She is an player good luck this year.
