id,text
53,He said his been saying one more.
157,You look down at your.
164,They have.
165,I can't bither.
372,Dealer indigenous this to confirmation buyers.
381,The Hercules and Grable stack medals are headlines here.
393,Is it a novelty or a real kind of importance?
430,There are no more vehicle talkers straight at the map.
446,Once they have children over here.
494,Rectified vision able to see at night.
542,The small pup gnawed a hole in the sock.
586,Use a basal to rate the first trap.
587,He ran half way to the outerwear store.
590,Cars and busses stalled in snow drifts.
593,The dune rose from the edge of the water.
599,The lease run out in sixteen weeks.
708,I knew what the deal was in the past.
711,They gave variety of benefits to their employment.
1110,get arrested or what not.
1111,That decision is imparted early next week.
1191,So a budget all of his lines being spoken in that voice.
1312,I'm getting a got feeling here.
1335,I hope other thing works out up there.
1377,Whatever they dug you is a liar.
1404,Just funny miles north of here.
