id,text
0,You can see the code at this point as well.
1,How does it keep the cost down?
2,Not too controversial.
3,The jury and a judge work together on it.
4,Were quite vocal about it.
5,He said the decision to part ways was mutual.
6,In fact this morning when they were talking.
7,This is like a quarantine joke.
8,Has such a high clay content.
9,What working mastery?
10,Wait a minute we know this thing isn't.
11,Up in New England where I'm from.
12,One thing or the other.
13,He's one of the big proponents of that.
14,I have not gone back lately.
15,To me it's a treasure.
16,He is also a member of the Royal Iris Addendum.
17,I guess I like to take care of it.
18,Put that back in the saucepan!
19,He does the yard.
20,You just really can't tell what's going to happen.
21,And who is in charge of making that decision?
22,Not for the job I have now.
23,It's really not too difficult.
24,Collisions should never happen.
25,I'm trying to think.
26,Employee Control.
27,Bacon and All That Good Stuff!
28,If you look back.
29,And it also helps when they were wedding.
30,She came last June and watched a game in the sky dome.
31,For me I had no choice but to move.
32,Then it's twice as hard.
33,I can't really complain.
34,When I do recipes I just throw stuff in.
35,They recently released him.
36,One year public service for everybody.
37,It's an eighty seven degree day.
38,I don't know if they do it all over.
39,Employing Benefits.
40,How long are we supposed to talk for?
41,You start to take pleasure in it.
42,They had us fill out a long questionnaire.
43,We've had our way of life.
44,His side of the family.
45,Good to hear from you.
46,I don't know where the answer is.
47,Would you get the car?
48,And you paint around it.
49,Crime is too much.
50,House robberies.
51,The Grand Canyon.
52,The experience.
53,He said he's been seeing one more.
54,I can't really think of anything else offhand.
55,I couldn't even think of what you call them.
56,I grew up water skiing.
57,They waited a couple years.
58,I have a cold one.
59,There's not a whole lot.
60,There was no word on casualties.
61,It kind of wound down.
62,But my boss wouldn't pay for it.
63,My mother was complaining last year about that.
64,Very Scary to See What They Found Out!
65,Not too much soy sauce.
66,None of your business.
67,He put up all of his oak trees.
68,He didn't just say.
69,If there was a credible punishment.
70,I've been pretty successful with that.
71,In the previous version.
72,Was it third of December?
73,Invasion of Rommel.
74,I guess we don't really use that many tin cats.
75,We're a sit down together family.
76,I'm originally from Maine.
77,He had a hot pad.
78,Sometimes they're not very open.
79,Right now I'm getting about sixty bucks a month.
80,That kind of gas mileage.
81,He won't do that yet.
82,I mean it's dying now.
83,It was written many years ago.
84,Do you go buy the ads when you look at them?
85,Do you get cable?
86,And this gets back to capital punishment.
87,Here are some key points from the briefing.
88,Ninety seven cents a week.
89,I think the roles now are less defined.
90,We started taking her.
91,So thank you for not using the exploit.
92,Their condiments a little bit weak.
93,Employees will not get any severance pay.
94,I really feel bad for the people I see there.
95,Even in my case.
96,According to the Judicial System.
97,Afford the payments on a used car.
98,Couple of hundred kids in the band.
99,I found that really helps.
100,That sort of stuff.
101,I know we've had this one lady that was attacked.
102,We went to Colorado Springs.
103,Now it doesn't bother me at all.
104,Don't have enough money?
105,But I haven't told my husband.
106,I have some neighbours across the field.
107,Have some part of the law.
108,Once the children were grown.
109,Special to the Detroit Free Press.
110,I'm doing all right.
111,I guess it's close enough.
112,A good appearance to do a good job where you work.
113,People donate more money.
114,People put them in.
115,Every time I do something.
116,Is there a basis for it?
117,I think because it was less.
118,It's a wellness and all.
119,It's a heady eight.
120,Things are free enough.
121,At the time you hired on with this company.
122,For the things that we want.
123,Dreaming Season is open boys!
124,It's already done for you.
125,He had been in that position for years.
126,Outside the building it's not bad.
127,The Fifties Families and Things.
128,I don't want to do anything.
129,You know I don't know.
130,It's difficult to really say why.
131,There was a voice in her head.
132,Lawmakers passed a measure last year.
133,I'd be curious.
134,It's like a major production.
135,We ended up watching it for a couple of hours.
136,You live in?
137,Anything on that?
138,He's never gone away.
139,What will be a luxury in the future?
140,Fiction Books That I Really Like.
141,I was really working with the model.
142,You have to get everything replaced.
143,There would be no way to do it.
144,What is it called?
145,They do take up a lot of your time.
146,I'm still going.
147,What would you find if you just kept on going?
148,Helps them understand the.
149,I do study what's going on in the economy.
150,I like that they run.
151,Just like how you said my father was.
152,You're going to get.
153,Guided by Voices.
154,When was the last time we measured you?
155,I wouldn't him to win best actor on top of.
156,I heard this on a Christian program.
157,You look down at your.
158,The permit.
159,He's the most old.
160,It is like a country.
161,A male.
162,The islands sleep.
163,They are the Detroit.
164,They have.
165,I can't bither.
166,You just have to keep buying them.
167,In the new house everything is.
168,Easiest Way Out?
169,That will have some our.
170,What kind of things do you think can be done?
171,I try to make sure.
172,There are also this various.
173,Enjoy the holidays!
174,No easy choices.
175,Drunk drivers kill people.
176,On profession or befall and killed someone.
177,This brings me to the next point.
178,I don't think there is a conspiracy.
179,A million dollars a year.
180,Trump Trump's budget is just a propeller at this point.
181,We've had one as long as I can remember.
182,However there is one key point to keep in mind.
183,It's working up to a year now.
184,A house full of snow.
185,All those European countries.
186,All of those things that one does with kids.
187,That aren't getting taught at home.
188,That's what they said.
189,Last year of any one.
190,That's a big concern if you live there.
191,So the doctor elected to have her.
192,Did they mail that to you?
193,Tim would like to take on other genres.
194,Can't give up on it.
195,Through the newspaper reviews.
196,We should see to our own lives.
197,What have you seen?
198,What do you like to do this time of year?
199,She didn't announce that to you.
200,I never even knew that.
201,There was one other person besides myself.
202,You don't have to hide it either.
203,No you can't get all of us.
204,I think the movement.
205,That's understandable.
206,We see them at least once a week.
207,That was a shocker to me.
208,It came out I guess about a month.
209,I saw all seven games of that.
210,The decision was not even close.
211,We always seem to.
212,The House Payment.
213,Technical Decision.
214,That's what's happening here.
215,They have a lot of cattle in the area.
216,That's one of the biggest ones I've seen.
217,My name is Pat Johnson and I live in Texas.
218,They can if they want to.
219,A A Liberal Arts School.
220,In the Houston area?
221,What kind of puppy you got?
222,You actually had wanted it yourself.
223,Got into it when I was young.
224,It's depressing to?
225,They live with us.
226,He's just goofing off like he always has.
227,It's nothing like what it used to be.
228,We try to do one thing once a year.
229,You can come and go as you please.
230,You just call him direct.
231,Owning on them than making payments on them.
232,You can have a variety.
233,You have to fly through.
234,Just the regular.
235,He plays pretty regularly.
236,You don't feel super cold.
237,What are the problems with public education?
238,Oh well no point in wailing on the past.
239,You have to pay the interest.
240,I'm old fashioned.
241,It's just a matter of passing the law.
242,Utility Depart.
243,Not that she will remember them.
244,It didn't matter.
245,That's still not enough for a total.
246,I'm not saying that they were.
247,Pay and accession and you know.
248,All my aunts and uncles.
249,A restaurant that employs minorities.
250,It's just one story.
251,There was one point I was going to make.
252,I have more innocent when I injustices.
253,Probably seventy.
254,The card is yet to make its decision public.
255,He's not that old.
256,He's an indoor cat.
257,It's a nightmare.
258,That kind of threw them off.
259,I'm mostly the easy cooker.
260,It's not anything like Kansas.
261,We're within walking distance.
262,I don't care for that at all.
263,That's a previous generation.
264,I get great distance hitting it.
265,The kids like to go.
266,I got it right after high school.
267,Routine change in around.
268,There is some definite stock in her report.
269,As far as that goes.
270,Not in terms of North and South.
271,A few minutes ago.
272,He was a Tory.
273,Here in India we pay.
274,We didn't do it it very much.
275,It's not at all anything worth talking about.
276,They can pretty much get everybody there.
277,Have their bellies rubbed and everything.
278,Obvious down there.
279,Go over there.
280,Was this his entire family?
281,Is she going to stay home?
282,I look at homemaking as a job also.
283,My family's not very big.
284,They are tempting at times.
285,You'll have one or two that are good.
286,Put a Cramp in Your Viewing!
287,The signs are really taking over.
288,Governor The People of Detroit Don't Forget!
289,Seven or something like that.
290,Join the gang!
291,I have a standard.
292,I don't want any interactions.
293,And that's kind of the way I was raised.
294,I love all the winders that they have out now to.
295,You know I don't.
296,It'll go through the slot.
297,A fine profession.
298,All the money.
299,The thing that should be.
300,If you are convinced that it is the right choice.
301,Because that's probably clean.
302,Make Him Feel Like He Wasn't Wanted.
303,We decided to stay.
304,There just so suspenseful.
305,I don't like administration.
306,Did you have to do that?
307,I really enjoy that team.
308,I can't think of his name now.
309,In fact the first year we were married.
310,I've got a two year old.
311,That's what the different types are.
312,When I came back here.
313,Because she makes clothes.
314,I don't water them or anything.
315,I did well in school.
316,A prohibition of movies in Parliament called.
317,Just all different college.
318,Barbecues and Mexican food.
319,Congratulations on that!
320,Especially not in some of these big cities.
321,I have my own policy on freeloaders.
322,The Nursing Home.
323,Snuggle up to you!
324,I don't know if you've heard of her.
325,But bringing the party together will be easier said than done.
326,I have seen so many who know that God has not given us a spirit of fear.
327,I try to impress it.
328,We all know that unfortunately schools are not always the safest places.
329,No names have been reported in the city.
330,He has no criminal convictions.
331,Thank you for signing up!
332,This is the price paid for counting eggs rather than chicken ambiance.
333,Leslie grew up on a family farm where he still works.
334,We decided to ask them.
335,And everyone involved in the case bar the jury had been here before.
336,A dog is featured below the text.
337,Lo and behold they did not.
338,Hey so you need to put away the milk and cereal.
339,Everything Trump was to do threatens everything Trudeau was to do.
340,Peter was in bed when I walked into the bedroom.
341,How does she live with herself?
342,I'm not even disputing the results of the point.
343,And Oregon also had not turned north yet.
344,The two have since taken some steps sports a replacement.
345,But there have often been times when talking has been a problematic ally.
346,Check out the new sales items!
347,I just to start there and set it all up.
348,That's a good way to get started.
349,I was on trenches.
350,When you stop to think of it.
351,It could be used to hassle somebody.
352,America is losing it.
353,I don't know whether you did yours first.
354,The stinging cloud grass under the carpet.
355,I think the majority are in that.
356,The people I know are from there.
357,I haven't seen too many lately.
358,I've only seen him in funny stuff.
359,For a different section.
360,Their mother was sick at times.
361,Wilkinson had no regrets about her decision.
362,My three year old.
363,I really just started.
364,If you're on a trip or something.
365,She handles it pretty well.
366,We ran into some problems.
367,I just got the new issue.
368,You'll still see people.
369,To separate the news from the comment.
370,Like the old week winners?
371,I would work in the summer.
372,Taylor encouragement this to confirmation buyers.
373,We apologize but this video has failed to load.
374,Go Talk to Her in the Lobby I'll be right down.
375,This project has been a real team effort.
376,He can consistently score the damage you need to trial your hand into play.
377,This is heading powders revision.
378,Understanding the Mobile Classroom.
379,Trump has nominated William Barr as the next attorney general.
380,Buswell is a similar argument should be made for search engines.
381,The Hercules and Grable Stack medals are headlines here.
382,A visual comparison of various distances.
383,I could hear my accelerated breathing.
384,The news and stories that matter delivered Wednesday mornings.
385,Which Amiga Games impressed you in terms of gameplay or technical tricks?
386,Also at that time we were starting to hate each other a little bit.
387,Are either or both dogs decided dangerous under Davis County ordinance?
388,Started and difficulty calculations.
389,What is Beef Jerky anyway?
390,The quantity you chose isn't the quantity available.
391,But even at its most scientific the concept is simple.
392,Are they the same there?
393,Is it a novelty or a real kind of importance?
394,Water into this ball.
395,We just left it alone.
396,You can always hit it up again.
397,Trying to find someone at home?
398,Sort of like an exchange program.
399,I don't know how we could make it more fair.
400,Better than rubber.
401,To go out fishing in a boat.
402,About four hundred showed up.
403,We came from living in a condo for nine years.
404,They were pretty much in good tastes.
405,I never quite found a new york fan.
406,Before you realize anything is going on.
407,When I'm up here.
408,And that's what it falls under.
409,I never go to the fiction section.
410,Our sleeping bags I guess.
411,C things like that.
412,I don't get that.
413,We're going to have to do something.
414,I wasn't really.
415,We think it's good.
416,It is in agreement with its provisions.
417,I can really tell the difference.
418,The last book I read.
419,Almost like a dealing.
420,I think that could work as a toy.
421,I noticed those tags.
422,Those games are fun to watch.
423,Things of that nature which made us feel good.
424,What kind of dog do you have?
425,They are going to get a gun no matter what.
426,A little brief auto biography of themselves.
427,On occasion I can wear jeans.
428,The news was first reported by Deadline Hollywood.
429,Students do not like this response.
430,There are no more vehicle talkers straight at the map.
431,Where is the evidence that they possess consciences?
432,Nevertheless I role my house as I get up.
433,People will do immunity protects things for addition.
434,Several correspondents had their notebooks searched.
435,They said if emissions to start new cancer colleges.
436,You actually look forward to foxes or records raiding your garbage.
437,For example the face might be typically painted red black and white.
438,It was given to you the minute you cast your ballot.
439,Check out B Crescents and other online sites for deals.
440,sign up for our daily newsletter of the top stories in Korea wanting.
441,Such things are a violation of the U. N. Charter.
442,Never miss a moment.
443,He is not making any major changes for the rematch.
444,Worse is the implication of blame.
445,I didn't buy a get.
446,Once they have children over here.
447,My husband and all the men.
448,To ask Automakers for more jobs won't work.
449,I like just looking at the babies.
450,That's true of any sport.
451,I would not mind it.
452,I'm concerned.
453,The motivation isn't there for a lot of people.
454,So you enjoy gardening.
455,She wheeled it out on a cart.
456,That's for hearing me rap.
457,We're living longer and people are less trusting.
458,The choice is yours.
459,Take off and leave your group and go explore.
460,Are you recycling?
461,Healthy Vision.
462,They was just bad side effects.
463,I just bought a new house.
464,It's like we've lost our values in this country.
465,It is time we made that decision together.
466,So many of them nowadays.
467,Basically the guy comments.
468,So it's been real fun here to see.
469,Was born exercising but graceful.
470,Shop Storing Mathematics Developing Cancel.
471,One bothers unless persists meals.
472,This allowed mimic trap uses.
473,Casualty communism argue first receptacle school.
474,Supported according to Arrive Cross.
475,Making traditional used flat.
476,Scores Teams Dollars Concentration Wins commonly.
477,Pass unused idle accurate crop stick.
478,Get during sellers thing everyone.
479,Does nose owning by commitment?
480,Grandparents enjoyment through stage.
481,Elk diplomatic please reimbursed names.
482,First Terry Clips Done!
483,As is blooming coming opinion take.
484,Semesters place lean sales fertilizers dimension.
485,Grade Nucleus of Access Destroying.
486,Bonsai Meeting Just Manly?
487,Real telling serious understanding moral.
488,Differently produces common grade paint.
489,We're being basketball people.
490,It sounds like you have really strong views on it.
491,On Sunday the snow and ice came in.
492,But drastic times could call for drastic measures.
493,Either servants or investment.
494,Mystified Vision Able to See at Night?
495,Of course my job was such that I didn't.
496,Pleasant now have a new visual effect.
497,It's like a joke I heard once.
498,After we got married we moved.
499,Live without dessert for the most part.
500,I don't cook anymore.
501,A lot of people complain.
502,She just get on the first step and lay down.
503,It seems like you get it the worst.
504,They got real fat.
505,I mean just nothing.
506,Well my oldest was a year old.
507,So it was really too late to do much.
508,I'm kind of being a pessimist though.
509,Maybe they're counting on that.
510,Being able to have a choice.
511,We want to stay forever.
512,Of course they ate a lot of sea food.
513,It is estimated a total of three thousand properties were affected.
514,Not all men pay their employees less.
515,Also known as Wiley.
516,Will the game be priced differently during and after Early Access?
517,Then reboot the system.
518,The product I tried was their Mini Corn Dog which were superb.
519,Vancouver teacher faces disciplinary action for arresting gay student.
520,How to Avoid Being Tracked on the Internet?
521,He was that exceptional.
522,Details of this plot were reported two years ago.
523,We are absolutely as excited about this as you.
524,What other questions would you ask?
525,So what about the enemies of the Assad regime?
526,It's too valuable to just let people stay in story.
527,And if I'm so blessed by the gods I'll never have to kill again.
528,Your bonding and age won't be visible to other users.
529,Please give me a paramedic.
530,A man with a small kitchen is a ward of the government.
531,This week's pick is an acronym that can diagnose a drug.
532,Yet the president is not wrong to be exasperated and enraged.
533,The Birch canoe leaned on the spoons place.
534,Glue the sheet to the tank blue placard.
535,It's easy to tell the depth of a well.
536,These days a chicken like is a rare dish.
537,Rice is often served in round bowls.
538,The change of limits makes fine points.
539,The Box was thrown beside the parked truck.
540,The hands were fed chopped cord and carbon.
541,Four hours of steady work feeds us.
542,The small pup wore a hole in the sock.
543,The French questioned and turned on the bait hook.
544,Press the pants and sew a button on the vest.
545,The right time was far short of perfect.
546,The beauty of the view scared the young boy.
547,Two blue fish swim in the tank.
548,Her purse was full of useless trash.
549,The Cold Read and Through the Wall Rider.
550,It snowed rained and hailed the same morning.
551,Read First Out Loud for Pleasure.
552,What's the load to your left shoulder?
553,The vegetable garden.
554,It really helps those people.
555,I never really thought of it that way.
556,I don't know who looks forward to it more.
557,A wide variety.
558,We can't find a place that will take everything.
559,When they got in and speak.
560,There grown now.
561,It comes down to measuring.
562,Very suspenseful.
563,Is that pollution?
564,The Productivity and the Training Costs.
565,There always willing to help you out.
566,In the mountains.
567,The hair is always cool.
568,That's the way I feel.
569,What kind of running to you do?
570,I don't think it's quite as great.
571,How large is Williams?
572,I think we've got to do more with recycling.
573,I have many a time called him to come get me.
574,He worked hard at it.
575,The funding here bust through the code.
576,The Hurricane makes field to full the most.
577,Adding first leads to wrong sums.
578,The show was a flop from the very start.
579,A saw is a school used for making points.
580,The workers moved on well oiled wheels.
581,Watch the series past the next hill.
582,A cup of city makes sweet fun.
583,Place a ribbon near the porch steps.
584,Both lost their lives in the raging storm.
585,We talked of the side show in the circus.
586,Use a basal to rate the first trap.
587,He ran half way to the outerwear store.
588,The clock struck two by the third pairing.
589,A small creek cut around the field.
590,Cars and buses stalled in snow drifts.
591,The City of Kenner hit the floor with a rush.
592,This is a grand season for Hutch on the road.
593,The tune rose from the head of the water.
594,Those words were the cue for the actor to leave.
595,A yacht leaned around the point into the bay.
596,The two met while lying on the sand.
597,The Ink Stain Dried on the Finished Page.
598,The Walled Town was seized without a fight.
599,The lease run out in sixteen weeks.
600,It's just pocket change to a a lot of people.
601,They told me that this was the coming.
602,Are you involved in any other things?
603,The other thing to do.
604,They both compete together.
605,It got too cold up there.
606,So let's make some conclusions.
607,Trade Expertise and Everything Else.
608,I guess that's about it.
609,I don't think it's a good idea.
610,Especially for repeat offenders.
611,Since we've been married I've stopped going.
612,You don't want to or you don't have the time?
613,Others said they were disappointed.
614,Somebody's going to change it.
615,This is easy for me.
616,It's not as severe.
617,If you don't resent it.
618,Thank you for persistently.
619,Employers have also voiced concerned.
620,An apartment or a home?
621,Inside the Chill There.
622,What should be done to avoid all these problems?
623,They don't reason.
624,It's called revealing my life.
625,How are you doing?
626,Do you think this is right?
627,This is good isn't it?
628,I am also doing this.
629,I feel that we should help them.
630,What should we do now?
631,How are you?
632,Can you show me the way?
633,Many people will come here.
634,She got this from me.
635,This is really very good.
636,We have worked a lot on this.
637,I guess that is very good.
638,I will make it work.
639,I think we all do right?
640,I wasn't saying this at all.
641,I have to pay for four things.
642,Call me once you get here.
643,What part of this is hard?
644,There's always a way out of this.
645,He came by looking for you.
646,They are very mean I don't like it.
647,Is there anything to do for me?
648,What could you do in a few days?
649,Remember to let other people through first.
650,Show Me What You Have Got!
651,I can't believe this is true.
652,I used their water.
653,I like the last bit of this movie.
654,Be nice to each other.
655,I will stay with my family for a week.
656,I went back to get the kids.
657,Something seems off with her.
658,She gave me a new watch.
659,I like to enjoy my life in the country.
660,Do you still care about your job?
661,She lives in the house right next to me.
662,Are they both still around?
663,I get less time to be with children these days.
664,Years have gone by.
665,Can we use this for something?
666,What is the point of all this?
667,I can't think of a better time.
668,I hope to see you there!
669,We should at least try this out.
670,I would love to have more of these to.
671,It's great you could join us here.
672,Keep this with you for now.
673,Someone thought this show was very bad.
674,I don't like this either.
675,How far do we have to go?
676,Are you able to come with me next week?
677,Can you guess what's in this?
678,Will you be around next week?
679,What's different about this?
680,This house looks very big.
681,What's your point?
682,Some people are quite good at this.
683,What would you like to do first?
684,I would love to be a part of this.
685,Crime made turn couldn't morning somewhere.
686,Sports This companies are television.
687,Truck newspaper Yule report baby.
688,What choices couldn't thirty cards?
689,Avoid anymore when guys oil.
690,Many past decisions Dallas Future bring.
