id,text
500,i don't cook anymore
501,a lot of people complain
502,shit just get on the first stop and lay down
503,it seems like you get hit the worst
504,they got real fact
505,i mean just nothing
506,while my oldies was a year old
507,so it was really too late to do much
508,i'm tired of being a pessimist though
509,maybe they're counting on that
510,being able to have a choice
511,we want to stay forever
512,of course they ate a lot of sea food
513,it is extirpated a total of three thousand properties were affected
514,not all men pay their employees last
515,also known as wifey
516,where the game be prized differently during and after early access
517,then reboot the system
518,the product i tried was there many card dog's with were supposed
519,vancouver teacher vs discipline action for arresting gay student
520,how to avoid being tracked on the interment
521,he was that exceptional
522,details of this plant were reported to years ago
523,we are absolutely as excited about this as you
524,what other questions would you ask
525,so what about the enemies of the assigned regime
526,it's too valuable to just let people stay in story
527,and if i'm so placed by the cards i'll never have to kill again
528,your birthing and each won't be visible to other users
529,please give me a promoting
530,a man with a small pynchon is a warrant of the government
531,this week's pick is an accusation that can tickets a drug
532,that the president is not wrong to be exasperated and enraged
533,the birch canoe cleaned on the sooth place
534,looove the sheet to the dark blue programmed
535,it's easy to tell the depths of the will
536,these days a chicken like is a rare dish
537,rice is often served in round bowls
538,the choose of lemons makes fine punch
539,the box was thrown beside the part drug
540,the hands were find stopped cord and carbon
541,for hours of study work fiends us
542,the small pop cards a whole in the sock
543,the base question and turned on the bet hook
544,press the bets and so a button on the first
545,the one time was far short of perfect
546,the beauty of the view stunned the young boy
547,two blue fix swim in the take
548,her boss was full of useless trash
549,the colt reared and threw the ball rider
550,it snowed rend and hold the same morning
551,read this out loud for pleasure
552,hoists the load to your left shoulder
553,he vegetable garden
554,it really helps those people
555,i never relinquished of it that way
556,i don't know who looks forward to it more
557,a wide variety
558,we can't find a place that will take everything
559,when they got in and speak
560,they're grown now
561,it comes down to measuring
562,very suspenseful
563,is that pollution
564,the redeliver in the training costs
565,they're always really to help you out
566,in the mountains
567,the hair is always cool
568,that's the way i feel
569,what kind of running to you do
570,i don't think it's quite as green
571,how large is wilkens
572,i think we've got to do more with recycling
573,i have many a time called him to come get me
574,he worked hard at it
575,the fronting here best through the coat
576,the rugged makes filled too full the most
577,getting fast least two wrong sums
578,the show was a flipped from the very start
579,a saw is a school used for making points
580,the wanted mode on will hold wheels
581,much the sirens past the next he'll
582,he cup of sitter makes sweet fudge
583,place a response there the point seems
584,both lost their lives in the raging time
585,we talked of the side show in the circles
586,use a pencil to write the first tram
587,he ran him way to the airport store
588,the look shrunk to by the side betting
589,a small creek get across the field
590,cars and buses stalled in snow trips
591,the set of gender it the floor with a much
592,this is a grand season for hot on the run
593,the dean rose from the haste of the water
594,those words were the school for the after to leave
595,he got cleaned around the point into the big
596,the two met while playing on the sand
597,the eq sten tried on the widget page
598,the world town was seized without a fight
599,the least read out in sixteen weeks
