id,text
0,You can see the code at this point as well.
29,And it also helps when they were wedding.
58,I have a cold one.
87,Here are some key points from the briefing.
116,Is there a basis for it?
146,I'm still going.
175,Drunk drivers kill people.
204,I think the movement.
233,You have to fly through.
262,I don't care for that at all.
291,I have a standard.
320,Especially not in some of these big cities.
349,I was on trenches.
378,Understanding the Mobile Classroom.
407,When I'm up here.
437,For example the face might be typically painted red black and white.
466,So many of them nowadays.
495,Of course my job was such that I didn't.
524,What other questions would you ask?
553,The vegetable garden.
582,A cup of city makes sweet fun.
611,Since we've been married I've stopped going.
640,I wasn't saying this at all.
669,We should at least try this out.
698,You spend many necessarily move.
728,Please order our regular food for everyone.
757,Her friend will thank her for the card.
786,I tried a lot but this is still wrong.
815,You should vote for the future.
844,It all worked out quite well for our family.
873,If you haven't cleaned down.
902,My computer is not working anymore.
931,They will financially recover from the loan.
960,It would be fine just to one one.
989,You have a choice what store to buy.
1019,That is horrible.
1048,And a very good afternoon to you.
1077,If it's run by the individual state.
1106,I always wanted to go to school for nursing.
1135,On the other hand I am quite good.
1164,That's what I was about to say.
1193,The movie had a lot of nudity and curse words.
1222,Selling bottles of water?
1251,I would reconcile where I was buying it from.
1280,But it didn't get the upper part of my body.
1310,Evidently he was elected president.
1339,In other words there is a price to pay.
1368,If you need some more stuff.
1397,I think it's good that you see your cousins regularly.
